domain,concept,scales,description,color,name_catalog,indicator_url,name_short,concept_type,name,tags,drill_up,interpolation
,20120905_extreme_poverty_percent_people_below_125_a_day,"[""linear"", ""log""]",WDI 20120905 The percentage of people living on less than $1.25 (2005 purchasing power parity dollars).,,Extreme poverty ($1.25) v20120905,https://docs.google.com/spreadsheet/pub?key=0ArfEDsV3bBwCdDhjcXdjbURLMFFVcVFPYThhYmtvZXc,Extreme poverty,measure,Extreme poverty (% people below $1.25 a day) version 20120905,alternative_poverty_measures,,
,adults_with_hiv_percent_age_15_49,"[""log"", ""linear""]","The estimated percentage of adults aged 15 to 49 years that are infected by HIV, including those without symptoms, those sick from AIDS and those healthy due to treatment of the HIV infection",,"Adults with HIV (%, age 15-49)",https://docs.google.com/spreadsheet/pub?key=pyj6tScZqmEfbZyl0qjbiRQ,Adults with HIV,measure,"Adults with HIV (%, age 15-49)",hiv,,
,age_at_1st_marriage_women,"[""linear"", ""log""]","The mean age, in years, of first marriage for women. Women who never married are excluded. Cohabitation is excluded. The data are based on multple sources and definitions might vary.",,Age at 1st marriage (women),https://docs.google.com/spreadsheet/pub?key=t4eF8H_jq_xyKCUHAX6VT1g,Age at 1st marriage,measure,Age at 1st marriage (women),population,,
,aged_15_24_employment_rate_percent,"[""linear"", ""log""]","Percentage of total population, age group 15-24, that has been employed during the given year.",,Aged 15-24,https://docs.google.com/spreadsheet/pub?key=rfHz_nx27dDQo4dUoIeVT3A,Employment rate (%),measure,Aged 15-24 employment rate (%),employment_rate,,
,aged_15_24_unemployment_rate_percent,"[""linear"", ""log""]","Percentage of total population, age group 15-24, that has been registered as unemployed during the given year.",,Aged 15-24,https://docs.google.com/spreadsheet/pub?key=rb0oP4d1BREXa8xMIUf4NZg,Unemployment rate (%),measure,Aged 15-24 unemployment rate (%),unemployment,,
,aged_15_64_labour_force_participation_rate_percent,"[""linear"", ""log""]","For age group 15-64, percentage of all labour to total population.",,Aged 15-64,https://docs.google.com/spreadsheet/pub?key=rx1TECfEnGlnomonxCCO-Aw,Labour force participation rate (%),measure,Aged 15-64 labour force participation rate (%),labour_force_participation,,
,aged_15plus_employment_rate_percent,"[""linear"", ""log""]","Percentage of total population, age group 15+, that has been employed during the given year.",,Aged 15+,https://docs.google.com/spreadsheet/pub?key=rV0ksExNqh6V_h40f0_nFjg,Employment rate (%),measure,Aged 15+ employment rate (%),employment_rate,,
,aged_15plus_labour_force_participation_rate_percent,"[""linear"", ""log""]","For age group 15+, percentage of all labour to total population.",,Aged 15+,https://docs.google.com/spreadsheet/pub?key=ryyQX_1TXlohXWOSUswhIKg,Labour force participation rate (%),measure,Aged 15+ labour force participation rate (%),labour_force_participation,,
,aged_15plus_unemployment_rate_percent,"[""linear"", ""log""]","Percentage of total population, age group above 15, that has been registered as unemployed during the given year.",,Aged 15+,https://docs.google.com/spreadsheet/pub?key=rlD36wGmkwFt3ED558waCTQ,Unemployment rate (%),measure,Aged 15+ unemployment rate (%),unemployment,,
,aged_25_54_labour_force_participation_rate_percent,"[""linear"", ""log""]","For age group 25-54, percentage of all labour to total population.",,Aged 25-54,https://docs.google.com/spreadsheet/pub?key=rTrB-PY0sfM_gdAQ20XovfA,Labour force participation rate (%),measure,Aged 25-54 labour force participation rate (%),labour_force_participation,,
,aged_25_54_unemployment_rate_percent,"[""linear"", ""log""]","Percentage of total population, age group 25-54, that has been registered as unemployed during the given year.",,Aged 25-54,https://docs.google.com/spreadsheet/pub?key=rEMA-cbNPaOtpDyxTcwugnw,Unemployment rate (%),measure,Aged 25-54 unemployment rate (%),unemployment,,
,aged_55plus_unemployment_rate_percent,"[""linear"", ""log""]","Percentage of total population, age group above 55, that has been registered as unemployed during the given year.",,Aged 55+,https://docs.google.com/spreadsheet/pub?key=rNn0y3e0bCpaqTM_8BVZBdg,Unemployment rate (%),measure,Aged 55+ unemployment rate (%),unemployment,,
,aged_65plus_labour_force_participation_rate_percent,"[""linear"", ""log""]","For age group 65+, percentage of all labour to total population.",,Aged 65+,https://docs.google.com/spreadsheet/pub?key=r1hlZB_n1rpXTij11Kw7lTQ,Labour force participation rate (%),measure,Aged 65+ labour force participation rate (%),labour_force_participation,,
,agricultural_land_percent_of_land_area,"[""linear"", ""log""]","Agricultural land refers to the share of land area that is arable, under permanent crops, and under permanent pastures. Arable land includes land defined by the FAO as land under temporary crops (double-cropped areas are counted once), temporary meadows for mowing or for pasture, land under market or kitchen gardens, and land temporarily fallow. Land abandoned as a result of shifting cultivation is excluded. Land under permanent crops is land cultivated with crops that occupy the land for long periods and need not be replanted after each harvest, such as cocoa, coffee, and rubber. This category includes land under flowering shrubs, fruit trees, nut trees, and vines, but excludes land under trees grown for wood or timber. Permanent pasture is land used for five or more years for forage, including natural and cultivated crops.",,Agricultural land,https://docs.google.com/spreadsheet/pub?key=0AkBd6lyS3EmpdEF3alRGS0JQZVgwSW1FWUxUQmZoWXc,Agricultural land,measure,Agricultural land (% of land area),geography,,
,agricultural_water_withdrawal_percent_of_total,"[""linear"", ""log""]","Percentage of the total water withdrawal used in agriculture, including renewable freshwater resources as well as potential over-abstraction of renewable groundwater or withdrawal of fossil groundwater, use of agricultural drainage water, desalinated water and treated wastewater. It also includes water withdrawn for irrigation purposes and for livestock watering, although depending on the country this last category sometimes is included in municipal water withdrawal. As far as the water withdrawn for irrigation is concerned, the value far exceeds the consumptive use of irrigation because of water lost in its distribution from its source to the crops.",,Agricultural water withdrawal,https://docs.google.com/spreadsheet/pub?key=rab3jHe_JZrU1pqlX0xnQEw,Agricultural water withdrawal,measure,Agricultural water withdrawal (% of total),environment_water,,
,agriculture_percent_of_gdp,"[""linear"", ""log""]","Agriculture corresponds to ISIC divisions 1-5 and includes forestry, hunting, and fishing, as well as cultivation of crops and livestock production. Value added is the net output of a sector after adding up all outputs and subtracting intermediate inputs. It is calculated without making deductions for depreciation of fabricated assets or depletion and degradation of natural resources. The origin of value added is determined by the International Standard Industrial Classification (ISIC), revision 3. Note: For VAB countries, gross value added at factor cost is used as the denominator.",,Agriculture,https://docs.google.com/spreadsheet/pub?key=0AkBd6lyS3EmpdFhPbDdCTTYxM1dGc21UdE9sSkp1WEE,Agriculture,measure,Agriculture (% of GDP),sectors,,
,agriculture_workers_percent_of_labour_force,"[""linear"", ""log""]",Percentage of all labour force that works in agriculture sector.,,Agriculture workers,https://docs.google.com/spreadsheet/pub?key=rzFD5mOuB5mR7-vLoP04LAQ,Agriculture workers,measure,Agriculture workers (% of labour force),employment_by_sector,,
,aid_given_2007_us,"[""linear"", ""log""]","Total amount of allocable aid for official development assistance (ODA) given by the donor countries, expressed in constant 2007 US$.",,Aid given,https://docs.google.com/spreadsheet/pub?key=tFOn62dEO9QCyIKK6kgSYRQ,Aid given,measure,Aid given (2007 US$),aid_given,,
,aid_given_per_person_2007_us,"[""linear"", ""log""]",Total amount of official development assistance (ODA) aid that has been given during this year divided by the population of the country (2007 US$),,Aid given per person,https://docs.google.com/spreadsheet/pub?key=tGTst0WEm8V8zI9LOYvGmTg,Aid given per person,measure,Aid given per person (2007 US$),aid_given,,
,aid_given_percent_of_gni,"[""linear"", ""log""]",Percentage of the gross national income (GNI) of each recepient country that has been given as official development assistance (ODA) aid during this year.,,Aid given (% of GNI),https://docs.google.com/spreadsheet/pub?key=tQR7RhlZdPjBkVCDPPF4zUg,Aid given (% of GNI),measure,Aid given (% of GNI),aid_given,,
,aid_received_per_person_current_us,"[""log"", ""linear""]","Net official development assistance (ODA) per capita consists of disbursements of loans made on concessional terms (net of repayments of principal) and grants by official agencies of the members of the Development Assistance Committee (DAC), by multilateral institutions, and by non-DAC countries to promote economic development and welfare in countries and territories in the DAC list of ODA recipients; and is calculated by dividing net ODA received by the midyear population estimate. It includes loans with a grant element of at least 25 percent (calculated at a rate of discount of 10 percent).",,Aid received per person,https://docs.google.com/spreadsheet/pub?key=t9GL1nIZdtxszJbjKErN2Hg,Aid received per person,measure,Aid received per person (current US$),aid_received,,
,aid_received_percent_of_gni,"[""linear"", ""log""]","Net official development assistance (ODA) consists of disbursements of loans made on concessional terms (net of repayments of principal) and grants by official agencies of the members of the Development Assistance Committee (DAC), by multilateral institutions, and by non-DAC countries to promote economic development and welfare in countries and territories in the DAC list of ODA recipients. It includes loans with a grant element of at least 25 percent (calculated at a rate of discount of 10 percent).",,Aid received (% of GNI),https://docs.google.com/spreadsheet/pub?key=tzK6dx2JltRfVXFI1ADh84w,Aid received (% of GNI),measure,Aid received (% of GNI),aid_received,,
,aid_received_total_us_inflation_adjusted,"[""linear"", ""log""]","Net official development assistance (ODA) consists of disbursements of loans made on concessional terms (net of repayments of principal) and grants by official agencies of the members of the Development Assistance Committee (DAC), by multilateral institutions, and by non-DAC countries to promote economic development and welfare in countries and territories in the DAC list of ODA recipients. It includes loans with a grant element of at least 25 percent (calculated at a rate of discount of 10 percent). Data are in constant 2014 U.S. dollars.",,"Aid received, total",https://docs.google.com/spreadsheet/pub?key=0AkBd6lyS3EmpdHVuNVpKdnNCa08yV3NOd0Zsal9JaWc,"Aid received, total",measure,"Aid received, total (US$, inflation-adjusted)",aid_received,,
,alcohol_consumption_per_adult_15plus_litres,"[""linear"", ""log""]","Recorded plus estimated alcohol consumption, average adult (15+) per capita consumption in litres",,Alcohol consumption,https://docs.google.com/spreadsheet/pub?key=0AgogXXPMARyldGJqTDRfNHBWODJMRWlZaVhNclhNZXc,Alcohol consumption,measure,Alcohol consumption per adult 15+ (litres),risk_factors,,
,all_causes_deaths_in_children_1_59_months_per_1000_births,"[""log"", ""linear""]","All causes deaths in children 1-59 months (per 1,000 births)",,All causes ‰ births,https://docs.google.com/spreadsheet/pub?key=t9FP3_OPrE2ug_I_iNsbePg,All causes deaths in children,measure,All causes deaths in children 1-59 months (per 1000 births),causes_of_child_deaths,,
,all_causes_deaths_in_children_1_59_months_total_deaths,"[""log"", ""linear""]",All causes deaths in children 1-59 months (total deaths),,All causes (total deaths),https://docs.google.com/spreadsheet/pub?key=taYeez4Mkk8OvdH-q4QAxxQ,All causes deaths in children,measure,All causes deaths in children 1-59 months (total deaths),causes_of_child_deaths,,
,all_causes_deaths_in_newborn_per_1000_births,"[""log"", ""linear""]","All causes deaths in newborn (per 1,000 births)",,All causes ‰ births,https://docs.google.com/spreadsheet/pub?key=tbpc_fYEqPzaE7pDWBG84Rw,All causes deaths in newborn,measure,All causes deaths in newborn (per 1000 births),causes_of_newborn_deaths,,
,all_causes_deaths_in_newborn_total_deaths,"[""log"", ""linear""]",All causes deaths in newborn (total deaths),,All causes (total deaths),https://docs.google.com/spreadsheet/pub?key=tBVcAKWEbc2s687q6D9yuYg,All causes deaths in newborn,measure,All causes deaths in newborn (total deaths),causes_of_newborn_deaths,,
,all_forms_of_tb_deaths_per_100000_estimated,"[""linear"", ""log""]","Estimated number of deaths caused by TB (all forms) among 100,000 residents during the given year.",,"TB deaths /100k, est., all forms",https://docs.google.com/spreadsheet/pub?key=rWM9yEzjpGJvcJlUAIm35tA,TB deaths per 100 000,measure,"TB deaths per 100 000, estimated, all forms of TB",tb_tuberculosis,,
,all_forms_of_tb_detection_rate_percent,"[""linear"", ""log""]",The proportion of estimated new cases of TB detected (diagnosed and then notified to WHO) by health facilities in the country during the given year.,,"TB detection rate, all forms",https://docs.google.com/spreadsheet/pub?key=ru195-zJ0rsx5axPIvm_bRA,TB detection rate,measure,"TB detection rate, all forms of TB (%)",tb_tuberculosis,,
,all_forms_of_tb_detection_rate_percent_dots_only,"[""linear"", ""log""]","The proportion of estimated new cases of TB detected (diagnosed and then notified to WHO) during the given year by DOTS programme, which is national TB programmes in finding and diagnosing people with TB.",,"TB detection rate, all forms, DOTS",https://docs.google.com/spreadsheet/pub?key=rutVwqgB14uRV_f2dRbqhUA,TB detection rate,measure,"TB detection rate, all forms of TB (%) - DOTS only",tb_tuberculosis,,
,all_forms_of_tb_existing_cases_per_100000_estimated,"[""linear"", ""log""]","Estimated number of existing TB cases (all forms) among 100,000 residents during the given year.",,"TB existing cases /100k, est. all forms",https://docs.google.com/spreadsheet/pub?key=rZNoyaocUmUGuFyRgjJUpig,TB existing cases per 100 000,measure,"TB existing cases per 100 000, estimated, all forms of TB",tb_tuberculosis,,
,all_forms_of_tb_new_cases_per_100000_estimated,"[""linear"", ""log""]","Estimated number of new TB cases (all forms) among 100,000 residents during the given year.",,"TB new cases /100k, est. all forms",https://docs.google.com/spreadsheet/pub?key=rMsQHawTObBb6_U2ESjKXYw,TB new cases per 100 000,measure,"TB new cases per 100 000, estimated, all forms of TB",tb_tuberculosis,,
,all_forms_of_tb_new_cases_per_100000_reported,"[""linear"", ""log""]","Reported number of new and relapsed TB cases (all forms) among 100,000 residents during the given year.",,"TB new cases /100k, reported, all forms",https://docs.google.com/spreadsheet/pub?key=rYICvtvVz28fVyQuG_ote2w,TB new cases per 100 000,measure,"TB new cases per 100 000, reported, all forms of TB",tb_tuberculosis,,
,all_forms_of_tb_number_of_deaths_estimated,"[""log"", ""linear""]",Estimated number of deaths caused by TB (all forms) during the given year.,,"TB deaths, est., all forms",https://docs.google.com/spreadsheet/pub?key=rrQ_y5fqQPlznp5mJGXWr-A,TB deaths,measure,"TB deaths, estimated, all forms of TB",tb_tuberculosis,,
,all_forms_of_tb_number_of_existing_cases_estimated,"[""log"", ""linear""]",Estimated number of existing TB cases (all forms) during the given year.,,"TB existing cases, est., all forms",https://docs.google.com/spreadsheet/pub?key=rOCGMcGcrZs-dfeTEC792ZQ,TB existing cases,measure,"TB existing cases, estimated, all forms of TB",tb_tuberculosis,,
,all_forms_of_tb_number_of_new_cases_estimated,"[""log"", ""linear""]",Estimated number of new TB cases (all forms) during the given year.,,"TB new cases, est., all forms",https://docs.google.com/spreadsheet/pub?key=rhZayTbvH3ZLlSN64OuRYFg,TB new cases,measure,"TB new cases, estimated, all forms of TB",tb_tuberculosis,,
,all_forms_of_tb_number_of_new_cases_reported,"[""log"", ""linear""]",Reported number of new and relapsed TB cases (all forms) during the given year.,,"TB new cases, reported, all forms",https://docs.google.com/spreadsheet/pub?key=r5UikGjnZlemlelKY0NX9Pg,TB new cases,measure,"TB new cases, reported, all forms of TB",tb_tuberculosis,,
,alt_5,,,,,,,string,ALT 5,_none,,
,alternative_1,,,,,,,string,Alternative 1,_none,,
,alternative_2,,,,,,,string,Alternative 2,_none,,
,alternative_3,,,,,,,string,Alternative 3,_none,,
,alternative_4_cdiac,,,,,,,string,Alternative 4 (CDIAC),_none,,
,alternative_gdp_per_capita_ppp_pwt_7_1,"[""linear"", ""log""]","GDP per capita PPP, in 2005 i$ from PWT 7.1",,"GDP/cap PPP, PWT 7.1",https://docs.google.com/spreadsheet/pub?key=0ArtujvvFrPjVdEhhbV90QlJ3RFM0TW83dHd6RXBiX3c,GDP per capita PPP,measure,"Alternative GDP per capita PPP, PWT 7.1",alternative_gdp_data,,
,alternative_gdp_per_capita_ppp_pwt_8_0,"[""linear"", ""log""]","GDP per capita PPP, in 2005 i$ from PWT 8.0 (based on rgdpe)",,"GDP/cap PPP, PWT 8.0",https://docs.google.com/spreadsheet/pub?key=0ArfEDsV3bBwCdGhmWXFMY0hNcDFiTEt3ZVE4b21wRlE,GDP per capita PPP,measure,"Alternative GDP per capita PPP, PWT 8.0",alternative_gdp_data,,
,alternative_gdp_per_capita_ppp_wb,"[""linear"", ""log""]",GDP per capita based on purchasing power parity (PPP). PPP GDP is gross domestic product converted to international dollars using purchasing power parity rates. An international dollar has the same purchasing power over GDP as the U.S. dollar has in the United States. GDP at purchaser's prices is the sum of gross value added by all resident producers in the economy plus any product taxes and minus any subsidies not included in the value of the products. It is calculated without making deductions for depreciation of fabricated assets or for depletion and degradation of natural resources. Data are in constant 2011 international dollars.,,"GDP per capita PPP, WB",https://docs.google.com/spreadsheet/pub?key=0ArtujvvFrPjVdERlTHZFQ2ZaUkpySHpQMF82UmdlcUE,GDP per capita PPP,measure,"Alternative GDP per capita PPP, WB",alternative_gdp_data,,
,alternative_gdppercapita_ppp_inflation_adjusted_from_pwt,"[""log"", ""linear""]","Expressed in international $ (PPP) and adjusted for inflation (in 2000 prices). The indicator measures the same thing as ""income per person"", but the source is different: Penn World Tables 6.2.",,"GDP/cap PPP, PWT infl-adjusted",https://docs.google.com/spreadsheet/pub?key=tSUr_yZVbM6a3AGJEq_Z2Pw,GDP per capita PPP,measure,"Alternative GDP per capita PPP, from PWT (inflation-adjusted)",alternative_gdp_data,,
,alternative_poverty_percent_below_nationally_defined_poverty,"[""linear"", ""log""]",National poverty headcount ratio is the percentage of the population living below the national poverty lines. National estimates are based on population-weighted subgroup estimates from household surveys.,,Relative poverty,https://docs.google.com/spreadsheet/pub?key=pyj6tScZqmEd1R9UmohEIaA,Relative poverty,measure,Relative poverty (% below nationally defined poverty line),alternative_poverty_measures,,
,annual_hiv_deaths_number_all_ages,"[""linear"", ""log""]",The total number of people that were estimated as died from HIV/AIDS during the given year.,,Annual HIV deaths,https://docs.google.com/spreadsheet/pub?key=0ArfEDsV3bBwCdHZJdFBhYVlvck43d1R6ZFYzUWpiLWc,Annual HIV deaths,measure,"Annual HIV deaths (number, all ages)",hiv,,
,arb1,,,,,,,string,arb1,_none,,
,arb2,,,,,,,string,arb2,_none,,
,arb3,,,,,,,string,arb3,_none,,
,arb4,,,,,,,string,arb4,_none,,
,arb5,,,,,,,string,arb5,_none,,
,arb6,,,,,,,string,arb6,_none,,
,armed_forces_personnel_percent_of_labor_force,"[""linear"", ""log""]","Armed forces personnel are active duty military personnel, including paramilitary forces if the training, organization, equipment, and control suggest they may be used to support or replace regular military forces. Labor force comprises all people who meet the International Labour Organization's definition of the economically active population.",,Armed forces personnel,https://docs.google.com/spreadsheet/pub?key=0Asm_G8nr4TCSdFFoVWRjcUdKZDFydGdGNXkzS2ZRbHc,Armed forces personnel,measure,Armed forces personnel (% of labor force),war_peace,,
,armed_forces_personnel_total,"[""linear"", ""log""]","Armed forces personnel are active duty military personnel, including paramilitary forces if the training, organization, equipment, and control suggest they may be used to support or replace regular military forces.",,Armed forces personnel,https://docs.google.com/spreadsheet/pub?key=0Asm_G8nr4TCSdG1nNjk5RzItcUp6N2dSdHUwOENXa0E,Armed forces personnel,measure,"Armed forces personnel, total",war_peace,,
,arms_exports_us_inflation_adjusted,"[""linear"", ""log""]","Arms transfers cover the supply of military weapons through sales, aid, gifts, and those made through manufacturing licenses. Data cover major conventional weapons such as aircraft, armored vehicles, artillery, radar systems, missiles, and ships designed for military use. Excluded are transfers of other military equipment such as small arms and light weapons, trucks, small artillery, ammunition, support equipment, technology transfers, and other services. Figures are SIPRI Trend Indicator Values (TIVs) expressed in US$ m. at constant (1990) prices.  A '0' indicates that the value of deliveries is less than US$0.5m",,Arms exports,https://docs.google.com/spreadsheet/pub?key=0AkBd6lyS3EmpdGpkU3BSVmw5UXhTMWd6UFc1eXI3Rnc,Arms exports,measure,"Arms exports (US$, inflation-adjusted)",debt_trade,,
,arms_imports_us_inflation_adjusted,"[""linear"", ""log""]","Arms transfers cover the supply of military weapons through sales, aid, gifts, and those made through manufacturing licenses. Data cover major conventional weapons such as aircraft, armored vehicles, artillery, radar systems, missiles, and ships designed for military use. Excluded are transfers of other military equipment such as small arms and light weapons, trucks, small artillery, ammunition, support equipment, technology transfers, and other services. Figures are SIPRI Trend Indicator Values (TIVs) expressed in US$ m. at constant (1990) prices. A '0' indicates that the value of deliveries is less than US$0.5m.",,Arms imports,https://docs.google.com/spreadsheet/pub?key=0AkBd6lyS3EmpdEljeENrOXlFXzR3Rm8xT0drTV9YclE,Arms imports,measure,"Arms imports (US$, inflation adjusted)",debt_trade,,
,art_coverage_percent_cd4_l_350,"[""linear"", ""log""]","For people who have been diagnosed as CD4 count < 350 / mm3, how many (%) have access to ART treatment, estimation.",,ART coverage,https://docs.google.com/spreadsheet/pub?key=0ArfEDsV3bBwCdHMzRDA5Z1RjWkJIWkNfdWNBVFR6b1E,ART coverage,measure,ART coverage % (CD4 < 350),hiv,,
,average_age_of_dollar_billionaires_years,"[""linear"", ""log""]","The average age of billionaires in the country of their citizenship, calculation based on data from Forbes.com",,Average age of dollar billionaires,https://docs.google.com/spreadsheet/pub?key=t_KhYe1qTGh4c90N61AUDSg,Average age of dollar billionaires,measure,Average age of dollar billionaires (years),poverty_inequality,,
,bad_teeth_per_child_12_yr,"[""linear"", ""log""]","The weighted average of the number of Decayed, Missing or Filled teeth among the 12 years old in a country (DMFT). It is meant to reflect the prevalence of caries in a population.",,Bad teeth per child,https://docs.google.com/spreadsheet/pub?key=phAwcNAVuyj3Os9LVO_pRDA,Bad teeth per child,measure,Bad teeth per child (12 yr),teeth,,
,battle_deaths_per_100_000,"[""linear"", ""log""]","Battle deaths, age-adjusted mortality per 100 000 standard population.",,Battle deaths,https://docs.google.com/spreadsheet/pub?key=0AgogXXPMARyldElMWEl4RFVTemlMbzJqRU50ZDJ3SHc,Battle deaths,measure,Battle deaths (per 100 000),war_peace,,
,biomass_stock_in_forest_tons,"[""log"", ""linear""]","Biomass stock refers to organic material both above-ground and below-ground, and both living and dead, e.g., trees, crops, grasses, tree litter, roots etc.; including the pool definition for above- and below-ground biomass in forest; other wooded land not included.",,Biomass stock in forest,https://docs.google.com/spreadsheet/pub?key=pp59adS3CHWcsSl830EklJA,Biomass stock in forest,measure,Biomass stock in forest (tons),forestry,,
,birth_asphyxia_deaths_in_newborn_per_1000_births,"[""log"", ""linear""]","Birth asphyxia deaths in newborn (per 1,000 births)",,Birth asphyxia ‰ births,https://docs.google.com/spreadsheet/pub?key=t_0WcTuc94YT9cJVvy1tmUg,Birth asphyxia deaths in newborn,measure,Birth asphyxia deaths in newborn (per 1000 births),causes_of_newborn_deaths,,
,birth_asphyxia_deaths_in_newborn_total_deaths,"[""log"", ""linear""]",Birth asphyxia deaths in newborn (total deaths),,Birth asphyxia (total deaths),https://docs.google.com/spreadsheet/pub?key=twrll6eL8GeIU4P71aTakmg,Birth asphyxia deaths in newborn,measure,Birth asphyxia deaths in newborn (total deaths),causes_of_newborn_deaths,,
,births_attended_by_skilled_health_staff_percent_of_total,"[""linear"", ""log""]","Births attended by skilled health staff are the percentage of deliveries attended by personnel trained to give the necessary supervision, care, and advice to women during pregnancy, labor, and the postpartum period; to conduct deliveries on their own; and to care for newborns.",,Births attended by skilled health staff,https://docs.google.com/spreadsheet/pub?key=0AkBd6lyS3EmpdF9OQ2dSSG5nNFhpS3RnRVZHUzZMb3c,Births attended by skilled health staff,measure,Births attended by skilled health staff (% of total),maternal_health,,
