name,concept_type,domain,indicator_url,color,scales,drill_up,unit,interpolation,description,tags,availability
Body Mass Index women,measure,"[18.47, 35.02]",https://spreadsheets.google.com/pub?key=0ArfEDsV3bBwCdGt0elo2dzJMVVQ3WmFGSmdhc09LRlE,,"[""linear"", ""log""]",,"(BMI), Kg/m2",,"The mean BMI (Body Mass Index) of the female population, counted in kilogram per square meter; this mean is calculated as if each country has the same age composition as the world population.",risk_factors,"[1980, 2008]"
Blood pressure men,measure,"[118.5, 143.1]",https://spreadsheets.google.com/pub?key=0ArfEDsV3bBwCdHNwRm9DN1FnT3hXWWZVSncxMkZyS2c,,"[""linear"", ""log""]",,"(SBP), mmHg",,"The mean SBP (Systolic Blood Pressure) of the male population, counted in mm-Hg; this mean is calculated as if each country has the same age composition as the world population.",risk_factors,"[1980, 2008]"
Blood pressure women,measure,"[110.3, 139.5]",https://spreadsheets.google.com/pub?key=0ArfEDsV3bBwCdHBzUVVSMDlTX1ZCUnNJQ3ZFdkFXVFE,,"[""linear"", ""log""]",,"(SBP), mmHg",,"The mean SBP (Systolic Blood Pressure) of the female population, counted in mm-Hg; this mean is calculated as if each country has the same age composition as the world population.",risk_factors,"[1980, 2008]"
Cholesterol men,measure,"[3.728, 6.242999999999999]",https://spreadsheets.google.com/pub?key=0ArfEDsV3bBwCdDU5SnRoQ0xlZWhwRUZ6RFNQV042enc,,"[""linear"", ""log""]",,"fat in blood, mmol/L",,"The mean TC (Total Cholesterol) of the male population, counted in mmol per L; this mean is calculated as if each country has the same age composition as the world population.",risk_factors,"[1980, 2008]"
Cholesterol women,measure,"[3.9739999999999998, 6.2]",https://spreadsheets.google.com/pub?key=0ArfEDsV3bBwCdGJHcHZkSUdBcU56aS1OT3lLeU4tRHc,,"[""linear"", ""log""]",,"fat in blood, mmol/L",,"The mean TC (Total Cholesterol) of the female population, counted in mmol per L; this mean is calculated as if each country has the same age composition as the world population.",risk_factors,"[1980, 2008]"
"Infectious TB, est. new cases share",measure,"[0.0, 443.0]",http://spreadsheets.google.com/pub?key=rVyfxaPK4dJ9B6ZdgG34F-g,,"[""linear"", ""log""]",,per 100 000,,"Estimated number of new TB cases (infectious) among 100,000 residents during the given year.",tb_tuberculosis,"[1990, 2007]"
"Infectious TB, reported new cases share",measure,"[0.0, 287.0]",http://spreadsheets.google.com/pub?key=r0pD5wznwEUJ0ipdxAWQjiA,,"[""linear"", ""log""]",,per 100 000,,"Reported number of new TB cases (infectious) among 100,000 residents during the given year.",tb_tuberculosis,"[1990, 2007]"
"Infectious TB, est. new cases total",measure,"[0.0, 872500.0]",http://spreadsheets.google.com/pub?key=rOPfJcbTTIyS-vxDWbkfNLA,,"[""log"", ""linear""]",,,,Estimated number of new TB cases (infectious) during the given year.,tb_tuberculosis,"[1990, 2007]"
"Infectious TB, reported new cases, total",measure,"[0.0, 592600.0]",http://spreadsheets.google.com/pub?key=rcbx0R-TXbkqRCyvKzn08fg,,"[""log"", ""linear""]",,,,Reported number of new TB cases (infectious) during the given year.,tb_tuberculosis,"[1990, 2007]"
"Infectious TB, detection rate",measure,"[0.0, 239.0]",http://spreadsheets.google.com/pub?key=rDb6EYc4YUTBRfXlBvjHYlg,,"[""linear"", ""log""]",,%,,The proportion of estimated new smear-positive cases of TB detected (diagnosed and then notified to WHO) by health facilities in the country during the given year.,tb_tuberculosis,"[1990, 2007]"
"Infectious TB, detection rate - DOTS only",measure,"[0.0, 196.0]",http://spreadsheets.google.com/pub?key=rjGHot8B6YSt3kPYEG8nANA,,"[""linear"", ""log""]",,%,,"The proportion of estimated new smear-positive cases of TB detected (diagnosed and then notified to WHO) during the given year by DOTS programme, which is national TB programmes in finding and diagnosing people with TB.",tb_tuberculosis,"[1995, 2007]"
"Infectious TB, treatments",measure,"[0.0, 100.0]",http://spreadsheets.google.com/pub?key=rewICFMTvBuer8UoJIK0yUg,,"[""linear"", ""log""]",,(DOTS) completed %,,Percentage of all patients with infectious TB detected by DOTS programme that have finished the treatment during the given year.,tb_tuberculosis,"[1994, 2006]"
TB programme coverage,measure,"[0.0, 100.0]",http://spreadsheets.google.com/pub?key=rKfjGaPxqirPDe8gnTVKuIw,,"[""linear"", ""log""]",,(DOTS) % of population,,"Percentage of total population that has been covered by DOTS programme, which is national TB programmes in finding and diagnosing people with TB.",tb_tuberculosis,"[1995, 2007]"
"All forms TB, est. new cases share",measure,"[0.0, 1198.0]",http://spreadsheets.google.com/pub?key=rMsQHawTObBb6_U2ESjKXYw,,"[""linear"", ""log""]",,per 100 000,,"Estimated number of new TB cases (all forms) among 100,000 residents during the given year.",tb_tuberculosis,"[1990, 2007]"
"All forms TB, est. existing cases share",measure,"[0.0, 1485.0]",http://spreadsheets.google.com/pub?key=rZNoyaocUmUGuFyRgjJUpig,,"[""linear"", ""log""]",,per 100 000,,"Estimated number of existing TB cases (all forms) among 100,000 residents during the given year.",tb_tuberculosis,"[1990, 2007]"
"All forms TB, est. deaths share",measure,"[0.0, 415.0]",http://spreadsheets.google.com/pub?key=rWM9yEzjpGJvcJlUAIm35tA,,"[""linear"", ""log""]",,per 100 000,,"Estimated number of deaths caused by TB (all forms) among 100,000 residents during the given year.",tb_tuberculosis,"[1990, 2007]"
"All forms TB, reported new cases share",measure,"[0.0, 779.0]",http://spreadsheets.google.com/pub?key=rYICvtvVz28fVyQuG_ote2w,,"[""linear"", ""log""]",,per 100 000,,"Reported number of new and relapsed TB cases (all forms) among 100,000 residents during the given year.",tb_tuberculosis,"[1980, 2007]"
"All forms TB, est. new cases total",measure,"[0.0, 1962000.0]",http://spreadsheets.google.com/pub?key=rhZayTbvH3ZLlSN64OuRYFg,,"[""log"", ""linear""]",,,,Estimated number of new TB cases (all forms) during the given year.,tb_tuberculosis,"[1990, 2007]"
"All forms TB, est. existing cases total",measure,"[0.0, 5088000.0]",http://spreadsheets.google.com/pub?key=rOCGMcGcrZs-dfeTEC792ZQ,,"[""log"", ""linear""]",,,,Estimated number of existing TB cases (all forms) during the given year.,tb_tuberculosis,"[1990, 2007]"
"All forms TB, est. deaths total",measure,"[0.0, 457800.0]",http://spreadsheets.google.com/pub?key=rrQ_y5fqQPlznp5mJGXWr-A,,"[""log"", ""linear""]",,,,Estimated number of deaths caused by TB (all forms) during the given year.,tb_tuberculosis,"[1990, 2007]"
"All forms TB, reported new cases total",measure,"[0.0, 1555000.0]",http://spreadsheets.google.com/pub?key=r5UikGjnZlemlelKY0NX9Pg,,"[""log"", ""linear""]",,,,Reported number of new and relapsed TB cases (all forms) during the given year.,tb_tuberculosis,"[1980, 2007]"
"All forms TB, detection rate",measure,"[0.0, 285.0]",http://spreadsheets.google.com/pub?key=ru195-zJ0rsx5axPIvm_bRA,,"[""linear"", ""log""]",,%,,The proportion of estimated new cases of TB detected (diagnosed and then notified to WHO) by health facilities in the country during the given year.,tb_tuberculosis,"[1990, 2007]"
"All forms TB, detection rate - DOTS only",measure,"[0.0, 210.0]",http://spreadsheets.google.com/pub?key=rutVwqgB14uRV_f2dRbqhUA,,"[""linear"", ""log""]",,%,,"The proportion of estimated new cases of TB detected (diagnosed and then notified to WHO) during the given year by DOTS programme, which is national TB programmes in finding and diagnosing people with TB.",tb_tuberculosis,"[1990, 2007]"
"TB with HIV+, est. new cases share",measure,"[0.0, 962.0]",http://spreadsheets.google.com/pub?key=rRCxDI3hB9E9zvc8qSe11qg,,"[""linear"", ""log""]",,per 100 000,,"Estimated number of new TB cases (with HIV+) among 100,000 residents during the given year.",tb_tuberculosis,"[1990, 2007]"
"TB with HIV+, est. existing cases share",measure,"[0.0, 481.0]",http://spreadsheets.google.com/pub?key=rQV47xgPGa3qOPHoLiVon-w,,"[""linear"", ""log""]",,per 100 000,,"Estimated number of existing TB cases (with HIV+) among 100,000 residents during the given year.",tb_tuberculosis,"[1990, 2007]"
"TB with HIV+, est. deaths share",measure,"[0.0, 365.4]",http://spreadsheets.google.com/pub?key=rUBCConMMLm9CxPXUGm325A,,"[""linear"", ""log""]",,per 100 000,,"Estimated number of deaths caused by TB (with HIV+) among 100,000 residents during the given year.",tb_tuberculosis,"[1990, 2007]"
"TB with HIV+, est. new cases total",measure,"[0.0, 335600.0]",http://spreadsheets.google.com/pub?key=rERPF4iYruK0DhAw_0tb5nA,,"[""log"", ""linear""]",,,,Estimated number of new TB cases (with HIV+) during the given year.,tb_tuberculosis,"[1990, 2007]"
"TB with HIV+, est. existing cases total",measure,"[0.0, 167800.0]",http://spreadsheets.google.com/pub?key=reiGJwoabnMOrPeFima_9ng,,"[""log"", ""linear""]",,,,Estimated number of existing TB cases (with HIV+) during the given year.,tb_tuberculosis,"[1990, 2007]"
"TB with HIV+, est. deaths total",measure,"[0.0, 100700.0]",http://spreadsheets.google.com/pub?key=rFAkC0Ae7oXxrVqosJ4NWUA,,"[""log"", ""linear""]",,,,Estimated number of deaths caused by TB (with HIV+) during the given year.,tb_tuberculosis,"[1990, 2007]"
Bad teeth per child,measure,"[0.2, 6.3]",http://spreadsheets.google.com/pub?key=phAwcNAVuyj3Os9LVO_pRDA,,"[""linear"", ""log""]",,12 years old,,"The weighted average of the number of Decayed, Missing or Filled teeth among the 12 years old in a country (DMFT). It is meant to reflect the prevalence of caries in a population. ",teeth,"[2004, 2004]"
DTP3 immunized,measure,"[0.0, 99.0]",http://spreadsheets.google.com/pub?key=txVTyScWObTBNuMmkNtLh1w,,"[""linear"", ""log""]",,% of one-year-olds,,"Percentage of 1 year old children who have received 3 doses of combined diphtheria, tetanus toxoid and pertussis vaccine during the year.",vaccine,"[1980, 2011]"
HepB3 immunized,measure,"[1.0, 99.0]",http://spreadsheets.google.com/pub?key=t7pU8fR9_ZzRFIMF3FX47YQ,,"[""linear"", ""log""]",,% of one-year-olds,,Percentage of 1 year old children who have received 3 doses of hepatitis B3 vaccine during the year.,vaccine,"[1989, 2011]"
Hib3 immunized,measure,"[0.0, 99.0]",http://spreadsheets.google.com/pub?key=thClNiXoQqfJDzTv0SYIHZg,,"[""linear"", ""log""]",,% of one-year-olds,,Percentage of 1 year old children who have received 3 doses of Haemophilus influenzae type B vaccine during the year.,vaccine,"[1991, 2011]"
MCV immunized,measure,"[0.0, 99.0]",http://spreadsheets.google.com/pub?key=pyj6tScZqmEenS18Yjl_SOQ,,"[""linear"", ""log""]",,% of one-year-olds,,"Percentage of 1 year old children who have received at least one dose of measles-containing vaccine in a given year. (Some countries for children below 2 years, depending on their policies.)",vaccine,"[1980, 2011]"
PAB immunized,measure,"[1.0, 99.0]",http://spreadsheets.google.com/pub?key=tnvxVX8aOAl0dwDNujbELPQ,,"[""linear"", ""log""]",,% of newborns,,Percentage of neonates in a given year that can be considered as having been protected against tetanus as a result of maternal immunization.,vaccine,"[1980, 2011]"
Broadband,measure,"[0.0, 126300000.0]",https://docs.google.com/spreadsheet/pub?key=0AkBd6lyS3EmpdEpMTHBoMmNzcDVCNVRHWE5zSVJVRHc,,"[""linear"", ""log""]",,total subscribers,,"Broadband subscribers are the total number of broadband subscribers with a digital subscriber line, cable modem, or other high-speed technologies, although definitions may vary from country to country. ",communication,"[1995, 2010]"
Broadband per 100 people,measure,"[0.0, 63.83]",https://docs.google.com/spreadsheet/pub?key=0AkBd6lyS3EmpdHdmMGVNNnV1SHBONDRTdTJzTVBKQXc,,"[""linear"", ""log""]",,,,"Broadband subscribers are the total number of broadband subscribers with a digital subscriber line, cable modem, or other high-speed technologies, although definitions may vary from country to country. ",communication,"[1998, 2010]"
Cell phones,measure,"[0.0, 986300000.0]",https://docs.google.com/spreadsheet/pub?key=0AkBd6lyS3EmpdEhWLWtqNzljbWg4ZXV6M09JQXNGaUE,,"[""linear"", ""log""]",,total,,The number of subscribers to a service providing access to the telephone network using cellular technology. ,communication,"[1965, 2011]"
Cell phones per 100 people,measure,"[0.0, 243.5]",https://docs.google.com/spreadsheet/pub?key=0AkBd6lyS3EmpdG1MSjEyS0h2QjRQZ3FXRVR2dVQyeFE,,"[""linear"", ""log""]",,,,The number of subscribers per 100 people to a service providing access to the telephone network using cellular technology. ,communication,"[1965, 2011]"
Fixed line and mobile phone subscribers,measure,"[0.01166, 211.2]",http://spreadsheets.google.com/pub?key=pyj6tScZqmEcfLoOcU6GAfg,,"[""log"", ""linear""]",,per 100 people,,Fixes lines connect a customer's equipment to the public switched telephone network. Mobile phone subscribers refer to users of portable telephones subscribing to the telephone network using cellular technology. ,communication,"[1975, 2006]"
Internet users,measure,"[0.0, 460100000.0]",https://docs.google.com/spreadsheet/pub?key=0AkBd6lyS3EmpdC1PcWJUZldDelFyQXdaOEtDUG9HSUE,,"[""linear"", ""log""]",,total,,Internet users are people with access to the worldwide network.,communication,"[1990, 2010]"
Internet users per 100 people,measure,"[0.0, 96.62]",https://docs.google.com/spreadsheet/pub?key=0AkBd6lyS3EmpdGwzSGV5OE9FOGhURlhTdEQtMW1TNkE,,"[""linear"", ""log""]",,,,Internet users are people with access to the worldwide network.,communication,"[1990, 2011]"
Computers,measure,"[3.0, 240500000.0]",http://spreadsheets.google.com/pub?key=pyj6tScZqmEfUXdC83YSzfw,,"[""log"", ""linear""]",,total,,Personal computers (total),communication,"[1990, 2006]"
Computers per 100 people,measure,"[0.01, 94.58]",http://spreadsheets.google.com/pub?key=pyj6tScZqmEdFW4nUY4gQdA,,"[""linear"", ""log""]",,,,Personal computers (per 100 people),communication,"[1990, 2006]"
"Improved sanitation, overall",measure,"[3.0, 101.0]",https://spreadsheets.google.com/pub?key=0ArfEDsV3bBwCdE4tekJPYkR4WmJqYTRPWjc3OTl4WUE,,"[""linear"", ""log""]",,%,,"The percentage of the total population with access to facilities that hygienically separate human excreta from human contact. Improved facilities include flush/pour flush toilets or latrines connected to a sewer, -septic tank, or -pit, ventilated improved pit latrines, pit latrines with a slab or platform of any material which covers the pit entirely, except for the drop hole and composting toilets/latrines. Unimproved facilities include public or shared facilities of an otherwise acceptable type, flush/pour-flush toilets or latrines which discharge directly into an open sewer or ditch, pit latrines without a slab, bucket latrines, hanging toilets or latrines which directly discharge in water bodies or in the open and the practice of open defecation in the bush, field or bodies or water.",sanitation,"[1990, 2010]"
"Improved sanitation, urban",measure,"[10.0, 100.0]",http://spreadsheets.google.com/pub?key=pyj6tScZqmEfLbPu48DrKfQ,,"[""linear"", ""log""]",,%,,"The percentage of the urban population with access to facilities that hygienically separate human excreta from human contact. Improved facilities include flush/pour flush toilets or latrines connected to a sewer, -septic tank, or -pit, ventilated improved pit latrines, pit latrines with a slab or platform of any material which covers the pit entirely, except for the drop hole and composting toilets/latrines. Unimproved facilities include public or shared facilities of an otherwise acceptable type, flush/pour-flush toilets or latrines which discharge directly into an open sewer or ditch, pit latrines without a slab, bucket latrines, hanging toilets or latrines which directly discharge in water bodies or in the open and the practice of open defecation in the bush, field or bodies or water.",sanitation,"[1990, 2010]"
"Improved sanitation, rural",measure,"[0.0, 100.0]",https://spreadsheets.google.com/pub?key=0ArfEDsV3bBwCdFNPMTE3d3FHTHdYaGFMXzJyNDBGd3c,,"[""linear"", ""log""]",,%,,"The percentage of the rural population with access to facilities that hygienically separate human excreta from human contact. Improved facilities include flush/pour flush toilets or latrines connected to a sewer, -septic tank, or -pit, ventilated improved pit latrines, pit latrines with a slab or platform of any material which covers the pit entirely, except for the drop hole and composting toilets/latrines. Unimproved facilities include public or shared facilities of an otherwise acceptable type, flush/pour-flush toilets or latrines which discharge directly into an open sewer or ditch, pit latrines without a slab, bucket latrines, hanging toilets or latrines which directly discharge in water bodies or in the open and the practice of open defecation in the bush, field or bodies or water.",sanitation,"[1990, 2010]"
Roads paved,measure,"[0.8, 100.0]",https://docs.google.com/spreadsheet/pub?key=0AkBd6lyS3EmpdDBKd2V5VmxkYlJuUHAtOURzUkZzNEE,,"[""linear"", ""log""]",,% of total roads,,"Roads, paved (% of total roads)",traffic,"[1990, 2009]"
"Improved water source, overall",measure,"[2.0, 100.0]",http://spreadsheets.google.com/pub?key=pyj6tScZqmEd98lRwrU3gIg,,"[""linear"", ""log""]",,%,,"The percentage of the total population who use any of the following types of water supply for drinking: piped water into dwelling, plot or yard; public tap/standpipe; borehole/tube well; protected dug well; protected spring; rainwater collection and bottled water (if a secondary available source is also improved). It does not include unprotected well, unprotected spring, water provided by carts with small tanks/drums, tanker truck-provided water and bottled water (if secondary source is not an improved source) or surface water taken directly from rivers, ponds, streams, lakes, dams, or irrigation channels. ",infrastructure_water,"[1990, 2010]"
"Improved water source, urban",measure,"[6.0, 100.0]",https://spreadsheets.google.com/pub?key=0ArfEDsV3bBwCdDlJNzNjcVc5Sm9memNuVHRzY1FsOXc,,"[""linear"", ""log""]",,%,,"The percentage of the urban population who use any of the following types of water supply for drinking: piped water into dwelling, plot or yard; public tap/standpipe; borehole/tube well; protected dug well; protected spring; rainwater collection and bottled water (if a secondary available source is also improved). It does not include unprotected well, unprotected spring, water provided by carts with small tanks/drums, tanker truck-provided water and bottled water (if secondary source is not an improved source) or surface water taken directly from rivers, ponds, streams, lakes, dams, or irrigation channels. ",infrastructure_water,"[1990, 2010]"
"Improved water source, rural",measure,"[1.0, 100.0]",https://spreadsheets.google.com/pub?key=0ArfEDsV3bBwCdFhhVzhXUEh0U0hlQ3M3TTZIQTFySUE,,"[""linear"", ""log""]",,%,,"The percentage of the rural population who use any of the following types of water supply for drinking: piped water into dwelling, plot or yard; public tap/standpipe; borehole/tube well; protected dug well; protected spring; rainwater collection and bottled water (if a secondary available source is also improved). It does not include unprotected well, unprotected spring, water provided by carts with small tanks/drums, tanker truck-provided water and bottled water (if secondary source is not an improved source) or surface water taken directly from rivers, ponds, streams, lakes, dams, or irrigation channels. ",infrastructure_water,"[1991, 2010]"
Population aged 0-4,measure,"[3.1, 21.68]",http://spreadsheets.google.com/pub?key=rsOONWhmGBtzb4j__0MJv7Q,,"[""linear"", ""log""]",,both sexes %,,Number of both sexes aged 0-4 years divided by total population,both_sexes_by_age,"[1950, 2050]"
Population aged 5-9,measure,"[3.1, 18.28]",http://spreadsheets.google.com/pub?key=rC5UskPU6PRVlmN7eXoridw,,"[""linear"", ""log""]",,both sexes %,,Number of both sexes aged 5-9 years divided by total population,both_sexes_by_age,"[1950, 2050]"
Population aged 10-14,measure,"[3.161, 17.02]",http://spreadsheets.google.com/pub?key=rmViJSkPd4xZneV2Q6gzFwQ,,"[""linear"", ""log""]",,both sexes %,,Number of both sexes aged 10-14 years divided by total population,both_sexes_by_age,"[1950, 2050]"
Population aged 15-19,measure,"[3.3110000000000004, 15.69]",http://spreadsheets.google.com/pub?key=r4VUu4a4AaWqXXoAsFz-z-Q,,"[""linear"", ""log""]",,both sexes %,,Number of both sexes aged 15-19 years divided by total population,both_sexes_by_age,"[1950, 2050]"
Population aged 20-39,measure,"[17.69, 54.34]",http://spreadsheets.google.com/pub?key=rTU20DXn0Bi7bTwW5T6J3gg,,"[""linear"", ""log""]",,both sexes %,,Number of both sexes aged 20-39 years divided by total population,both_sexes_by_age,"[1950, 2050]"
Population aged 40-59,measure,"[6.736000000000001, 36.2]",http://spreadsheets.google.com/pub?key=rLwpdKbW2OykBbvVxhYKrhA,,"[""linear"", ""log""]",,both sexes %,,Number of both sexes aged 40-59 years divided by total population,both_sexes_by_age,"[1950, 2050]"
Population aged 60+,measure,"[0.0, 44.18]",http://spreadsheets.google.com/pub?key=rH6TEe8f_WNq_8x9pWZ3W0A,,"[""linear"", ""log""]",,both sexes %,,Number of both sexes aged above 60 years divided by total population,both_sexes_by_age,"[1950, 2050]"
Population aged 0-4,measure,"[2000.0, 130100000.0]",http://spreadsheets.google.com/pub?key=rovrK0Uj9JPN95P9adob0tw,,"[""linear"", ""log""]",,total number,,Total number of people aged 0-4 years,both_sexes_by_age_total,"[1950, 2050]"
Population aged 5-9,measure,"[2000.0, 128600000.0]",http://spreadsheets.google.com/pub?key=r83X3yfjC6ENYWoo41yDehg,,"[""linear"", ""log""]",,total number,,Total number of people aged 5-9 years,both_sexes_by_age_total,"[1950, 2050]"
Population aged 10-14,measure,"[1000.0, 127900000.0]",http://spreadsheets.google.com/pub?key=r9ztOSMb5WNHUBLwlgJqPSw,,"[""linear"", ""log""]",,total number,,Total number of people aged 10-14 years,both_sexes_by_age_total,"[1950, 2050]"
Population aged 15-19,measure,"[1000.0, 127300000.0]",http://spreadsheets.google.com/pub?key=rFmJvuotJYE30q4nWEvpGJA,,"[""linear"", ""log""]",,total number,,Total number of people aged 15-19 years,both_sexes_by_age_total,"[1950, 2050]"
Population aged 20-39,measure,"[4000.0, 479300000.0]",http://spreadsheets.google.com/pub?key=rHrin819tHgZudARnpsN0Mg,,"[""linear"", ""log""]",,total number,,Total number of people aged 20-39 years,both_sexes_by_age_total,"[1950, 2050]"
Population aged 40-59,measure,"[2000.0, 454600000.0]",http://spreadsheets.google.com/pub?key=ri9SXMNc7TpebHucmAYepGQ,,"[""linear"", ""log""]",,total number,,Total number of people aged 40-59 years,both_sexes_by_age_total,"[1950, 2050]"
Population aged 60+,measure,"[0.0, 440400000.0]",http://spreadsheets.google.com/pub?key=rVD6A2uAmeIE0BQNW1KSg3A,,"[""linear"", ""log""]",,total number,,Total number of people aged above 60 years,both_sexes_by_age_total,"[1950, 2050]"
"Population aged 0-4, female",measure,"[2.736, 33.33]",http://spreadsheets.google.com/pub?key=roLpNPQkooNCFzpTWXQ48Dw,,"[""linear"", ""log""]",,%,,Number of women aged 0-4 years divided by total number of women,female_by_age,"[1950, 2050]"
"Population aged 5-9, female",measure,"[2.736, 33.33]",http://spreadsheets.google.com/pub?key=re3efChATTYAT5bRqoaChXA,,"[""linear"", ""log""]",,%,,Number of women aged 5-9 years divided by total number of women,female_by_age,"[1950, 2050]"
"Population aged 10-14, female",measure,"[2.752, 33.33]",http://spreadsheets.google.com/pub?key=rJwVmwTFzheqVUzYWwSqXlA,,"[""linear"", ""log""]",,%,,Number of women aged 10-14 years divided by total number of women,female_by_age,"[1950, 2050]"
"Population aged 15-19, female",measure,"[0.0, 16.67]",http://spreadsheets.google.com/pub?key=rYEHWlJHaLjHtcsSpRRJeig,,"[""linear"", ""log""]",,%,,Number of women aged 15-19 years divided by total number of women,female_by_age,"[1950, 2050]"
"Population aged 20-39, female",measure,"[0.0, 46.16]",http://spreadsheets.google.com/pub?key=rWpQHQIQdntj6BEK8OIuWYw,,"[""linear"", ""log""]",,%,,Number of women aged 20-39 years divided by total number of women,female_by_age,"[1950, 2050]"
"Population aged 40-59, female",measure,"[0.0, 37.79]",http://spreadsheets.google.com/pub?key=rElErbmOnSM6om03a1uinKQ,,"[""linear"", ""log""]",,%,,Number of women aged 40-59 years divided by total number of women,female_by_age,"[1950, 2050]"
"Population aged 60+, female",measure,"[0.0, 47.43]",http://spreadsheets.google.com/pub?key=rjhBvpeRgCxBq0EnQVN6b0w,,"[""linear"", ""log""]",,%,,Number of women aged above 60 years divided by total number of women,female_by_age,"[1950, 2050]"
"Population aged 0-4, male",measure,"[3.219, 23.53]",http://spreadsheets.google.com/pub?key=rIpDsoI9lVTCh_PRqm66Tcw,,"[""linear"", ""log""]",,%,,Number of men aged 0-4 years divided by total number of men,male_by_age,"[1950, 2050]"
"Population aged 5-9, male",measure,"[3.415, 20.93]",http://spreadsheets.google.com/pub?key=rgyZrNmSfXcPJQxJK7IxnEw,,"[""linear"", ""log""]",,%,,Number of men aged 5-9 years divided by total number of men,male_by_age,"[1950, 2050]"
"Population aged 10-14, male",measure,"[3.2510000000000003, 18.18]",http://spreadsheets.google.com/pub?key=rmQZ_H88rIhF3315QBZpcIQ,,"[""linear"", ""log""]",,%,,Number of men aged 10-14 years divided by total number of men,male_by_age,"[1950, 2050]"
"Population aged 15-19, male",measure,"[3.397, 16.67]",http://spreadsheets.google.com/pub?key=rYfw4UJZSizLRtgDs73d5jA,,"[""linear"", ""log""]",,%,,Number of men aged 15-19 years divided by total number of men,male_by_age,"[1950, 2050]"
"Population aged 20-39, male",measure,"[12.5, 58.7]",http://spreadsheets.google.com/pub?key=rab1GmqpzJkWd4MF0hieVgA,,"[""linear"", ""log""]",,%,,Number of men aged 20-39 years divided by total number of men,male_by_age,"[1950, 2050]"
"Population aged 40-59, male",measure,"[0.0, 39.3]",http://spreadsheets.google.com/pub?key=rcQkob1yAm-to1scz51flgw,,"[""linear"", ""log""]",,%,,Number of men aged 40-59 years divided by total number of men,male_by_age,"[1950, 2050]"
