domain,concept,scales,description,color,name_catalog,indicator_url,name_short,concept_type,name,tags,drill_up,interpolation
,net_barter_terms_of_trade_2000_100,"[""linear"", ""log""]","Net barter terms of trade index is calculated as the percentage ratio of the export unit value indexes to the import unit value indexes, measured relative to the base year 2000. Unit value indexes are based on data reported by countries that demonstrate consistency under UNCTAD quality controls, supplemented by UNCTAD's estimates using the previous yearâs trade values at the Standard International Trade Classification three-digit level as weights. To improve data coverage, especially for the latest periods, UNCTAD constructs a set of average prices indexes at the three-digit product classification of the Standard International Trade Classification revision 3 using UNCTADâs Commodity Price Statistics, internaÂ­tional and national sources, and UNCTAD secretariat estimates and calculates unit value indexes at the country level using the current year's trade values as weights.",,Net barter terms of trade,https://docs.google.com/spreadsheet/pub?key=pyj6tScZqmEe5SueBIj6eSw,Net barter terms of trade,measure,Net barter terms of trade (2000 = 100),advanced_debt_trade,,
,new_births_total_number_estimated,"[""log"", ""linear""]","Total number of estimated new births during the given year, based on the crude birth rate data from UN Population Division and the population data from Gapminder Foundation.",,New births,https://docs.google.com/spreadsheet/pub?key=0ArfEDsV3bBwCdERQeFplM2VWczVrMTFfMXVrQkJpVXc,New births,measure,"New births (total number, estimated)",population_growth,,
,newborn_deaths,"[""linear"", ""log""]",Neonatal deaths Children dying within the first 28 days.,,Newborn deaths,https://docs.google.com/spreadsheet/pub?key=1iTvolhgIMta3MmsoPkGnewJiaybev3MvR9e_7mxZ48o,Newborn deaths,measure,Newborn deaths,newborn_infants,,
,newborn_mortality_rate_per_1000,"[""linear"", ""log""]",Neonatal mortality rate. Children dying within the first 28 days per 1000 live births.,,Newborn mortality rate,https://docs.google.com/spreadsheet/pub?key=1S3Kcw96vp5-fZbaM7Lck_06IbJ8DagThGI5KHnzeSps,Newborn mortality rate,measure,Newborn mortality rate per 1000,newborn_infants,,
,newly_hiv_infected_number_all_ages,"[""linear"", ""log""]",The total number of persons in all ages that are estimated to be newly infected with HIV during the given year.,,Newly HIV infected,https://docs.google.com/spreadsheet/pub?key=0ArfEDsV3bBwCdFk2WGhwakxTQkt4NUtTdFJDSlFHQ3c,Newly HIV infected,measure,"Newly HIV infected (number, all ages)",hiv,,
,newly_hiv_infected_percent_age_15_49,"[""linear"", ""log""]",The estimated percentage of adults aged 15 to 49 years that are newly infected with HIV during the given year.,,"Newly HIV infected (%, age 15-49)",https://docs.google.com/spreadsheet/pub?key=0ArfEDsV3bBwCdDREUkRSRDJtQmFNTE1TYmRYX1pFNEE,Newly HIV infected,measure,"Newly HIV infected (%, age 15-49)",hiv,,
,nuclear_power_generation_per_person,"[""linear"", ""log""]","The amount of electricity produced by nuclear power plants per person in a given year, counted in tonnes of oil equivalent (toe).",,Nuclear electricity production /person,https://docs.google.com/spreadsheet/pub?key=t28UhT9IaWINamciSiJIS7w,Nuclear electricity production,measure,"Nuclear electricity production, per person",nuclear,,
,nuclear_power_generation_total,"[""linear"", ""log""]","The amount of electricity produced by nuclear power plants in a given year, counted in tonnes of oil equivalent (toe).",,Nuclear electricity production,https://docs.google.com/spreadsheet/pub?key=trRb8ZIaBOD4KzikShshZ2g,Nuclear electricity production,measure,"Nuclear electricity production, total",nuclear,,
,number,,,,,,,string,Number,_none,,
,number_of_child_deaths,"[""linear"", ""log""]",The number of children dying before age 5,,Number of child deaths,https://docs.google.com/spreadsheet/pub?key=0ArfEDsV3bBwCdGhSY2trbEVpYnNsMENqendaVm5ucnc,Number of child deaths,measure,Number of child deaths,health,,
,number_of_people_in_poverty,"[""linear"", ""log""]",Number of the poor population in millions living on less than $1.25 a day at 2005 international prices. Povcal data,,Number of people in poverty,https://docs.google.com/spreadsheet/pub?key=1edXplIOkF3Y5OuEWp_aVapd92-OD5aVFAPECZLgP8cA,Number of people in poverty,measure,Number of people in poverty,poverty_inequality,,
,oil_consumption_per_cap,"[""linear"", ""log""]",Oil Consumption per capita (tonnes per year per person),,Oil consumption /person,https://docs.google.com/spreadsheet/pub?key=0ArfEDsV3bBwCdERNZmlfUGM5YVE3bmEwODdlRDFqSkE,Oil consumption,measure,"Oil consumption, per person",oil,,
,oil_consumption_total,"[""linear"", ""log""]",Total amount of crude oil consumption (tonnes oil equivalent),,Oil consumption,https://docs.google.com/spreadsheet/pub?key=pyj6tScZqmEcm0fIa0IVtKw,Oil consumption,measure,"Oil consumption, total",oil,,
,oil_production_per_person,"[""linear"", ""log""]",Crude oil production per person (tonnes oil equivalent),,Oil production /person,https://docs.google.com/spreadsheet/pub?key=pyj6tScZqmEeUgUuvuJTONQ,Oil production,measure,"Oil production, per person",oil,,
,oil_production_total,"[""linear"", ""log""]",Total amount of crude oil production (tonnes oil equivalent),,Oil production,https://docs.google.com/spreadsheet/pub?key=pyj6tScZqmEdNIa3ckVXaCQ,Oil production,measure,"Oil production, total",oil,,
,oil_proved_reserves_total,"[""linear"", ""log""]",Proven reserves of oil (tonnes oil equivalent),,Oil proved reserves,https://docs.google.com/spreadsheet/pub?key=pyj6tScZqmEfJfS1WYrLeBA,Oil proved reserves,measure,"Oil proved reserves, total",oil,,
,oil_proven_reserves_per_person,"[""log"", ""linear""]",Oil proven reserves per person (tonnes oil equivalent),,Oil proven reserves /person,https://docs.google.com/spreadsheet/pub?key=pyj6tScZqmEfrI4YlDJDUag,Oil proved reserves,measure,"Oil proven reserves, per person",oil,,
,old_version_of_income_per_person_version_3,"[""log"", ""linear""]","The version of Income per person used before 22 december 2008 (version 3). Gross Domestic Product per person by Purchasing Power Parities (in international dollars, fixed 1990 prices).",,Old version of Income per person (version 3),https://docs.google.com/spreadsheet/pub?key=phAwcNAVuyj0npaJxInyYDg,Old version of Income per person (version 3),measure,Old version of Income per person (version 3),alternative_gdp_data,,
,old_version_of_income_per_person_version_8,"[""log"", ""linear""]","The version of Income per person used before 12 july 2010 (version 8). Gross Domestic Product per person by Purchasing Power Parities (in international dollars, fixed 2050 prices).",,Old version of Income per person (version 8),https://docs.google.com/spreadsheet/pub?key=0ArfEDsV3bBwCdE5xWmcyYVZJQzJvOFpZUklqX3lkSkE,Old version of Income per person (version 8),measure,Old version of Income per person (version 8),alternative_gdp_data,,
,other_deaths_in_newborn_per_1000_births,"[""log"", ""linear""]","Other deaths in newborn (per 1,000 births)",,Other deaths ‰ births,https://docs.google.com/spreadsheet/pub?key=tiYIen5OQP0fKiQbg6g8VyA,Other deaths in newborn,measure,Other deaths in newborn (per 1000 births),causes_of_newborn_deaths,,
,other_deaths_in_newborn_total_deaths,"[""log"", ""linear""]",Other deaths in newborn (total deaths),,Other deaths,https://docs.google.com/spreadsheet/pub?key=tyPO4OLCIZtK5zcdkafcHMA,Other deaths in newborn,measure,Other deaths in newborn (total deaths),causes_of_newborn_deaths,,
,other_infections_deaths_in_children_1_59_months_per_1000_birt,"[""log"", ""linear""]","Other infections deaths in children 1-59 months (per 1,000 births)",,Other infections deaths ‰ births,https://docs.google.com/spreadsheet/pub?key=tVAqgYwCDZfcq9jSCI87SAw,Other infections deaths,measure,Other infections deaths in children 1-59 months (per 1000 births),causes_of_child_deaths,,
,other_infections_deaths_in_children_1_59_months_total_deaths,"[""log"", ""linear""]",Other infections deaths in children 1-59 months (total deaths),,Other infections deaths,https://docs.google.com/spreadsheet/pub?key=tiehFos6jB-lekEAH028deA,Other infections deaths,measure,Other infections deaths in children 1-59 months (total deaths),causes_of_child_deaths,,
,other_social_services_aid_given_percent_of_aid,"[""linear"", ""log""]",Percentage of total allocable aid for official development assistance (ODA) given by the donor countries that has been used in other social infrastructures and services.,,Other social services aid given,https://docs.google.com/spreadsheet/pub?key=tqjUijP4mi_dHKkCZjOn0oA,Other social services aid given,measure,Other social services aid given (% of aid),aid_given,,
,out_of_pocket_share_of_total_health_spending_percent,"[""linear"", ""log""]",Proportion of total health expenditures that has been paid directly out-of-pocket by individuals.,,Out-of-pocket total health spending,https://docs.google.com/spreadsheet/pub?key=tXf6_OUYVmyEMZo0g4DQw6w,Out-of-pocket total health spending,measure,Out-of-pocket total health spending share (%),health_economics,,
,pab_immunized_percent_of_newborns,"[""linear"", ""log""]",Percentage of neonates in a given year that can be considered as having been protected against tetanus as a result of maternal immunization.,,PAB immunized,https://docs.google.com/spreadsheet/pub?key=tnvxVX8aOAl0dwDNujbELPQ,PAB immunized,measure,PAB immunized (% of newborns),vaccine,,
,pandg,,,,,,,string,pandg,_none,,
,parent,,,,,,,string,Tag Parent,_none,,
,patent_applications_total,"[""linear"", ""log""]",Patents are documents issued by a government office that describe an invention and create a legal situation in which the patented invention can normally be exploited only by or with the authorization of the patent holder. The protection is generally limited to 20 years.,,Patent applications,https://docs.google.com/spreadsheet/pub?key=pyj6tScZqmEd5FA9xlfO9eA,Patent applications,measure,Patent applications (total),economic_situation,,
,patents_granted_total,"[""linear"", ""log""]",Patents are documents issued by a government office that describe an invention and create a legal situation in which the patented invention can normally be exploited only by or with the authorization of the patent holder. The protection is generally limited to 20 years.,,Patents granted,https://docs.google.com/spreadsheet/pub?key=pyj6tScZqmEdMioz5VJKXHw,Patents granted,measure,Patents granted (total),economic_situation,,
,patents_in_force_total,"[""linear"", ""log""]",Patents are documents issued by a government office that describe an invention and create a legal situation in which the patented invention can normally be exploited only by or with the authorization of the patent holder. The protection is generally limited to 20 years.,,Patents in force,https://docs.google.com/spreadsheet/pub?key=pyj6tScZqmEe371ZVZl73eA,Patents in force,measure,Patents in force (total),economic_situation,,
,people_living_with_hiv_number_all_ages,"[""log"", ""linear""]","The total number of persons in all ages that are estimated to be infected by HIV, including those without symptoms, those sick from AIDS and those healthy due to treatment of the HIV infection",,People living with HIV,https://docs.google.com/spreadsheet/pub?key=pyj6tScZqmEe1GaiYJX2qGA,People living with HIV,measure,"People living with HIV (number, all ages)",hiv,,
,personal_computers_per_100_people,"[""linear"", ""log""]",Personal computers (per 100 people),,Personal computers /100 people,https://docs.google.com/spreadsheet/pub?key=pyj6tScZqmEdFW4nUY4gQdA,Personal computers,measure,Personal computers (per 100 people),communication,,
,personal_computers_total,"[""log"", ""linear""]",Personal computers (total),,Personal computers,https://docs.google.com/spreadsheet/pub?key=pyj6tScZqmEfUXdC83YSzfw,Personal computers,measure,Personal computers (total),communication,,
,pertussis_deaths_in_children_1_59_months_per_1000_births,"[""log"", ""linear""]","Pertussis deaths in children 1-59 months (per 1,000 births)",,Pertussis deaths ‰ births,https://docs.google.com/spreadsheet/pub?key=t4RbfeK6Dtt2srxw4REoXxQ,Pertussis deaths in children,measure,Pertussis deaths in children 1-59 months (per 1000 births),causes_of_child_deaths,,
,pertussis_deaths_in_children_1_59_months_total_deaths,"[""log"", ""linear""]",Pertussis deaths in children 1-59 months (total deaths),,Pertussis deaths,https://docs.google.com/spreadsheet/pub?key=tdOlzqGxVdDnnCpfWyyGX1A,Pertussis deaths in children,measure,Pertussis deaths in children 1-59 months (total deaths),causes_of_child_deaths,,
,plane_crash_affected_annual_number,"[""log"", ""linear""]","Total number of people getting affected, injured or killed in air accidents during the given year.",,Plane crash affected,https://docs.google.com/spreadsheet/pub?key=rhbS3kWOfMzvY4ofUFoeFJg,Plane crash affected,measure,Plane crash affected annual number,disasters,,
,plane_crash_deaths_annual_number,"[""linear"", ""log""]",Number of people killed in air accidents during the given year.,,Plane crash deaths,https://docs.google.com/spreadsheet/pub?key=rSv5aMDwESiKg-yA__-tRFg,Plane crash deaths,measure,Plane crash deaths annual number,disasters,,
,planted_forest_area_ha,"[""log"", ""linear""]","Total area of forest land (hectares) established through planting or seeding, basically of introduced species and in some cases native species.",,Planted forest area,https://docs.google.com/spreadsheet/pub?key=pp59adS3CHWc4aJd9fV8zZg,Planted forest area,measure,Planted forest area (ha),forestry,,
,pneumonia_deaths_in_children_1_59_months_per_1000_births,"[""log"", ""linear""]","Pneumonia deaths in children 1-59 months (per 1,000 births)",,Pneumonia deaths ‰ births,https://docs.google.com/spreadsheet/pub?key=tCe8N5KXAYCJteQokAqVM_A,Pneumonia deaths in children,measure,Pneumonia deaths in children 1-59 months (per 1000 births),causes_of_child_deaths,,
,pneumonia_deaths_in_children_1_59_months_total_deaths,"[""log"", ""linear""]",Pneumonia deaths in children 1-59 months (total deaths),,Pneumonia deaths in children,https://docs.google.com/spreadsheet/pub?key=tcYkTk6KMHsrXzcM9WyUxbw,Pneumonia deaths in children,measure,Pneumonia deaths in children 1-59 months (total deaths),causes_of_child_deaths,,
,pneumonia_deaths_in_newborn_per_1000_births,"[""log"", ""linear""]","Pneumonia deaths in newborn (per 1,000 births)",,Pneumonia deaths ‰ births,https://docs.google.com/spreadsheet/pub?key=tOXHWd6PcUGK3Dg-k2N8Clw,Pneumonia deaths in newborn,measure,Pneumonia deaths in newborn (per 1000 births),causes_of_newborn_deaths,,
,pneumonia_deaths_in_newborn_total_deaths,"[""log"", ""linear""]",Pneumonia deaths in newborn (total deaths),,Pneumonia deaths in newborn,https://docs.google.com/spreadsheet/pub?key=tjvbVGhVx7YCk1uguLrkaag,Pneumonia deaths in newborn,measure,Pneumonia deaths in newborn (total deaths),causes_of_newborn_deaths,,
,poisonings_deaths_per_100000_people,"[""linear"", ""log""]","Unintentional poisonings, age-adjusted mortality per 100 000 standard population. This rate is calculated as if all countries had the same age composition of the population.",,"Poisonings, deaths /100k people",https://docs.google.com/spreadsheet/pub?key=0AgogXXPMARyldGhVLXVsSTB0aDY2eXdLaEt1T0psdXc,"Poisonings, deaths",measure,"Poisonings, deaths (per 100 000 people)",injuries_and_accidents,,
,population_aged_0_4_years_both_sexes_percent,"[""linear"", ""log""]",Number of both sexes aged 0-4 years divided by total population,,"Population aged 0-4, (%)",https://docs.google.com/spreadsheet/pub?key=rsOONWhmGBtzb4j__0MJv7Q,Population aged 0-4,measure,"Population aged 0-4, both sexes (%)",both_sexes_by_age,,
,population_aged_0_4_years_female_percent,"[""linear"", ""log""]",Number of women aged 0-4 years divided by total number of women,,"Population aged 0-4, F (%)",https://docs.google.com/spreadsheet/pub?key=roLpNPQkooNCFzpTWXQ48Dw,Population aged 0-4,measure,"Population aged 0-4, female (%)",female_by_age,,
,population_aged_0_4_years_male_percent,"[""linear"", ""log""]",Number of men aged 0-4 years divided by total number of men,,"Population aged 0-4, M (%)",https://docs.google.com/spreadsheet/pub?key=rIpDsoI9lVTCh_PRqm66Tcw,Population aged 0-4,measure,"Population aged 0-4, male (%)",male_by_age,,
,population_aged_0_4_years_total_number,"[""linear"", ""log""]",Total number of people aged 0-4 years,,"Population aged 0-4, total",https://docs.google.com/spreadsheet/pub?key=rovrK0Uj9JPN95P9adob0tw,Population aged 0-4,measure,"Population aged 0-4, total number",both_sexes_by_age_total,,
,population_aged_10_14_years_both_sexes_percent,"[""linear"", ""log""]",Number of both sexes aged 10-14 years divided by total population,,"Population aged 10-14, (%)",https://docs.google.com/spreadsheet/pub?key=rmViJSkPd4xZneV2Q6gzFwQ,Population aged 10-14,measure,"Population aged 10-14, both sexes (%)",both_sexes_by_age,,
,population_aged_10_14_years_female_percent,"[""linear"", ""log""]",Number of women aged 10-14 years divided by total number of women,,"Population aged 10-14, F (%)",https://docs.google.com/spreadsheet/pub?key=rJwVmwTFzheqVUzYWwSqXlA,Population aged 10-14,measure,"Population aged 10-14, female (%)",female_by_age,,
,population_aged_10_14_years_male_percent,"[""linear"", ""log""]",Number of men aged 10-14 years divided by total number of men,,"Population aged 10-14, M (%)",https://docs.google.com/spreadsheet/pub?key=rmQZ_H88rIhF3315QBZpcIQ,Population aged 10-14,measure,"Population aged 10-14, male (%)",male_by_age,,
,population_aged_10_14_years_total_number,"[""linear"", ""log""]",Total number of people aged 10-14 years,,"Population aged 10-14, total",https://docs.google.com/spreadsheet/pub?key=r9ztOSMb5WNHUBLwlgJqPSw,Population aged 10-14,measure,"Population aged 10-14, total number",both_sexes_by_age_total,,
,population_aged_15_19_years_both_sexes_percent,"[""linear"", ""log""]",Number of both sexes aged 15-19 years divided by total population,,"Population aged 15-19, (%)",https://docs.google.com/spreadsheet/pub?key=r4VUu4a4AaWqXXoAsFz-z-Q,Population aged 15-19,measure,"Population aged 15-19, both sexes (%)",both_sexes_by_age,,
,population_aged_15_19_years_female_percent,"[""linear"", ""log""]",Number of women aged 15-19 years divided by total number of women,,"Population aged 15-19, F (%)",https://docs.google.com/spreadsheet/pub?key=rYEHWlJHaLjHtcsSpRRJeig,Population aged 15-19,measure,"Population aged 15-19, female (%)",female_by_age,,
,population_aged_15_19_years_male_percent,"[""linear"", ""log""]",Number of men aged 15-19 years divided by total number of men,,"Population aged 15-19, M (%)",https://docs.google.com/spreadsheet/pub?key=rYfw4UJZSizLRtgDs73d5jA,Population aged 15-19,measure,"Population aged 15-19, male (%)",male_by_age,,
,population_aged_15_19_years_total_number,"[""linear"", ""log""]",Total number of people aged 15-19 years,,"Population aged 15-19, total",https://docs.google.com/spreadsheet/pub?key=rFmJvuotJYE30q4nWEvpGJA,Population aged 15-19,measure,"Population aged 15-19, total number",both_sexes_by_age_total,,
,population_aged_20_39_years_both_sexes_percent,"[""linear"", ""log""]",Number of both sexes aged 20-39 years divided by total population,,"Population aged 20-39, (%)",https://docs.google.com/spreadsheet/pub?key=rTU20DXn0Bi7bTwW5T6J3gg,Population aged 20-39,measure,"Population aged 20-39, both sexes (%)",both_sexes_by_age,,
,population_aged_20_39_years_female_percent,"[""linear"", ""log""]",Number of women aged 20-39 years divided by total number of women,,"Population aged 20-39, F (%)",https://docs.google.com/spreadsheet/pub?key=rWpQHQIQdntj6BEK8OIuWYw,Population aged 20-39,measure,"Population aged 20-39, female (%)",female_by_age,,
,population_aged_20_39_years_male_percent,"[""linear"", ""log""]",Number of men aged 20-39 years divided by total number of men,,"Population aged 20-39, M (%)",https://docs.google.com/spreadsheet/pub?key=rab1GmqpzJkWd4MF0hieVgA,Population aged 20-39,measure,"Population aged 20-39, male (%)",male_by_age,,
,population_aged_20_39_years_total_number,"[""linear"", ""log""]",Total number of people aged 20-39 years,,"Population aged 20-39, total",https://docs.google.com/spreadsheet/pub?key=rHrin819tHgZudARnpsN0Mg,Population aged 20-39,measure,"Population aged 20-39, total number",both_sexes_by_age_total,,
,population_aged_40_59_years_both_sexes_percent,"[""linear"", ""log""]",Number of both sexes aged 40-59 years divided by total population,,"Population aged 40-59, (%)",https://docs.google.com/spreadsheet/pub?key=rLwpdKbW2OykBbvVxhYKrhA,Population aged 40-59,measure,"Population aged 40-59, both sexes (%)",both_sexes_by_age,,
,population_aged_40_59_years_female_percent,"[""linear"", ""log""]",Number of women aged 40-59 years divided by total number of women,,"Population aged 40-59, F (%)",https://docs.google.com/spreadsheet/pub?key=rElErbmOnSM6om03a1uinKQ,Population aged 40-59,measure,"Population aged 40-59, female (%)",female_by_age,,
,population_aged_40_59_years_male_percent,"[""linear"", ""log""]",Number of men aged 40-59 years divided by total number of men,,"Population aged 40-59, M (%)",https://docs.google.com/spreadsheet/pub?key=rcQkob1yAm-to1scz51flgw,Population aged 40-59,measure,"Population aged 40-59, male (%)",male_by_age,,
,population_aged_40_59_years_total_number,"[""linear"", ""log""]",Total number of people aged 40-59 years,,"Population aged 40-59, total",https://docs.google.com/spreadsheet/pub?key=ri9SXMNc7TpebHucmAYepGQ,Population aged 40-59,measure,"Population aged 40-59, total number",both_sexes_by_age_total,,
,population_aged_5_9_years_both_sexes_percent,"[""linear"", ""log""]",Number of both sexes aged 5-9 years divided by total population,,"Population aged 5-9, (%)",https://docs.google.com/spreadsheet/pub?key=rC5UskPU6PRVlmN7eXoridw,Population aged 5-9,measure,"Population aged 5-9, both sexes (%)",both_sexes_by_age,,
,population_aged_5_9_years_female_percent,"[""linear"", ""log""]",Number of women aged 5-9 years divided by total number of women,,"Population aged 5-9, F (%)",https://docs.google.com/spreadsheet/pub?key=re3efChATTYAT5bRqoaChXA,Population aged 5-9,measure,"Population aged 5-9, female (%)",female_by_age,,
,population_aged_5_9_years_male_percent,"[""linear"", ""log""]",Number of men aged 5-9 years divided by total number of men,,"Population aged 5-9, M (%)",https://docs.google.com/spreadsheet/pub?key=rgyZrNmSfXcPJQxJK7IxnEw,Population aged 5-9,measure,"Population aged 5-9, male (%)",male_by_age,,
,population_aged_5_9_years_total_number,"[""linear"", ""log""]",Total number of people aged 5-9 years,,"Population aged 5-9, total",https://docs.google.com/spreadsheet/pub?key=r83X3yfjC6ENYWoo41yDehg,Population aged 5-9,measure,"Population aged 5-9, total number",both_sexes_by_age_total,,
,population_aged_60plus_years_both_sexes_percent,"[""linear"", ""log""]",Number of both sexes aged above 60 years divided by total population,,"Population aged 60+, (%)",https://docs.google.com/spreadsheet/pub?key=rH6TEe8f_WNq_8x9pWZ3W0A,Population aged 60+,measure,"Population aged 60+, both sexes (%)",both_sexes_by_age,,
,population_aged_60plus_years_female_percent,"[""linear"", ""log""]",Number of women aged above 60 years divided by total number of women,,"Population aged 60+, F (%)",https://docs.google.com/spreadsheet/pub?key=rjhBvpeRgCxBq0EnQVN6b0w,Population aged 60+,measure,"Population aged 60+, female (%)",female_by_age,,
,population_aged_60plus_years_male_percent,"[""linear"", ""log""]",Number of men aged above 60 years divided by total number of men,,"Population aged 60+, M (%)",https://docs.google.com/spreadsheet/pub?key=rSkhGgUVN74knEhSAhBSSKA,Population aged 60+,measure,"Population aged 60+, male (%)",male_by_age,,
,population_aged_60plus_years_total_number,"[""linear"", ""log""]",Total number of people aged above 60 years,,"Population aged 60+, total",https://docs.google.com/spreadsheet/pub?key=rVD6A2uAmeIE0BQNW1KSg3A,Population aged 60+,measure,"Population aged 60+, total number",both_sexes_by_age_total,,
,population_density_per_square_km,"[""linear"", ""log""]",Average number of people on each square km of the land in the given country.,,Population density,https://docs.google.com/spreadsheet/pub?key=tVY51lNaCL9m9xPqf29oFAA,Population density,measure,Population density (per square km),population,,
,population_growth_annual_percent,"[""linear"", ""log""]","Annual population growth rate for year t is the exponential rate of growth of midyear population from year t-1 to t, expressed as a percentage . Population is based on the de facto definition of population, which counts all residents regardless of legal status or citizenship.",,Population growth,https://docs.google.com/spreadsheet/pub?key=0AkBd6lyS3EmpdFY5Z0QzTzRRbzJ1VXdqdGVyNE0tcFE,Population growth,measure,Population growth (annual %),population_growth,,
,population_growth_annual_percent_with_projections,"[""linear"", ""log""]","Annual change of population in percentage, data after 2010 is based on the medium estimates from UN population division.",,"Population growth, w projections",https://docs.google.com/spreadsheet/pub?key=rZrHzR__kZfmw6L_xUx7cwg,Population growth,measure,"Population growth (annual %), with projections",projections,,
,population_in_urban_agglomerations_m_1_million_percent_of_total,"[""linear"", ""log""]",Population in urban agglomerations of more than one million is the percentage of a country's population living in metropolitan areas that in 2000 had a population of more than one million people.,,Population in urban agglomerations,https://docs.google.com/spreadsheet/pub?key=pyj6tScZqmEdwXv1tqzV4Xg,Population in urban agglomerations,measure,Population in urban agglomerations > 1 million (% of total population),urbanization,,
