domain,concept,scales,description,color,name_catalog,indicator_url,name_short,concept_type,name,tags,drill_up,interpolation
,income_share_of_poorest_10percent,"[""linear"", ""log""]",Percentage share of income or consumption is the share that accrues to subgroups of population indicated by deciles or quintiles.,,Income share of poorest 10%,https://docs.google.com/spreadsheet/pub?key=trzLWJQU4SZMDpeVg3XnL5A,Income share of poorest 10%,measure,Income share of poorest 10%,poverty_inequality,,
,income_share_of_poorest_20percent,"[""linear"", ""log""]",Percentage share of income or consumption is the share that accrues to subgroups of population indicated by deciles or quintiles. Percentage shares by quintile may not sum to 100 because of rounding.,,Income share of poorest 20%,https://docs.google.com/spreadsheet/pub?key=pyj6tScZqmEdIyrBS31XAaw,Income share of poorest 20%,measure,Income share of poorest 20%,poverty_inequality,,
,income_share_of_richest_10percent,"[""linear"", ""log""]",Percentage share of income or consumption is the share that accrues to subgroups of population indicated by deciles or quintiles.,,Income share of richest 10%,https://docs.google.com/spreadsheet/pub?key=tmKvydPl_roGIQBrMYA6C4g,Income share of richest 10%,measure,Income share of richest 10%,poverty_inequality,,
,income_share_of_richest_20percent,"[""linear"", ""log""]",Percentage share of income or consumption is the share that accrues to subgroups of population indicated by deciles or quintiles. Percentage shares by quintile may not sum to 100 because of rounding.,,Income share of richest 20%,https://docs.google.com/spreadsheet/pub?key=tLnCxItXzRSu9gH-5PyEFDw,Income share of richest 20%,measure,Income share of richest 20%,poverty_inequality,,
,indicator_url,,,,,,,string,Indicator url,_none,,
,industrial_water_withdrawal_percent_of_total,"[""linear"", ""log""]","Percentage of the total water withdrawal used in industry, including renewable water resources as well as potential over-abstraction of renewable groundwater or withdrawal of fossil groundwater and potential use of desalinated water or treated wastewater. Usually, this sector refers to self-supplied industries not connected to any distribution network. The ratio between net consumption and withdrawal is estimated at less than 5%.",,Industrial water withdrawal,https://docs.google.com/spreadsheet/pub?key=rGKP-BBylLOM11iGahW1lxA,Industrial water withdrawal,measure,Industrial water withdrawal (% of total),environment_water,,
,industry_percent_of_gdp,"[""linear"", ""log""]","Industry corresponds to ISIC divisions 10-45 and includes manufacturing (ISIC divisions 15-37). It comprises value added in mining, manufacturing (also reported as a separate subgroup), construction, electricity, water, and gas. Value added is the net output of a sector after adding up all outputs and subtracting intermediate inputs. It is calculated without making deductions for depreciation of fabricated assets or depletion and degradation of natural resources. The origin of value added is determined by the International Standard Industrial Classification (ISIC), revision 3. Note: For VAB countries, gross value added at factor cost is used as the denominator.",,Industry (% of GDP),https://docs.google.com/spreadsheet/pub?key=0AkBd6lyS3EmpdHA2UEFOYTlUTWtzV29xbHFuMU00SFE,Industry (% of GDP),measure,Industry (% of GDP),sectors,,
,industry_workers_percent_of_labour_force,"[""linear"", ""log""]",Percentage of all labour force that works in industry sector.,,Industry workers,https://docs.google.com/spreadsheet/pub?key=rqcJTExcUqNdolB-7flqebQ,Industry workers,measure,Industry workers (% of labour force),employment_by_sector,,
,inequality_index_gini,"[""linear"", ""log""]","Gini index measures the extent to which the distribution of income (or, in some cases, consumption expenditure) among individuals or households within an economy deviates from a perfectly equal distribution. A Lorenz curve plots the cumulative percentages of total income received against the cumulative number of recipients, starting with the poorest individual or household. The Gini index measures the area between the Lorenz curve and a hypothetical line of absolute equality, expressed as a percentage of the maximum area under the line. Thus a Gini index of 0 represents perfect equality, while an index of 100 implies perfect inequality.",,Inequality index (Gini),https://docs.google.com/spreadsheet/pub?key=pyj6tScZqmEcjeKHnZq6RIg,Inequality index (Gini),measure,Inequality index (Gini),poverty_inequality,,
,infant_mortality_rate_per_1000_births,"[""log"", ""linear""]",Deaths of children during first year of life (per 1000 live births).,,Infant mortality,https://docs.google.com/spreadsheet/pub?key=phAwcNAVuyj0NpF2PTov2Cw,Infant mortality,measure,Infant mortality (rate per 1000 births),newborn_infants,,
,infectious_tb_detection_rate_percent,"[""linear"", ""log""]",The proportion of estimated new smear-positive cases of TB detected (diagnosed and then notified to WHO) by health facilities in the country during the given year.,,"TB detection rate, infectious TB",https://docs.google.com/spreadsheet/pub?key=rDb6EYc4YUTBRfXlBvjHYlg,TB detection rate (%),measure,"TB detection rate (%), infectious TB",tb_tuberculosis,,
,infectious_tb_detection_rate_percent_dots_only,"[""linear"", ""log""]","The proportion of estimated new smear-positive cases of TB detected (diagnosed and then notified to WHO) during the given year by DOTS programme, which is national TB programmes in finding and diagnosing people with TB.",,"TB detection rate, infectious - DOTS only",https://docs.google.com/spreadsheet/pub?key=rjGHot8B6YSt3kPYEG8nANA,TB detection rate (%),measure,"TB detection rate (%), infectious - DOTS only",tb_tuberculosis,,
,infectious_tb_new_cases_per_100000_estimated,"[""linear"", ""log""]","Estimated number of new TB cases (infectious) among 100,000 residents during the given year.",,"TB new cases /100k, estimated, infectious TB",https://docs.google.com/spreadsheet/pub?key=rVyfxaPK4dJ9B6ZdgG34F-g,TB new cases per 100 000,measure,"TB new cases per 100 000, estimated, infectious TB",tb_tuberculosis,,
,infectious_tb_new_cases_per_100000_reported,"[""linear"", ""log""]","Reported number of new TB cases (infectious) among 100,000 residents during the given year.",,"TB new cases /100k, reported, infectious TB",https://docs.google.com/spreadsheet/pub?key=r0pD5wznwEUJ0ipdxAWQjiA,TB new cases per 100 000,measure,"TB new cases per 100 000, reported, infectious TB",tb_tuberculosis,,
,infectious_tb_number_of_new_cases_estimated,"[""log"", ""linear""]",Estimated number of new TB cases (infectious) during the given year.,,"TB new cases, estimated, infectious TB",https://docs.google.com/spreadsheet/pub?key=rOPfJcbTTIyS-vxDWbkfNLA,TB new cases,measure,"TB new cases, estimated, infectious TB",tb_tuberculosis,,
,infectious_tb_number_of_new_cases_reported,"[""log"", ""linear""]",Reported number of new TB cases (infectious) during the given year.,,"TB new cases, reported, infectious TB",https://docs.google.com/spreadsheet/pub?key=rcbx0R-TXbkqRCyvKzn08fg,TB new cases,measure,"TB new cases, reported, infectious TB",tb_tuberculosis,,
,infectious_tb_treatment_dots_completed_percent,"[""linear"", ""log""]",Percentage of all patients with infectious TB detected by DOTS programme that have finished the treatment during the given year.,,"Treatment (DOTS) completed, infectious TB",https://docs.google.com/spreadsheet/pub?key=rewICFMTvBuer8UoJIK0yUg,Treatment (DOTS) completed,measure,"Treatment (DOTS) completed (%), infectious TB",tb_tuberculosis,,
,inflation_annual_percent,"[""linear"", ""log""]",Inflation as measured by the annual growth rate of the GDP implicit deflator shows the rate of price change in the economy as a whole. The GDP implicit deflator is the ratio of GDP in current local currency to GDP in constant local currency.,,Inflation,https://docs.google.com/spreadsheet/pub?key=0AkBd6lyS3EmpdGJoOUJXalk3STFYUG85MkxlbnQxMmc,Inflation,measure,Inflation (annual %),economic_situation,,
,injury_deaths_in_children_1_59_months_per_1000_births,"[""log"", ""linear""]","Injury deaths in children 1-59 months (per 1,000 births)",,Injury deaths ‰ births,https://docs.google.com/spreadsheet/pub?key=tfOi0Ji7pJDJbxJVqwJXj9g,Injury deaths in children,measure,Injury deaths in children 1-59 months (per 1000 births),causes_of_child_deaths,,
,injury_deaths_in_children_1_59_months_total_deaths,"[""log"", ""linear""]",Injury deaths in children 1-59 months (total deaths),,"Injury deaths in children, total",https://docs.google.com/spreadsheet/pub?key=tnRIpcH0InZUFz7f2ziXKog,Injury deaths in children,measure,Injury deaths in children 1-59 months (total deaths),causes_of_child_deaths,,
,internal_renewable_water_cu_meters_per_person,"[""linear"", ""log""]",Quantity of internal renewable water resources per person per year in cubic meters. Internal Renewable Water Resources (IRWR): Long-term average annual flow of rivers and recharge of aquifers generated from endogenous precipitation. Double counting of surface water and groundwater resources is avoided by deducting the overlap from the sum of the surface water and groundwater resources.,,Internal renewable water,https://docs.google.com/spreadsheet/pub?key=riLRFECHMsTq7OTa2KYZCWA,Internal renewable water,measure,Internal renewable water (cu meters per person),environment_water,,
,internet_users_per_100_people,"[""linear"", ""log""]",Internet users are people with access to the worldwide network.,,Internet users /100 people,https://docs.google.com/spreadsheet/pub?key=0AkBd6lyS3EmpdGwzSGV5OE9FOGhURlhTdEQtMW1TNkE,Internet users,measure,Internet users (per 100 people),communication,,
,internet_users_total_number,"[""linear"", ""log""]",Internet users are people with access to the worldwide network.,,Internet users,https://docs.google.com/spreadsheet/pub?key=0AkBd6lyS3EmpdC1PcWJUZldDelFyQXdaOEtDUG9HSUE,Internet users,measure,Internet users (total),communication,,
,interpolation,,,,,,,string,interpolation,_none,,
,investments_percent_of_gdp,"[""linear"", ""log""]","Gross capital formation (formerly gross domestic investment) consists of outlays on additions to the fixed assets of the economy plus net changes in the level of inventories. Fixed assets include land improvements (fences, ditches, drains, and so on); plant, machinery, and equipment purchases; and the construction of roads, railways, and the like, including schools, offices, hospitals, private residential dwellings, and commercial and industrial buildings. Inventories are stocks of goods held by firms to meet temporary or unexpected fluctuations in production or sales, and ""work in progress."" According to the 1993 SNA, net acquisitions of valuables are also considered capital formation.",,Investments,https://docs.google.com/spreadsheet/pub?key=0AkBd6lyS3EmpdG9sVVF6dHpGdnhQU3BkMlAtNHFwVkE,Investments,measure,Investments (% of GDP),economic_situation,,
,iso3166_1_alpha2,,,,,http://www.iso.org/iso/home/standards/country_codes.htm,,string,ISO 3166-1 alpha-2,_none,,
,iso3166_1_alpha3,,,,,http://www.iso.org/iso/home/standards/country_codes.htm,,string,ISO 3166-1 alpha-3,_none,,
,iso3166_1_numeric,,,,,http://www.iso.org/iso/home/standards/country_codes.htm,,string,ISO 3166-1 numeric,_none,,
,iso3166_2,,,,,https://en.wikipedia.org/wiki/ISO_3166-2,,string,ISO 3166-2,_none,,
geo,landlocked,"[""ordinal""]",,"{""palette"": {""coastline"": ""#7487ef"", ""landlocked"": ""#f05656""}}",,https://docs.google.com/spreadsheet/pub?key=rBwKBodk7Y08pGiA4OAfzUA,,entity_set,Landlocked,categorizations,,
,latitude,"[""linear""]",,,,https://github.com/open-numbers/ddf--gapminder--dim_geo_countries_and_groups/blob/master/ddf--list--geo--country.csv,,measure,Latitude,_none,,
,life_expectancy_at_birth_data_from_ihme,"[""linear"", ""log""]","Life expectancy at birth, the data is taken from Institute for health metrics and evaluation",,Life expectancy IHME,https://docs.google.com/spreadsheet/pub?key=0ArfEDsV3bBwCdG9jSHA0WklHU0dqUnBCVUpVOXFzQUE,Life expectancy,measure,"Life expectancy at birth, data from IHME",alternative_demography_indicators,,
,life_expectancy_at_birth_with_projections,"[""linear"", ""log""]",The number of years a newborn child would live if current mortality patterns were to stay the same. Medium variant projections until 2050,,Life expectancy w projections,https://docs.google.com/spreadsheet/pub?key=tiAiXcrneZrUnnJ9dBU-PAw,Life expectancy,measure,"Life expectancy at birth, with projections",projections,,
,life_expectancy_female,"[""linear"", ""log""]","Life expectancy at birth, female, with projections",,"Life expectancy, female",https://docs.google.com/spreadsheet/pub?key=12VhzicKNQCt8I4gmtBmulpfzDfnGjvFPr38g2wDcEGU,"Life expectancy, female",measure,"Life expectancy, female",health,,
,life_expectancy_male,"[""linear"", ""log""]","Life expectancy at birth, male, with projections",,"Life expectancy, male",https://docs.google.com/spreadsheet/pub?key=1iHsRp1TARpgh2CbuZGP5fj6jeY3Iz5cBLKTDlukVSHI,"Life expectancy, male",measure,"Life expectancy, male",health,,
,life_expectancy_years,"[""linear"", ""log""]",The average number of years a newborn child would live if current mortality patterns were to stay the same.,,Life expectancy,https://github.com/open-numbers/ddf--gapminder--life_expectancy,Life expectancy,measure,Life expectancy (years),"_root, health",,
,literacy_rate_adult_female_percent_of_females_ages_15_above,"[""linear"", ""log""]","Adult literacy rate is the percentage of people ages 15 and above who can, with understanding, read and write a short, simple statement on their everyday life.",,"Literacy rate, adult female",https://docs.google.com/spreadsheet/pub?key=pyj6tScZqmEc96gAEE60-Zg,Literacy rate,measure,"Literacy rate, adult female (% of females ages 15 and above)",literacy,,
,literacy_rate_adult_male_percent_of_males_ages_15_and_above,"[""linear"", ""log""]","Adult literacy rate is the percentage of people ages 15 and above who can, with understanding, read and write a short, simple statement on their everyday life.",,"Literacy rate, adult male",https://docs.google.com/spreadsheet/pub?key=pyj6tScZqmEd4fn4YYOvuOg,Literacy rate,measure,"Literacy rate, adult male (% of males ages 15 and above)",literacy,,
,literacy_rate_adult_total_percent_of_people_ages_15_and_above,"[""linear"", ""log""]","Adult literacy rate is the percentage of people ages 15 and above who can, with understanding, read and write a short, simple statement on their everyday life.",,"Literacy rate, adult total",https://docs.google.com/spreadsheet/pub?key=pyj6tScZqmEdrsBnj2ROXAg,Literacy rate,measure,"Literacy rate, adult total (% of people ages 15 and above)",literacy,,
,literacy_rate_youth_female_percent_of_females_ages_15_24,"[""linear"", ""log""]","Youth literacy rate is the percentage of people ages 15-24 who can, with understanding, read and write a short, simple statement on their everyday life.",,"Literacy rate, youth female",https://docs.google.com/spreadsheet/pub?key=pyj6tScZqmEf96wv_abR0OA,Literacy rate,measure,"Literacy rate, youth female (% of females ages 15-24)",literacy,,
,literacy_rate_youth_male_percent_of_males_ages_15_24,"[""linear"", ""log""]","Youth literacy rate is the percentage of people ages 15-24 who can, with understanding, read and write a short, simple statement on their everyday life.",,"Literacy rate, youth male",https://docs.google.com/spreadsheet/pub?key=pyj6tScZqmEe7OxrqKcSWfw,Literacy rate,measure,"Literacy rate, youth male (% of males ages 15-24)",literacy,,
,literacy_rate_youth_total_percent_of_people_ages_15_24,"[""linear"", ""log""]","Youth literacy rate is the percentage of people ages 15-24 who can, with understanding, read and write a short, simple statement on their everyday life.",,"Literacy rate, youth total",https://docs.google.com/spreadsheet/pub?key=pyj6tScZqmEepmgV0TLjBag,Literacy rate,measure,"Literacy rate, youth total (% of people ages 15-24)",literacy,,
,liver_cancer_deaths_per_100000_men,"[""linear"", ""log""]","Number of deaths due to liver cancer in 100,000 male residents during the certain year. This rate is calculated as if each country has the same age composition as the world population.",,Liver c. deaths /100k men,https://docs.google.com/spreadsheet/pub?key=phAwcNAVuyj3rojF8TmZtOw,"Liver cancer, deaths",measure,"Liver cancer, deaths per 100 000 men",cancer_male,,
,liver_cancer_deaths_per_100000_women,"[""linear"", ""log""]","Number of deaths due to liver cancer in 100,000 female residents during the certain year. This rate is calculated as if each country has the same age composition as the world population.",,Liver c. deaths /100k women,https://docs.google.com/spreadsheet/pub?key=phAwcNAVuyj2ItBsVpK9VBA,"Liver cancer, deaths",measure,"Liver cancer, deaths per 100 000 women",cancer_female,,
,liver_cancer_new_cases_per_100000_men,"[""linear"", ""log""]","Number of new cases of liver cancer in 100,000 male residents during the certain year. This rate is calculated as if each country has the same age composition as the world population.",,Liver c. new cases /100k men,https://docs.google.com/spreadsheet/pub?key=phAwcNAVuyj1u0KpZbsopCA,"Liver cancer, new cases",measure,"Liver cancer, new cases per 100 000 men",cancer_male,,
,liver_cancer_new_cases_per_100000_women,"[""linear"", ""log""]","Number of new cases of liver cancer in 100,000 female residents during the certain year. This rate is calculated as if each country has the same age composition as the world population.",,Liver c. new cases /100k women,https://docs.google.com/spreadsheet/pub?key=phAwcNAVuyj2xhaKENmyRKw,"Liver cancer, new cases",measure,"Liver cancer, new cases per 100 000 women",cancer_female,,
,liver_cancer_number_of_female_deaths,"[""linear"", ""log""]",Total number of female deaths due to liver cancer during the certain year.,,"Liver c. deaths, women",https://docs.google.com/spreadsheet/pub?key=phAwcNAVuyj2LwNOwMSnJQA,"Liver cancer, deaths",measure,"Liver cancer, deaths, women",cancer_female,,
,liver_cancer_number_of_male_deaths,"[""linear"", ""log""]",Total number of male deaths due to liver cancer during the certain year.,,"Liver c. deaths, men",https://docs.google.com/spreadsheet/pub?key=phAwcNAVuyj1RD88c3w1vNg,"Liver cancer, deaths",measure,"Liver cancer, deaths, men",cancer_male,,
,liver_cancer_number_of_new_female_cases,"[""linear"", ""log""]",Total number of new female cases of liver cancer during the certain year.,,"Liver c. new cases, women",https://docs.google.com/spreadsheet/pub?key=phAwcNAVuyj1_IYQtrqQCKQ,"Liver cancer, new cases",measure,"Liver cancer, new cases, women",cancer_female,,
,liver_cancer_number_of_new_male_cases,"[""linear"", ""log""]",Total number of new male cases of liver cancer during the certain year.,,"Liver c. new cases, men",https://docs.google.com/spreadsheet/pub?key=phAwcNAVuyj2LIYJXVW9EVw,"Liver cancer, new cases",measure,"Liver cancer, new cases, men",cancer_male,,
,long_term_unemployment_rate_percent,"[""linear"", ""log""]",Percentage of total population that has been registered as long-term unemployed during the given year.,,Long term unemployment,https://docs.google.com/spreadsheet/pub?key=rCRqVXC95LeKm_EvLrFNXKw,Long term unemployment,measure,Long term unemployment rate (%),unemployment,,
,longitude,"[""linear""]",,,,https://github.com/open-numbers/ddf--gapminder--dim_geo_countries_and_groups/blob/master/ddf--list--geo--country.csv,,measure,Longitude,_none,,
,lung_cancer_deaths_per_100000_men,"[""linear"", ""log""]","Number of deaths due to lung cancer in 100,000 male residents during the certain year. This rate is calculated as if each country has the same age composition as the world population.",,Lung c. deaths /100k men,https://docs.google.com/spreadsheet/pub?key=phAwcNAVuyj2_ibAjsuNgYA,"Lung cancer, deaths",measure,"Lung cancer, deaths per 100 000 men",cancer_male,,
,lung_cancer_deaths_per_100000_women,"[""linear"", ""log""]","Number of deaths due to lung cancer in 100,000 female residents during the certain year. This rate is calculated as if each country has the same age composition as the world population.",,Lung c. deaths /100k women,https://docs.google.com/spreadsheet/pub?key=phAwcNAVuyj2hZorcv6aVLA,"Lung cancer, deaths",measure,"Lung cancer, deaths per 100 000 women",cancer_female,,
,lung_cancer_new_cases_per_100000_men,"[""linear"", ""log""]","Number of new cases of lung cancer in 100,000 male residents during the certain year. This rate is calculated as if each country has the same age composition as the world population.",,Lung c. new cases /100k men,https://docs.google.com/spreadsheet/pub?key=phAwcNAVuyj1kCRbsnNcTVg,"Lung cancer, new cases",measure,"Lung cancer, new cases per 100 000 men",cancer_male,,
,lung_cancer_new_cases_per_100000_women,"[""linear"", ""log""]","Number of new cases of lung cancer in 100,000 female residents during the certain year. This rate is calculated as if each country has the same age composition as the world population.",,Lung c. new cases /100k women,https://docs.google.com/spreadsheet/pub?key=phAwcNAVuyj0UaQ2DNjK9Lg,"Lung cancer, new cases",measure,"Lung cancer, new cases per 100 000 women",cancer_female,,
,lung_cancer_number_of_female_deaths,"[""linear"", ""log""]",Total number of female deaths due to lung cancer during the certain year.,,"Lung c. deaths, women",https://docs.google.com/spreadsheet/pub?key=phAwcNAVuyj0RMyUI1QFfaA,"Lung cancer, deaths",measure,"Lung cancer, deaths, women",cancer_female,,
,lung_cancer_number_of_male_deaths,"[""linear"", ""log""]",Total number of male deaths due to lung cancer during the certain year.,,"Lung c. deaths, men",https://docs.google.com/spreadsheet/pub?key=phAwcNAVuyj2Az43qu-dQJQ,"Lung cancer, deaths",measure,"Lung cancer, deaths, men",cancer_male,,
,lung_cancer_number_of_new_female_cases,"[""linear"", ""log""]",Total number of new female cases of lung cancer during the certain year.,,"Lung c. new cases, women",https://docs.google.com/spreadsheet/pub?key=phAwcNAVuyj2oQAW8_53cVQ,"Lung cancer, new cases",measure,"Lung cancer, new cases, women",cancer_female,,
,lung_cancer_number_of_new_male_cases,"[""linear"", ""log""]",Total number of new male cases of lung cancer during the certain year.,,"Lung c. new cases, men",https://docs.google.com/spreadsheet/pub?key=phAwcNAVuyj0sd0z2MGpeeA,"Lung cancer, new cases",measure,"Lung cancer, new cases, men",cancer_male,,
geo,main_religion_2008,"[""ordinal""]",,"{""palette"": {""muslim"": ""#71c44c"", ""eastern_religions"": ""#f05656"", ""christian"": ""#7487ef""}, ""selectable"": false}",,https://docs.google.com/spreadsheet/pub?key=0ArtujvvFrPjVdHUzTGVicFJZQ1NjaFhqelV5SDNxMVE,,entity_set,Main religion 2008,categorizations,,
,malaria_cases_per_100000_reported,"[""linear"", ""log""]","Number of malaria cases in every 100,000 residents during the given year.",,Malaria cases /100k people,https://docs.google.com/spreadsheet/pub?key=pp59adS3CHWcGnFB9pe14OA,Malaria cases,measure,Malaria cases per 100 000 - reported,malaria,,
,malaria_deaths_in_children_1_59_months_per_1000_births,"[""log"", ""linear""]","Malaria deaths in children 1-59 months (per 1,000 births)",,Malaria deaths ‰ births,https://docs.google.com/spreadsheet/pub?key=tunqKEwokfnJMDA1g7W8KwA,Malaria deaths in children,measure,Malaria deaths in children 1-59 months (per 1000 births),causes_of_child_deaths,,
,malaria_deaths_in_children_1_59_months_total_deaths,"[""log"", ""linear""]",Malaria deaths in children 1-59 months (total deaths),,Malaria deaths,https://docs.google.com/spreadsheet/pub?key=t1Vf-4rkGlG20pYzuGib3hw,Malaria deaths in children,measure,Malaria deaths in children 1-59 months (total deaths),causes_of_child_deaths,,
,malaria_deaths_per_100000_reported,"[""linear"", ""log""]","Number of malaria deaths in every 100,000 residents during the given year.",,Malaria deaths /100k people,https://docs.google.com/spreadsheet/pub?key=pp59adS3CHWfGZUVJ2L-dCw,Malaria deaths,measure,Malaria deaths per 100 000 - reported,malaria,,
,malaria_number_of_cases_reported,"[""linear"", ""log""]",Total number of malaria cases reported during the given year.,,Malaria cases,https://docs.google.com/spreadsheet/pub?key=pp59adS3CHWczfPHQMiqxCg,Malaria cases,measure,Malaria cases - reported,malaria,,
,malaria_number_of_deaths_reported,"[""linear"", ""log""]",Total number of malaria deaths reported during the given year.,,Malaria deaths,https://docs.google.com/spreadsheet/pub?key=pp59adS3CHWfZGL9qouvTbQ,Malaria deaths,measure,Malaria deaths - reported,malaria,,
,male_agriculture_workers_percent_of_male_labour_force,"[""linear"", ""log""]",Percentage of all male labour force that works in agriculture sector.,,Male agriculture workers,https://docs.google.com/spreadsheet/pub?key=rtt_ihBgyYafmDJpThQecoA,Male agriculture workers,measure,Male agriculture workers (% of male labour force),employment_by_sector,,
,male_family_workers_percent_of_male_labour_force,"[""linear"", ""log""]",Percentage of all male labour force that works as contributing family workers.,,Male family workers,https://docs.google.com/spreadsheet/pub?key=rJMlhr2YOvL2EE5NhpbfYAg,Male family workers,measure,Male family workers (% of male labour force),employment_by_status,,
,male_industry_workers_percent_of_male_labour_force,"[""linear"", ""log""]",Percentage of all male labour force that works in industry sector.,,Male industry workers,https://docs.google.com/spreadsheet/pub?key=rmLnlLnnm2kjBbNsBZYxqow,Male industry workers,measure,Male industry workers (% of male labour force),employment_by_sector,,
,male_long_term_unemployment_rate_percent,"[""linear"", ""log""]",Percentage of male population that has been registered as long-term unemployed during the given year.,,Male long term unemployment,https://docs.google.com/spreadsheet/pub?key=rezDaYxOOBEFgR4TiPN9qtw,Male long term unemployment,measure,Male long term unemployment rate (%),unemployment,,
