geo,iso3166_1_alpha2,iso3166_1_alpha3,iso3166_1_numeric,landlocked,latitude,longitude,main_religion_2008,name,un_state,unicode_region_subtag,world_4region,world_6region
bes,BQ,BES,535,coastline,12.1833333,-68.233333,christian,"Bonaire, Sint Eustatius and Saba",FALSE,BQ,americas,america
eap,,,,,,,,East Asia and Pacific,,,,
eca,,,,,,,,Europe and Central Asia,,,,
lac,,,,,,,,Latin America and Caribbean,,,,
mena,,,,,,,,Middle East and North Africa,,,,
na,,,,,,,,North America ,,,,
sa,,,,,,,,South Asia,,,,
ssa,,,,,,,,Sub-Saharan Africa,,,,
