drill_up,scales,color,indicator_url,concept,name,tags,interpolation,name_catalog,concept_type,description,name_short,domain
,"[""log"", ""linear""]",,https://docs.google.com/spreadsheet/pub?key=pyj6tScZqmEf0IBo_AGrgKA,natural_gas_production_per_person,"Natural gas production, per person",natural_gas,,Natural gas production /person,measure,Natural gas production per person (tonnes oil equivalent),Natural gas production,
,"[""linear"", ""log""]",,https://docs.google.com/spreadsheet/pub?key=pyj6tScZqmEfv2K6dZmskWg,natural_gas_production_total,"Natural gas production, total",natural_gas,,Natural gas production,measure,Natural gas production (tonnes oil equivalent),Natural gas production,
,"[""linear"", ""log""]",,https://docs.google.com/spreadsheet/pub?key=pyj6tScZqmEc5qiv87tr3NA,natural_gas_proved_reserves_total,"Natural gas proved reserves, total",natural_gas,,Natural gas reserves,measure,Proven reserves of natural gas (tonnes oil equivalent),Natural gas proved reserves,
,"[""log"", ""linear""]",,https://docs.google.com/spreadsheet/pub?key=pyj6tScZqmEfZd6DbNF1MKA,natural_gas_proven_reserves_per_person,"Natural gas proven reserves, per person",natural_gas,,Natural gas reserves /person,measure,Natural gas proven reserves per person (tonnes oil equivalent),Natural gas proved reserves,
,"[""log"", ""linear""]",,https://docs.google.com/spreadsheet/pub?key=tqAEpy6pMtN7ULlF6uIzEog,ncd_deaths_in_children_1_59_months_per_1000_births,NCD deaths in children 1-59 months (per 1000 births),causes_of_child_deaths,,NCD deaths ‰ births,measure,"NCD deaths in children 1-59 months (per 1,000 births)",NCD deaths in children,
,"[""log"", ""linear""]",,https://docs.google.com/spreadsheet/pub?key=tfmFGk3PIvTgimegQiHOtSQ,ncd_deaths_in_children_1_59_months_total_deaths,NCD deaths in children 1-59 months (total deaths),causes_of_child_deaths,,NCD deaths,measure,NCD deaths in children 1-59 months (total deaths),NCD deaths in children,
,"[""linear"", ""log""]",,https://docs.google.com/spreadsheet/pub?key=pyj6tScZqmEe5SueBIj6eSw,net_barter_terms_of_trade_2000_100,Net barter terms of trade (2000 = 100),advanced_debt_trade,,Net barter terms of trade,measure,"Net barter terms of trade index is calculated as the percentage ratio of the export unit value indexes to the import unit value indexes, measured relative to the base year 2000. Unit value indexes are based on data reported by countries that demonstrate consistency under UNCTAD quality controls, supplemented by UNCTAD's estimates using the previous yearâs trade values at the Standard International Trade Classification three-digit level as weights. To improve data coverage, especially for the latest periods, UNCTAD constructs a set of average prices indexes at the three-digit product classification of the Standard International Trade Classification revision 3 using UNCTADâs Commodity Price Statistics, internaÂ­tional and national sources, and UNCTAD secretariat estimates and calculates unit value indexes at the country level using the current year's trade values as weights.",Net barter terms of trade,
,"[""log"", ""linear""]",,https://docs.google.com/spreadsheet/pub?key=0ArfEDsV3bBwCdERQeFplM2VWczVrMTFfMXVrQkJpVXc,new_births_total_number_estimated,"New births (total number, estimated)",population_growth,,New births,measure,"Total number of estimated new births during the given year, based on the crude birth rate data from UN Population Division and the population data from Gapminder Foundation.",New births,
,"[""linear"", ""log""]",,https://docs.google.com/spreadsheet/pub?key=1iTvolhgIMta3MmsoPkGnewJiaybev3MvR9e_7mxZ48o,newborn_deaths,Newborn deaths,newborn_infants,,Newborn deaths,measure,Neonatal deaths Children dying within the first 28 days.,Newborn deaths,
,"[""linear"", ""log""]",,https://docs.google.com/spreadsheet/pub?key=1S3Kcw96vp5-fZbaM7Lck_06IbJ8DagThGI5KHnzeSps,newborn_mortality_rate_per_1000,Newborn mortality rate per 1000,newborn_infants,,Newborn mortality rate,measure,Neonatal mortality rate. Children dying within the first 28 days per 1000 live births.,Newborn mortality rate,
,"[""linear"", ""log""]",,https://docs.google.com/spreadsheet/pub?key=0ArfEDsV3bBwCdFk2WGhwakxTQkt4NUtTdFJDSlFHQ3c,newly_hiv_infected_number_all_ages,"Newly HIV infected (number, all ages)",hiv,,Newly HIV infected,measure,The total number of persons in all ages that are estimated to be newly infected with HIV during the given year.,Newly HIV infected,
,"[""linear"", ""log""]",,https://docs.google.com/spreadsheet/pub?key=0ArfEDsV3bBwCdDREUkRSRDJtQmFNTE1TYmRYX1pFNEE,newly_hiv_infected_percent_age_15_49,"Newly HIV infected (%, age 15-49)",hiv,,"Newly HIV infected (%, age 15-49)",measure,The estimated percentage of adults aged 15 to 49 years that are newly infected with HIV during the given year.,Newly HIV infected,
,"[""linear"", ""log""]",,https://docs.google.com/spreadsheet/pub?key=t28UhT9IaWINamciSiJIS7w,nuclear_power_generation_per_person,"Nuclear electricity production, per person",nuclear,,Nuclear electricity production /person,measure,"The amount of electricity produced by nuclear power plants per person in a given year, counted in tonnes of oil equivalent (toe).",Nuclear electricity production,
,"[""linear"", ""log""]",,https://docs.google.com/spreadsheet/pub?key=trRb8ZIaBOD4KzikShshZ2g,nuclear_power_generation_total,"Nuclear electricity production, total",nuclear,,Nuclear electricity production,measure,"The amount of electricity produced by nuclear power plants in a given year, counted in tonnes of oil equivalent (toe).",Nuclear electricity production,
,,,,number,Number,_none,,,string,,,
,"[""linear"", ""log""]",,https://docs.google.com/spreadsheet/pub?key=0ArfEDsV3bBwCdGhSY2trbEVpYnNsMENqendaVm5ucnc,number_of_child_deaths,Number of child deaths,health,,Number of child deaths,measure,The number of children dying before age 5,Number of child deaths,
,"[""linear"", ""log""]",,https://docs.google.com/spreadsheet/pub?key=1edXplIOkF3Y5OuEWp_aVapd92-OD5aVFAPECZLgP8cA,number_of_people_in_poverty,Number of people in poverty,poverty_inequality,,Number of people in poverty,measure,Number of the poor population in millions living on less than $1.25 a day at 2005 international prices. Povcal data,Number of people in poverty,
,"[""linear"", ""log""]",,https://docs.google.com/spreadsheet/pub?key=0ArfEDsV3bBwCdERNZmlfUGM5YVE3bmEwODdlRDFqSkE,oil_consumption_per_cap,"Oil consumption, per person",oil,,Oil consumption /person,measure,Oil Consumption per capita (tonnes per year per person),Oil consumption,
,"[""linear"", ""log""]",,https://docs.google.com/spreadsheet/pub?key=pyj6tScZqmEcm0fIa0IVtKw,oil_consumption_total,"Oil consumption, total",oil,,Oil consumption,measure,Total amount of crude oil consumption (tonnes oil equivalent),Oil consumption,
,"[""linear"", ""log""]",,https://docs.google.com/spreadsheet/pub?key=pyj6tScZqmEeUgUuvuJTONQ,oil_production_per_person,"Oil production, per person",oil,,Oil production /person,measure,Crude oil production per person (tonnes oil equivalent),Oil production,
,"[""linear"", ""log""]",,https://docs.google.com/spreadsheet/pub?key=pyj6tScZqmEdNIa3ckVXaCQ,oil_production_total,"Oil production, total",oil,,Oil production,measure,Total amount of crude oil production (tonnes oil equivalent),Oil production,
,"[""linear"", ""log""]",,https://docs.google.com/spreadsheet/pub?key=pyj6tScZqmEfJfS1WYrLeBA,oil_proved_reserves_total,"Oil proved reserves, total",oil,,Oil proved reserves,measure,Proven reserves of oil (tonnes oil equivalent),Oil proved reserves,
,"[""log"", ""linear""]",,https://docs.google.com/spreadsheet/pub?key=pyj6tScZqmEfrI4YlDJDUag,oil_proven_reserves_per_person,"Oil proven reserves, per person",oil,,Oil proven reserves /person,measure,Oil proven reserves per person (tonnes oil equivalent),Oil proved reserves,
,"[""log"", ""linear""]",,https://docs.google.com/spreadsheet/pub?key=phAwcNAVuyj0npaJxInyYDg,old_version_of_income_per_person_version_3,Old version of Income per person (version 3),alternative_gdp_data,,Old version of Income per person (version 3),measure,"The version of Income per person used before 22 december 2008 (version 3). Gross Domestic Product per person by Purchasing Power Parities (in international dollars, fixed 1990 prices).",Old version of Income per person (version 3),
,"[""log"", ""linear""]",,https://docs.google.com/spreadsheet/pub?key=0ArfEDsV3bBwCdE5xWmcyYVZJQzJvOFpZUklqX3lkSkE,old_version_of_income_per_person_version_8,Old version of Income per person (version 8),alternative_gdp_data,,Old version of Income per person (version 8),measure,"The version of Income per person used before 12 july 2010 (version 8). Gross Domestic Product per person by Purchasing Power Parities (in international dollars, fixed 2050 prices).",Old version of Income per person (version 8),
,"[""log"", ""linear""]",,https://docs.google.com/spreadsheet/pub?key=tiYIen5OQP0fKiQbg6g8VyA,other_deaths_in_newborn_per_1000_births,Other deaths in newborn (per 1000 births),causes_of_newborn_deaths,,Other deaths ‰ births,measure,"Other deaths in newborn (per 1,000 births)",Other deaths in newborn,
,"[""log"", ""linear""]",,https://docs.google.com/spreadsheet/pub?key=tyPO4OLCIZtK5zcdkafcHMA,other_deaths_in_newborn_total_deaths,Other deaths in newborn (total deaths),causes_of_newborn_deaths,,Other deaths,measure,Other deaths in newborn (total deaths),Other deaths in newborn,
,"[""log"", ""linear""]",,https://docs.google.com/spreadsheet/pub?key=tVAqgYwCDZfcq9jSCI87SAw,other_infections_deaths_in_children_1_59_months_per_1000_birt,Other infections deaths in children 1-59 months (per 1000 births),causes_of_child_deaths,,Other infections deaths ‰ births,measure,"Other infections deaths in children 1-59 months (per 1,000 births)",Other infections deaths,
,"[""log"", ""linear""]",,https://docs.google.com/spreadsheet/pub?key=tiehFos6jB-lekEAH028deA,other_infections_deaths_in_children_1_59_months_total_deaths,Other infections deaths in children 1-59 months (total deaths),causes_of_child_deaths,,Other infections deaths,measure,Other infections deaths in children 1-59 months (total deaths),Other infections deaths,
,"[""linear"", ""log""]",,https://docs.google.com/spreadsheet/pub?key=tqjUijP4mi_dHKkCZjOn0oA,other_social_services_aid_given_percent_of_aid,Other social services aid given (% of aid),aid_given,,Other social services aid given,measure,Percentage of total allocable aid for official development assistance (ODA) given by the donor countries that has been used in other social infrastructures and services.,Other social services aid given,
,"[""linear"", ""log""]",,https://docs.google.com/spreadsheet/pub?key=tXf6_OUYVmyEMZo0g4DQw6w,out_of_pocket_share_of_total_health_spending_percent,Out-of-pocket total health spending share (%),health_economics,,Out-of-pocket total health spending,measure,Proportion of total health expenditures that has been paid directly out-of-pocket by individuals.,Out-of-pocket total health spending,
,"[""linear"", ""log""]",,https://docs.google.com/spreadsheet/pub?key=tnvxVX8aOAl0dwDNujbELPQ,pab_immunized_percent_of_newborns,PAB immunized (% of newborns),vaccine,,PAB immunized,measure,Percentage of neonates in a given year that can be considered as having been protected against tetanus as a result of maternal immunization.,PAB immunized,
,,,,pandg,pandg,_none,,,string,,,
,,,,parent,Tag Parent,_none,,,string,,,
,"[""linear"", ""log""]",,https://docs.google.com/spreadsheet/pub?key=pyj6tScZqmEd5FA9xlfO9eA,patent_applications_total,Patent applications (total),economic_situation,,Patent applications,measure,Patents are documents issued by a government office that describe an invention and create a legal situation in which the patented invention can normally be exploited only by or with the authorization of the patent holder. The protection is generally limited to 20 years.,Patent applications,
,"[""linear"", ""log""]",,https://docs.google.com/spreadsheet/pub?key=pyj6tScZqmEdMioz5VJKXHw,patents_granted_total,Patents granted (total),economic_situation,,Patents granted,measure,Patents are documents issued by a government office that describe an invention and create a legal situation in which the patented invention can normally be exploited only by or with the authorization of the patent holder. The protection is generally limited to 20 years.,Patents granted,
,"[""linear"", ""log""]",,https://docs.google.com/spreadsheet/pub?key=pyj6tScZqmEe371ZVZl73eA,patents_in_force_total,Patents in force (total),economic_situation,,Patents in force,measure,Patents are documents issued by a government office that describe an invention and create a legal situation in which the patented invention can normally be exploited only by or with the authorization of the patent holder. The protection is generally limited to 20 years.,Patents in force,
,"[""log"", ""linear""]",,https://docs.google.com/spreadsheet/pub?key=pyj6tScZqmEe1GaiYJX2qGA,people_living_with_hiv_number_all_ages,"People living with HIV (number, all ages)",hiv,,People living with HIV,measure,"The total number of persons in all ages that are estimated to be infected by HIV, including those without symptoms, those sick from AIDS and those healthy due to treatment of the HIV infection",People living with HIV,
,"[""linear"", ""log""]",,https://docs.google.com/spreadsheet/pub?key=pyj6tScZqmEdFW4nUY4gQdA,personal_computers_per_100_people,Personal computers (per 100 people),communication,,Personal computers /100 people,measure,Personal computers (per 100 people),Personal computers,
,"[""log"", ""linear""]",,https://docs.google.com/spreadsheet/pub?key=pyj6tScZqmEfUXdC83YSzfw,personal_computers_total,Personal computers (total),communication,,Personal computers,measure,Personal computers (total),Personal computers,
,"[""log"", ""linear""]",,https://docs.google.com/spreadsheet/pub?key=t4RbfeK6Dtt2srxw4REoXxQ,pertussis_deaths_in_children_1_59_months_per_1000_births,Pertussis deaths in children 1-59 months (per 1000 births),causes_of_child_deaths,,Pertussis deaths ‰ births,measure,"Pertussis deaths in children 1-59 months (per 1,000 births)",Pertussis deaths in children,
,"[""log"", ""linear""]",,https://docs.google.com/spreadsheet/pub?key=tdOlzqGxVdDnnCpfWyyGX1A,pertussis_deaths_in_children_1_59_months_total_deaths,Pertussis deaths in children 1-59 months (total deaths),causes_of_child_deaths,,Pertussis deaths,measure,Pertussis deaths in children 1-59 months (total deaths),Pertussis deaths in children,
,"[""log"", ""linear""]",,https://docs.google.com/spreadsheet/pub?key=rhbS3kWOfMzvY4ofUFoeFJg,plane_crash_affected_annual_number,Plane crash affected annual number,disasters,,Plane crash affected,measure,"Total number of people getting affected, injured or killed in air accidents during the given year.",Plane crash affected,
,"[""linear"", ""log""]",,https://docs.google.com/spreadsheet/pub?key=rSv5aMDwESiKg-yA__-tRFg,plane_crash_deaths_annual_number,Plane crash deaths annual number,disasters,,Plane crash deaths,measure,Number of people killed in air accidents during the given year.,Plane crash deaths,
,"[""log"", ""linear""]",,https://docs.google.com/spreadsheet/pub?key=pp59adS3CHWc4aJd9fV8zZg,planted_forest_area_ha,Planted forest area (ha),forestry,,Planted forest area,measure,"Total area of forest land (hectares) established through planting or seeding, basically of introduced species and in some cases native species.",Planted forest area,
,"[""log"", ""linear""]",,https://docs.google.com/spreadsheet/pub?key=tCe8N5KXAYCJteQokAqVM_A,pneumonia_deaths_in_children_1_59_months_per_1000_births,Pneumonia deaths in children 1-59 months (per 1000 births),causes_of_child_deaths,,Pneumonia deaths ‰ births,measure,"Pneumonia deaths in children 1-59 months (per 1,000 births)",Pneumonia deaths in children,
,"[""log"", ""linear""]",,https://docs.google.com/spreadsheet/pub?key=tcYkTk6KMHsrXzcM9WyUxbw,pneumonia_deaths_in_children_1_59_months_total_deaths,Pneumonia deaths in children 1-59 months (total deaths),causes_of_child_deaths,,Pneumonia deaths in children,measure,Pneumonia deaths in children 1-59 months (total deaths),Pneumonia deaths in children,
,"[""log"", ""linear""]",,https://docs.google.com/spreadsheet/pub?key=tOXHWd6PcUGK3Dg-k2N8Clw,pneumonia_deaths_in_newborn_per_1000_births,Pneumonia deaths in newborn (per 1000 births),causes_of_newborn_deaths,,Pneumonia deaths ‰ births,measure,"Pneumonia deaths in newborn (per 1,000 births)",Pneumonia deaths in newborn,
,"[""log"", ""linear""]",,https://docs.google.com/spreadsheet/pub?key=tjvbVGhVx7YCk1uguLrkaag,pneumonia_deaths_in_newborn_total_deaths,Pneumonia deaths in newborn (total deaths),causes_of_newborn_deaths,,Pneumonia deaths in newborn,measure,Pneumonia deaths in newborn (total deaths),Pneumonia deaths in newborn,
,"[""linear"", ""log""]",,https://docs.google.com/spreadsheet/pub?key=0AgogXXPMARyldGhVLXVsSTB0aDY2eXdLaEt1T0psdXc,poisonings_deaths_per_100000_people,"Poisonings, deaths (per 100 000 people)",injuries_and_accidents,,"Poisonings, deaths /100k people",measure,"Unintentional poisonings, age-adjusted mortality per 100 000 standard population. This rate is calculated as if all countries had the same age composition of the population.","Poisonings, deaths",
,"[""linear"", ""log""]",,https://docs.google.com/spreadsheet/pub?key=rsOONWhmGBtzb4j__0MJv7Q,population_aged_0_4_years_both_sexes_percent,"Population aged 0-4, both sexes (%)",both_sexes_by_age,,"Population aged 0-4, (%)",measure,Number of both sexes aged 0-4 years divided by total population,Population aged 0-4,
,"[""linear"", ""log""]",,https://docs.google.com/spreadsheet/pub?key=roLpNPQkooNCFzpTWXQ48Dw,population_aged_0_4_years_female_percent,"Population aged 0-4, female (%)",female_by_age,,"Population aged 0-4, F (%)",measure,Number of women aged 0-4 years divided by total number of women,Population aged 0-4,
,"[""linear"", ""log""]",,https://docs.google.com/spreadsheet/pub?key=rIpDsoI9lVTCh_PRqm66Tcw,population_aged_0_4_years_male_percent,"Population aged 0-4, male (%)",male_by_age,,"Population aged 0-4, M (%)",measure,Number of men aged 0-4 years divided by total number of men,Population aged 0-4,
,"[""linear"", ""log""]",,https://docs.google.com/spreadsheet/pub?key=rovrK0Uj9JPN95P9adob0tw,population_aged_0_4_years_total_number,"Population aged 0-4, total number",both_sexes_by_age_total,,"Population aged 0-4, total",measure,Total number of people aged 0-4 years,Population aged 0-4,
,"[""linear"", ""log""]",,https://docs.google.com/spreadsheet/pub?key=rmViJSkPd4xZneV2Q6gzFwQ,population_aged_10_14_years_both_sexes_percent,"Population aged 10-14, both sexes (%)",both_sexes_by_age,,"Population aged 10-14, (%)",measure,Number of both sexes aged 10-14 years divided by total population,Population aged 10-14,
,"[""linear"", ""log""]",,https://docs.google.com/spreadsheet/pub?key=rJwVmwTFzheqVUzYWwSqXlA,population_aged_10_14_years_female_percent,"Population aged 10-14, female (%)",female_by_age,,"Population aged 10-14, F (%)",measure,Number of women aged 10-14 years divided by total number of women,Population aged 10-14,
,"[""linear"", ""log""]",,https://docs.google.com/spreadsheet/pub?key=rmQZ_H88rIhF3315QBZpcIQ,population_aged_10_14_years_male_percent,"Population aged 10-14, male (%)",male_by_age,,"Population aged 10-14, M (%)",measure,Number of men aged 10-14 years divided by total number of men,Population aged 10-14,
,"[""linear"", ""log""]",,https://docs.google.com/spreadsheet/pub?key=r9ztOSMb5WNHUBLwlgJqPSw,population_aged_10_14_years_total_number,"Population aged 10-14, total number",both_sexes_by_age_total,,"Population aged 10-14, total",measure,Total number of people aged 10-14 years,Population aged 10-14,
,"[""linear"", ""log""]",,https://docs.google.com/spreadsheet/pub?key=r4VUu4a4AaWqXXoAsFz-z-Q,population_aged_15_19_years_both_sexes_percent,"Population aged 15-19, both sexes (%)",both_sexes_by_age,,"Population aged 15-19, (%)",measure,Number of both sexes aged 15-19 years divided by total population,Population aged 15-19,
,"[""linear"", ""log""]",,https://docs.google.com/spreadsheet/pub?key=rYEHWlJHaLjHtcsSpRRJeig,population_aged_15_19_years_female_percent,"Population aged 15-19, female (%)",female_by_age,,"Population aged 15-19, F (%)",measure,Number of women aged 15-19 years divided by total number of women,Population aged 15-19,
,"[""linear"", ""log""]",,https://docs.google.com/spreadsheet/pub?key=rYfw4UJZSizLRtgDs73d5jA,population_aged_15_19_years_male_percent,"Population aged 15-19, male (%)",male_by_age,,"Population aged 15-19, M (%)",measure,Number of men aged 15-19 years divided by total number of men,Population aged 15-19,
,"[""linear"", ""log""]",,https://docs.google.com/spreadsheet/pub?key=rFmJvuotJYE30q4nWEvpGJA,population_aged_15_19_years_total_number,"Population aged 15-19, total number",both_sexes_by_age_total,,"Population aged 15-19, total",measure,Total number of people aged 15-19 years,Population aged 15-19,
,"[""linear"", ""log""]",,https://docs.google.com/spreadsheet/pub?key=rTU20DXn0Bi7bTwW5T6J3gg,population_aged_20_39_years_both_sexes_percent,"Population aged 20-39, both sexes (%)",both_sexes_by_age,,"Population aged 20-39, (%)",measure,Number of both sexes aged 20-39 years divided by total population,Population aged 20-39,
,"[""linear"", ""log""]",,https://docs.google.com/spreadsheet/pub?key=rWpQHQIQdntj6BEK8OIuWYw,population_aged_20_39_years_female_percent,"Population aged 20-39, female (%)",female_by_age,,"Population aged 20-39, F (%)",measure,Number of women aged 20-39 years divided by total number of women,Population aged 20-39,
,"[""linear"", ""log""]",,https://docs.google.com/spreadsheet/pub?key=rab1GmqpzJkWd4MF0hieVgA,population_aged_20_39_years_male_percent,"Population aged 20-39, male (%)",male_by_age,,"Population aged 20-39, M (%)",measure,Number of men aged 20-39 years divided by total number of men,Population aged 20-39,
,"[""linear"", ""log""]",,https://docs.google.com/spreadsheet/pub?key=rHrin819tHgZudARnpsN0Mg,population_aged_20_39_years_total_number,"Population aged 20-39, total number",both_sexes_by_age_total,,"Population aged 20-39, total",measure,Total number of people aged 20-39 years,Population aged 20-39,
,"[""linear"", ""log""]",,https://docs.google.com/spreadsheet/pub?key=rLwpdKbW2OykBbvVxhYKrhA,population_aged_40_59_years_both_sexes_percent,"Population aged 40-59, both sexes (%)",both_sexes_by_age,,"Population aged 40-59, (%)",measure,Number of both sexes aged 40-59 years divided by total population,Population aged 40-59,
,"[""linear"", ""log""]",,https://docs.google.com/spreadsheet/pub?key=rElErbmOnSM6om03a1uinKQ,population_aged_40_59_years_female_percent,"Population aged 40-59, female (%)",female_by_age,,"Population aged 40-59, F (%)",measure,Number of women aged 40-59 years divided by total number of women,Population aged 40-59,
,"[""linear"", ""log""]",,https://docs.google.com/spreadsheet/pub?key=rcQkob1yAm-to1scz51flgw,population_aged_40_59_years_male_percent,"Population aged 40-59, male (%)",male_by_age,,"Population aged 40-59, M (%)",measure,Number of men aged 40-59 years divided by total number of men,Population aged 40-59,
,"[""linear"", ""log""]",,https://docs.google.com/spreadsheet/pub?key=ri9SXMNc7TpebHucmAYepGQ,population_aged_40_59_years_total_number,"Population aged 40-59, total number",both_sexes_by_age_total,,"Population aged 40-59, total",measure,Total number of people aged 40-59 years,Population aged 40-59,
,"[""linear"", ""log""]",,https://docs.google.com/spreadsheet/pub?key=rC5UskPU6PRVlmN7eXoridw,population_aged_5_9_years_both_sexes_percent,"Population aged 5-9, both sexes (%)",both_sexes_by_age,,"Population aged 5-9, (%)",measure,Number of both sexes aged 5-9 years divided by total population,Population aged 5-9,
,"[""linear"", ""log""]",,https://docs.google.com/spreadsheet/pub?key=re3efChATTYAT5bRqoaChXA,population_aged_5_9_years_female_percent,"Population aged 5-9, female (%)",female_by_age,,"Population aged 5-9, F (%)",measure,Number of women aged 5-9 years divided by total number of women,Population aged 5-9,
,"[""linear"", ""log""]",,https://docs.google.com/spreadsheet/pub?key=rgyZrNmSfXcPJQxJK7IxnEw,population_aged_5_9_years_male_percent,"Population aged 5-9, male (%)",male_by_age,,"Population aged 5-9, M (%)",measure,Number of men aged 5-9 years divided by total number of men,Population aged 5-9,
,"[""linear"", ""log""]",,https://docs.google.com/spreadsheet/pub?key=r83X3yfjC6ENYWoo41yDehg,population_aged_5_9_years_total_number,"Population aged 5-9, total number",both_sexes_by_age_total,,"Population aged 5-9, total",measure,Total number of people aged 5-9 years,Population aged 5-9,
,"[""linear"", ""log""]",,https://docs.google.com/spreadsheet/pub?key=rH6TEe8f_WNq_8x9pWZ3W0A,population_aged_60plus_years_both_sexes_percent,"Population aged 60+, both sexes (%)",both_sexes_by_age,,"Population aged 60+, (%)",measure,Number of both sexes aged above 60 years divided by total population,Population aged 60+,
,"[""linear"", ""log""]",,https://docs.google.com/spreadsheet/pub?key=rjhBvpeRgCxBq0EnQVN6b0w,population_aged_60plus_years_female_percent,"Population aged 60+, female (%)",female_by_age,,"Population aged 60+, F (%)",measure,Number of women aged above 60 years divided by total number of women,Population aged 60+,
,"[""linear"", ""log""]",,https://docs.google.com/spreadsheet/pub?key=rSkhGgUVN74knEhSAhBSSKA,population_aged_60plus_years_male_percent,"Population aged 60+, male (%)",male_by_age,,"Population aged 60+, M (%)",measure,Number of men aged above 60 years divided by total number of men,Population aged 60+,
,"[""linear"", ""log""]",,https://docs.google.com/spreadsheet/pub?key=rVD6A2uAmeIE0BQNW1KSg3A,population_aged_60plus_years_total_number,"Population aged 60+, total number",both_sexes_by_age_total,,"Population aged 60+, total",measure,Total number of people aged above 60 years,Population aged 60+,
