drill_up,scales,color,indicator_url,concept,name,tags,interpolation,name_catalog,concept_type,description,name_short,domain
,"[""linear"", ""log""]",,https://docs.google.com/spreadsheet/pub?key=trzLWJQU4SZMDpeVg3XnL5A,income_share_of_poorest_10percent,Income share of poorest 10%,poverty_inequality,,Income share of poorest 10%,measure,Percentage share of income or consumption is the share that accrues to subgroups of population indicated by deciles or quintiles.,Income share of poorest 10%,
,"[""linear"", ""log""]",,https://docs.google.com/spreadsheet/pub?key=pyj6tScZqmEdIyrBS31XAaw,income_share_of_poorest_20percent,Income share of poorest 20%,poverty_inequality,,Income share of poorest 20%,measure,Percentage share of income or consumption is the share that accrues to subgroups of population indicated by deciles or quintiles. Percentage shares by quintile may not sum to 100 because of rounding.,Income share of poorest 20%,
,"[""linear"", ""log""]",,https://docs.google.com/spreadsheet/pub?key=tmKvydPl_roGIQBrMYA6C4g,income_share_of_richest_10percent,Income share of richest 10%,poverty_inequality,,Income share of richest 10%,measure,Percentage share of income or consumption is the share that accrues to subgroups of population indicated by deciles or quintiles.,Income share of richest 10%,
,"[""linear"", ""log""]",,https://docs.google.com/spreadsheet/pub?key=tLnCxItXzRSu9gH-5PyEFDw,income_share_of_richest_20percent,Income share of richest 20%,poverty_inequality,,Income share of richest 20%,measure,Percentage share of income or consumption is the share that accrues to subgroups of population indicated by deciles or quintiles. Percentage shares by quintile may not sum to 100 because of rounding.,Income share of richest 20%,
,,,,indicator_url,Indicator url,_none,,,string,,,
,"[""linear"", ""log""]",,https://docs.google.com/spreadsheet/pub?key=rGKP-BBylLOM11iGahW1lxA,industrial_water_withdrawal_percent_of_total,Industrial water withdrawal (% of total),environment_water,,Industrial water withdrawal,measure,"Percentage of the total water withdrawal used in industry, including renewable water resources as well as potential over-abstraction of renewable groundwater or withdrawal of fossil groundwater and potential use of desalinated water or treated wastewater. Usually, this sector refers to self-supplied industries not connected to any distribution network. The ratio between net consumption and withdrawal is estimated at less than 5%.",Industrial water withdrawal,
,"[""linear"", ""log""]",,https://docs.google.com/spreadsheet/pub?key=0AkBd6lyS3EmpdHA2UEFOYTlUTWtzV29xbHFuMU00SFE,industry_percent_of_gdp,Industry (% of GDP),sectors,,Industry (% of GDP),measure,"Industry corresponds to ISIC divisions 10-45 and includes manufacturing (ISIC divisions 15-37). It comprises value added in mining, manufacturing (also reported as a separate subgroup), construction, electricity, water, and gas. Value added is the net output of a sector after adding up all outputs and subtracting intermediate inputs. It is calculated without making deductions for depreciation of fabricated assets or depletion and degradation of natural resources. The origin of value added is determined by the International Standard Industrial Classification (ISIC), revision 3. Note: For VAB countries, gross value added at factor cost is used as the denominator.",Industry (% of GDP),
,"[""linear"", ""log""]",,https://docs.google.com/spreadsheet/pub?key=rqcJTExcUqNdolB-7flqebQ,industry_workers_percent_of_labour_force,Industry workers (% of labour force),employment_by_sector,,Industry workers,measure,Percentage of all labour force that works in industry sector.,Industry workers,
,"[""linear"", ""log""]",,https://docs.google.com/spreadsheet/pub?key=pyj6tScZqmEcjeKHnZq6RIg,inequality_index_gini,Inequality index (Gini),poverty_inequality,,Inequality index (Gini),measure,"Gini index measures the extent to which the distribution of income (or, in some cases, consumption expenditure) among individuals or households within an economy deviates from a perfectly equal distribution. A Lorenz curve plots the cumulative percentages of total income received against the cumulative number of recipients, starting with the poorest individual or household. The Gini index measures the area between the Lorenz curve and a hypothetical line of absolute equality, expressed as a percentage of the maximum area under the line. Thus a Gini index of 0 represents perfect equality, while an index of 100 implies perfect inequality.",Inequality index (Gini),
,"[""log"", ""linear""]",,https://docs.google.com/spreadsheet/pub?key=phAwcNAVuyj0NpF2PTov2Cw,infant_mortality_rate_per_1000_births,Infant mortality (rate per 1000 births),newborn_infants,,Infant mortality,measure,Deaths of children during first year of life (per 1000 live births).,Infant mortality,
,"[""linear"", ""log""]",,https://docs.google.com/spreadsheet/pub?key=rDb6EYc4YUTBRfXlBvjHYlg,infectious_tb_detection_rate_percent,"TB detection rate (%), infectious TB",tb_tuberculosis,,"TB detection rate, infectious TB",measure,The proportion of estimated new smear-positive cases of TB detected (diagnosed and then notified to WHO) by health facilities in the country during the given year.,TB detection rate (%),
,"[""linear"", ""log""]",,https://docs.google.com/spreadsheet/pub?key=rjGHot8B6YSt3kPYEG8nANA,infectious_tb_detection_rate_percent_dots_only,"TB detection rate (%), infectious - DOTS only",tb_tuberculosis,,"TB detection rate, infectious - DOTS only",measure,"The proportion of estimated new smear-positive cases of TB detected (diagnosed and then notified to WHO) during the given year by DOTS programme, which is national TB programmes in finding and diagnosing people with TB.",TB detection rate (%),
,"[""linear"", ""log""]",,https://docs.google.com/spreadsheet/pub?key=rVyfxaPK4dJ9B6ZdgG34F-g,infectious_tb_new_cases_per_100000_estimated,"TB new cases per 100 000, estimated, infectious TB",tb_tuberculosis,,"TB new cases /100k, estimated, infectious TB",measure,"Estimated number of new TB cases (infectious) among 100,000 residents during the given year.",TB new cases per 100 000,
,"[""linear"", ""log""]",,https://docs.google.com/spreadsheet/pub?key=r0pD5wznwEUJ0ipdxAWQjiA,infectious_tb_new_cases_per_100000_reported,"TB new cases per 100 000, reported, infectious TB",tb_tuberculosis,,"TB new cases /100k, reported, infectious TB",measure,"Reported number of new TB cases (infectious) among 100,000 residents during the given year.",TB new cases per 100 000,
,"[""log"", ""linear""]",,https://docs.google.com/spreadsheet/pub?key=rOPfJcbTTIyS-vxDWbkfNLA,infectious_tb_number_of_new_cases_estimated,"TB new cases, estimated, infectious TB",tb_tuberculosis,,"TB new cases, estimated, infectious TB",measure,Estimated number of new TB cases (infectious) during the given year.,TB new cases,
,"[""log"", ""linear""]",,https://docs.google.com/spreadsheet/pub?key=rcbx0R-TXbkqRCyvKzn08fg,infectious_tb_number_of_new_cases_reported,"TB new cases, reported, infectious TB",tb_tuberculosis,,"TB new cases, reported, infectious TB",measure,Reported number of new TB cases (infectious) during the given year.,TB new cases,
,"[""linear"", ""log""]",,https://docs.google.com/spreadsheet/pub?key=rewICFMTvBuer8UoJIK0yUg,infectious_tb_treatment_dots_completed_percent,"Treatment (DOTS) completed (%), infectious TB",tb_tuberculosis,,"Treatment (DOTS) completed, infectious TB",measure,Percentage of all patients with infectious TB detected by DOTS programme that have finished the treatment during the given year.,Treatment (DOTS) completed,
,"[""linear"", ""log""]",,https://docs.google.com/spreadsheet/pub?key=0AkBd6lyS3EmpdGJoOUJXalk3STFYUG85MkxlbnQxMmc,inflation_annual_percent,Inflation (annual %),economic_situation,,Inflation,measure,Inflation as measured by the annual growth rate of the GDP implicit deflator shows the rate of price change in the economy as a whole. The GDP implicit deflator is the ratio of GDP in current local currency to GDP in constant local currency.,Inflation,
,"[""log"", ""linear""]",,https://docs.google.com/spreadsheet/pub?key=tfOi0Ji7pJDJbxJVqwJXj9g,injury_deaths_in_children_1_59_months_per_1000_births,Injury deaths in children 1-59 months (per 1000 births),causes_of_child_deaths,,Injury deaths ‰ births,measure,"Injury deaths in children 1-59 months (per 1,000 births)",Injury deaths in children,
,"[""log"", ""linear""]",,https://docs.google.com/spreadsheet/pub?key=tnRIpcH0InZUFz7f2ziXKog,injury_deaths_in_children_1_59_months_total_deaths,Injury deaths in children 1-59 months (total deaths),causes_of_child_deaths,,"Injury deaths in children, total",measure,Injury deaths in children 1-59 months (total deaths),Injury deaths in children,
,"[""linear"", ""log""]",,https://docs.google.com/spreadsheet/pub?key=riLRFECHMsTq7OTa2KYZCWA,internal_renewable_water_cu_meters_per_person,Internal renewable water (cu meters per person),environment_water,,Internal renewable water,measure,Quantity of internal renewable water resources per person per year in cubic meters. Internal Renewable Water Resources (IRWR): Long-term average annual flow of rivers and recharge of aquifers generated from endogenous precipitation. Double counting of surface water and groundwater resources is avoided by deducting the overlap from the sum of the surface water and groundwater resources.,Internal renewable water,
,"[""linear"", ""log""]",,https://docs.google.com/spreadsheet/pub?key=0AkBd6lyS3EmpdGwzSGV5OE9FOGhURlhTdEQtMW1TNkE,internet_users_per_100_people,Internet users (per 100 people),communication,,Internet users /100 people,measure,Internet users are people with access to the worldwide network.,Internet users,
,"[""linear"", ""log""]",,https://docs.google.com/spreadsheet/pub?key=0AkBd6lyS3EmpdC1PcWJUZldDelFyQXdaOEtDUG9HSUE,internet_users_total_number,Internet users (total),communication,,Internet users,measure,Internet users are people with access to the worldwide network.,Internet users,
,,,,interpolation,interpolation,_none,,,string,,,
,"[""linear"", ""log""]",,https://docs.google.com/spreadsheet/pub?key=0AkBd6lyS3EmpdG9sVVF6dHpGdnhQU3BkMlAtNHFwVkE,investments_percent_of_gdp,Investments (% of GDP),economic_situation,,Investments,measure,"Gross capital formation (formerly gross domestic investment) consists of outlays on additions to the fixed assets of the economy plus net changes in the level of inventories. Fixed assets include land improvements (fences, ditches, drains, and so on); plant, machinery, and equipment purchases; and the construction of roads, railways, and the like, including schools, offices, hospitals, private residential dwellings, and commercial and industrial buildings. Inventories are stocks of goods held by firms to meet temporary or unexpected fluctuations in production or sales, and ""work in progress."" According to the 1993 SNA, net acquisitions of valuables are also considered capital formation.",Investments,
,,,http://www.iso.org/iso/home/standards/country_codes.htm,iso3166_1_alpha2,ISO 3166-1 alpha-2,_none,,,string,,,
,,,http://www.iso.org/iso/home/standards/country_codes.htm,iso3166_1_alpha3,ISO 3166-1 alpha-3,_none,,,string,,,
,,,http://www.iso.org/iso/home/standards/country_codes.htm,iso3166_1_numeric,ISO 3166-1 numeric,_none,,,string,,,
,,,https://en.wikipedia.org/wiki/ISO_3166-2,iso3166_2,ISO 3166-2,_none,,,string,,,
,"[""ordinal""]","{""palette"": {""coastline"": ""#7487ef"", ""landlocked"": ""#f05656""}}",https://docs.google.com/spreadsheet/pub?key=rBwKBodk7Y08pGiA4OAfzUA,landlocked,Landlocked,categorizations,,,entity_set,,,geo
,"[""linear""]",,https://github.com/open-numbers/ddf--gapminder--dim_geo_countries_and_groups/blob/master/ddf--list--geo--country.csv,latitude,Latitude,_none,,,measure,,,
,"[""linear"", ""log""]",,https://docs.google.com/spreadsheet/pub?key=0ArfEDsV3bBwCdG9jSHA0WklHU0dqUnBCVUpVOXFzQUE,life_expectancy_at_birth_data_from_ihme,"Life expectancy at birth, data from IHME",alternative_demography_indicators,,Life expectancy IHME,measure,"Life expectancy at birth, the data is taken from Institute for health metrics and evaluation",Life expectancy,
,"[""linear"", ""log""]",,https://docs.google.com/spreadsheet/pub?key=tiAiXcrneZrUnnJ9dBU-PAw,life_expectancy_at_birth_with_projections,"Life expectancy at birth, with projections",projections,,Life expectancy w projections,measure,The number of years a newborn child would live if current mortality patterns were to stay the same. Medium variant projections until 2050,Life expectancy,
,"[""linear"", ""log""]",,https://docs.google.com/spreadsheet/pub?key=12VhzicKNQCt8I4gmtBmulpfzDfnGjvFPr38g2wDcEGU,life_expectancy_female,"Life expectancy, female",health,,"Life expectancy, female",measure,"Life expectancy at birth, female, with projections","Life expectancy, female",
,"[""linear"", ""log""]",,https://docs.google.com/spreadsheet/pub?key=1iHsRp1TARpgh2CbuZGP5fj6jeY3Iz5cBLKTDlukVSHI,life_expectancy_male,"Life expectancy, male",health,,"Life expectancy, male",measure,"Life expectancy at birth, male, with projections","Life expectancy, male",
,"[""linear"", ""log""]",,https://github.com/open-numbers/ddf--gapminder--life_expectancy,life_expectancy_years,Life expectancy (years),"_root, health",,Life expectancy,measure,The average number of years a newborn child would live if current mortality patterns were to stay the same.,Life expectancy,
,"[""linear"", ""log""]",,https://docs.google.com/spreadsheet/pub?key=pyj6tScZqmEc96gAEE60-Zg,literacy_rate_adult_female_percent_of_females_ages_15_above,"Literacy rate, adult female (% of females ages 15 and above)",literacy,,"Literacy rate, adult female",measure,"Adult literacy rate is the percentage of people ages 15 and above who can, with understanding, read and write a short, simple statement on their everyday life.",Literacy rate,
,"[""linear"", ""log""]",,https://docs.google.com/spreadsheet/pub?key=pyj6tScZqmEd4fn4YYOvuOg,literacy_rate_adult_male_percent_of_males_ages_15_and_above,"Literacy rate, adult male (% of males ages 15 and above)",literacy,,"Literacy rate, adult male",measure,"Adult literacy rate is the percentage of people ages 15 and above who can, with understanding, read and write a short, simple statement on their everyday life.",Literacy rate,
,"[""linear"", ""log""]",,https://docs.google.com/spreadsheet/pub?key=pyj6tScZqmEdrsBnj2ROXAg,literacy_rate_adult_total_percent_of_people_ages_15_and_above,"Literacy rate, adult total (% of people ages 15 and above)",literacy,,"Literacy rate, adult total",measure,"Adult literacy rate is the percentage of people ages 15 and above who can, with understanding, read and write a short, simple statement on their everyday life.",Literacy rate,
,"[""linear"", ""log""]",,https://docs.google.com/spreadsheet/pub?key=pyj6tScZqmEf96wv_abR0OA,literacy_rate_youth_female_percent_of_females_ages_15_24,"Literacy rate, youth female (% of females ages 15-24)",literacy,,"Literacy rate, youth female",measure,"Youth literacy rate is the percentage of people ages 15-24 who can, with understanding, read and write a short, simple statement on their everyday life.",Literacy rate,
,"[""linear"", ""log""]",,https://docs.google.com/spreadsheet/pub?key=pyj6tScZqmEe7OxrqKcSWfw,literacy_rate_youth_male_percent_of_males_ages_15_24,"Literacy rate, youth male (% of males ages 15-24)",literacy,,"Literacy rate, youth male",measure,"Youth literacy rate is the percentage of people ages 15-24 who can, with understanding, read and write a short, simple statement on their everyday life.",Literacy rate,
,"[""linear"", ""log""]",,https://docs.google.com/spreadsheet/pub?key=pyj6tScZqmEepmgV0TLjBag,literacy_rate_youth_total_percent_of_people_ages_15_24,"Literacy rate, youth total (% of people ages 15-24)",literacy,,"Literacy rate, youth total",measure,"Youth literacy rate is the percentage of people ages 15-24 who can, with understanding, read and write a short, simple statement on their everyday life.",Literacy rate,
,"[""linear"", ""log""]",,https://docs.google.com/spreadsheet/pub?key=phAwcNAVuyj3rojF8TmZtOw,liver_cancer_deaths_per_100000_men,"Liver cancer, deaths per 100 000 men",cancer_male,,Liver c. deaths /100k men,measure,"Number of deaths due to liver cancer in 100,000 male residents during the certain year. This rate is calculated as if each country has the same age composition as the world population.","Liver cancer, deaths",
,"[""linear"", ""log""]",,https://docs.google.com/spreadsheet/pub?key=phAwcNAVuyj2ItBsVpK9VBA,liver_cancer_deaths_per_100000_women,"Liver cancer, deaths per 100 000 women",cancer_female,,Liver c. deaths /100k women,measure,"Number of deaths due to liver cancer in 100,000 female residents during the certain year. This rate is calculated as if each country has the same age composition as the world population.","Liver cancer, deaths",
,"[""linear"", ""log""]",,https://docs.google.com/spreadsheet/pub?key=phAwcNAVuyj1u0KpZbsopCA,liver_cancer_new_cases_per_100000_men,"Liver cancer, new cases per 100 000 men",cancer_male,,Liver c. new cases /100k men,measure,"Number of new cases of liver cancer in 100,000 male residents during the certain year. This rate is calculated as if each country has the same age composition as the world population.","Liver cancer, new cases",
,"[""linear"", ""log""]",,https://docs.google.com/spreadsheet/pub?key=phAwcNAVuyj2xhaKENmyRKw,liver_cancer_new_cases_per_100000_women,"Liver cancer, new cases per 100 000 women",cancer_female,,Liver c. new cases /100k women,measure,"Number of new cases of liver cancer in 100,000 female residents during the certain year. This rate is calculated as if each country has the same age composition as the world population.","Liver cancer, new cases",
,"[""linear"", ""log""]",,https://docs.google.com/spreadsheet/pub?key=phAwcNAVuyj2LwNOwMSnJQA,liver_cancer_number_of_female_deaths,"Liver cancer, deaths, women",cancer_female,,"Liver c. deaths, women",measure,Total number of female deaths due to liver cancer during the certain year.,"Liver cancer, deaths",
,"[""linear"", ""log""]",,https://docs.google.com/spreadsheet/pub?key=phAwcNAVuyj1RD88c3w1vNg,liver_cancer_number_of_male_deaths,"Liver cancer, deaths, men",cancer_male,,"Liver c. deaths, men",measure,Total number of male deaths due to liver cancer during the certain year.,"Liver cancer, deaths",
,"[""linear"", ""log""]",,https://docs.google.com/spreadsheet/pub?key=phAwcNAVuyj1_IYQtrqQCKQ,liver_cancer_number_of_new_female_cases,"Liver cancer, new cases, women",cancer_female,,"Liver c. new cases, women",measure,Total number of new female cases of liver cancer during the certain year.,"Liver cancer, new cases",
,"[""linear"", ""log""]",,https://docs.google.com/spreadsheet/pub?key=phAwcNAVuyj2LIYJXVW9EVw,liver_cancer_number_of_new_male_cases,"Liver cancer, new cases, men",cancer_male,,"Liver c. new cases, men",measure,Total number of new male cases of liver cancer during the certain year.,"Liver cancer, new cases",
,"[""linear"", ""log""]",,https://docs.google.com/spreadsheet/pub?key=rCRqVXC95LeKm_EvLrFNXKw,long_term_unemployment_rate_percent,Long term unemployment rate (%),unemployment,,Long term unemployment,measure,Percentage of total population that has been registered as long-term unemployed during the given year.,Long term unemployment,
,"[""linear""]",,https://github.com/open-numbers/ddf--gapminder--dim_geo_countries_and_groups/blob/master/ddf--list--geo--country.csv,longitude,Longitude,_none,,,measure,,,
,"[""linear"", ""log""]",,https://docs.google.com/spreadsheet/pub?key=phAwcNAVuyj2_ibAjsuNgYA,lung_cancer_deaths_per_100000_men,"Lung cancer, deaths per 100 000 men",cancer_male,,Lung c. deaths /100k men,measure,"Number of deaths due to lung cancer in 100,000 male residents during the certain year. This rate is calculated as if each country has the same age composition as the world population.","Lung cancer, deaths",
,"[""linear"", ""log""]",,https://docs.google.com/spreadsheet/pub?key=phAwcNAVuyj2hZorcv6aVLA,lung_cancer_deaths_per_100000_women,"Lung cancer, deaths per 100 000 women",cancer_female,,Lung c. deaths /100k women,measure,"Number of deaths due to lung cancer in 100,000 female residents during the certain year. This rate is calculated as if each country has the same age composition as the world population.","Lung cancer, deaths",
,"[""linear"", ""log""]",,https://docs.google.com/spreadsheet/pub?key=phAwcNAVuyj1kCRbsnNcTVg,lung_cancer_new_cases_per_100000_men,"Lung cancer, new cases per 100 000 men",cancer_male,,Lung c. new cases /100k men,measure,"Number of new cases of lung cancer in 100,000 male residents during the certain year. This rate is calculated as if each country has the same age composition as the world population.","Lung cancer, new cases",
,"[""linear"", ""log""]",,https://docs.google.com/spreadsheet/pub?key=phAwcNAVuyj0UaQ2DNjK9Lg,lung_cancer_new_cases_per_100000_women,"Lung cancer, new cases per 100 000 women",cancer_female,,Lung c. new cases /100k women,measure,"Number of new cases of lung cancer in 100,000 female residents during the certain year. This rate is calculated as if each country has the same age composition as the world population.","Lung cancer, new cases",
,"[""linear"", ""log""]",,https://docs.google.com/spreadsheet/pub?key=phAwcNAVuyj0RMyUI1QFfaA,lung_cancer_number_of_female_deaths,"Lung cancer, deaths, women",cancer_female,,"Lung c. deaths, women",measure,Total number of female deaths due to lung cancer during the certain year.,"Lung cancer, deaths",
,"[""linear"", ""log""]",,https://docs.google.com/spreadsheet/pub?key=phAwcNAVuyj2Az43qu-dQJQ,lung_cancer_number_of_male_deaths,"Lung cancer, deaths, men",cancer_male,,"Lung c. deaths, men",measure,Total number of male deaths due to lung cancer during the certain year.,"Lung cancer, deaths",
,"[""linear"", ""log""]",,https://docs.google.com/spreadsheet/pub?key=phAwcNAVuyj2oQAW8_53cVQ,lung_cancer_number_of_new_female_cases,"Lung cancer, new cases, women",cancer_female,,"Lung c. new cases, women",measure,Total number of new female cases of lung cancer during the certain year.,"Lung cancer, new cases",
,"[""linear"", ""log""]",,https://docs.google.com/spreadsheet/pub?key=phAwcNAVuyj0sd0z2MGpeeA,lung_cancer_number_of_new_male_cases,"Lung cancer, new cases, men",cancer_male,,"Lung c. new cases, men",measure,Total number of new male cases of lung cancer during the certain year.,"Lung cancer, new cases",
,"[""ordinal""]","{""palette"": {""muslim"": ""#71c44c"", ""eastern_religions"": ""#f05656"", ""christian"": ""#7487ef""}, ""selectable"": false}",https://docs.google.com/spreadsheet/pub?key=0ArtujvvFrPjVdHUzTGVicFJZQ1NjaFhqelV5SDNxMVE,main_religion_2008,Main religion 2008,categorizations,,,entity_set,,,geo
,"[""linear"", ""log""]",,https://docs.google.com/spreadsheet/pub?key=pp59adS3CHWcGnFB9pe14OA,malaria_cases_per_100000_reported,Malaria cases per 100 000 - reported,malaria,,Malaria cases /100k people,measure,"Number of malaria cases in every 100,000 residents during the given year.",Malaria cases,
,"[""log"", ""linear""]",,https://docs.google.com/spreadsheet/pub?key=tunqKEwokfnJMDA1g7W8KwA,malaria_deaths_in_children_1_59_months_per_1000_births,Malaria deaths in children 1-59 months (per 1000 births),causes_of_child_deaths,,Malaria deaths ‰ births,measure,"Malaria deaths in children 1-59 months (per 1,000 births)",Malaria deaths in children,
,"[""log"", ""linear""]",,https://docs.google.com/spreadsheet/pub?key=t1Vf-4rkGlG20pYzuGib3hw,malaria_deaths_in_children_1_59_months_total_deaths,Malaria deaths in children 1-59 months (total deaths),causes_of_child_deaths,,Malaria deaths,measure,Malaria deaths in children 1-59 months (total deaths),Malaria deaths in children,
,"[""linear"", ""log""]",,https://docs.google.com/spreadsheet/pub?key=pp59adS3CHWfGZUVJ2L-dCw,malaria_deaths_per_100000_reported,Malaria deaths per 100 000 - reported,malaria,,Malaria deaths /100k people,measure,"Number of malaria deaths in every 100,000 residents during the given year.",Malaria deaths,
,"[""linear"", ""log""]",,https://docs.google.com/spreadsheet/pub?key=pp59adS3CHWczfPHQMiqxCg,malaria_number_of_cases_reported,Malaria cases - reported,malaria,,Malaria cases,measure,Total number of malaria cases reported during the given year.,Malaria cases,
,"[""linear"", ""log""]",,https://docs.google.com/spreadsheet/pub?key=pp59adS3CHWfZGL9qouvTbQ,malaria_number_of_deaths_reported,Malaria deaths - reported,malaria,,Malaria deaths,measure,Total number of malaria deaths reported during the given year.,Malaria deaths,
,"[""linear"", ""log""]",,https://docs.google.com/spreadsheet/pub?key=rtt_ihBgyYafmDJpThQecoA,male_agriculture_workers_percent_of_male_labour_force,Male agriculture workers (% of male labour force),employment_by_sector,,Male agriculture workers,measure,Percentage of all male labour force that works in agriculture sector.,Male agriculture workers,
,"[""linear"", ""log""]",,https://docs.google.com/spreadsheet/pub?key=rJMlhr2YOvL2EE5NhpbfYAg,male_family_workers_percent_of_male_labour_force,Male family workers (% of male labour force),employment_by_status,,Male family workers,measure,Percentage of all male labour force that works as contributing family workers.,Male family workers,
,"[""linear"", ""log""]",,https://docs.google.com/spreadsheet/pub?key=rmLnlLnnm2kjBbNsBZYxqow,male_industry_workers_percent_of_male_labour_force,Male industry workers (% of male labour force),employment_by_sector,,Male industry workers,measure,Percentage of all male labour force that works in industry sector.,Male industry workers,
,"[""linear"", ""log""]",,https://docs.google.com/spreadsheet/pub?key=rezDaYxOOBEFgR4TiPN9qtw,male_long_term_unemployment_rate_percent,Male long term unemployment rate (%),unemployment,,Male long term unemployment,measure,Percentage of male population that has been registered as long-term unemployed during the given year.,Male long term unemployment,
