concept,description,name,unit
arms_exports_us_inflation_adjusted,"تستند البيانات لبعض البلدان على بيانات جزئية أو غير مؤكدة وتقديرات تقريبية. تغطي عمليات نقل الأسلحة إمدادت الأسلحة العسكرية من خلال المبيعات والمساعدات, وتلك المقدمة من خلال تراخيص التصنيع. وتغطي البيانات الأسلحة التقليدية الأساسية كالطائرات والعربات المدرعة والمدفعية., وأنظمة الرادار والصواريخ والسفن المصممة للاستخدام العسكري. ويستثنى من ذلك نقل المعدات العسكرية الأخرى مثل الأسلحة الصغيرة والخفيفة, والشاحنات, والمدفعية الصغيرة, والذخيرة, ومعدات الدعم, و نفل التكنولوجيا والخدمات الأخرى. بأسعار عام 1990.",صادرات الأسلحة,$
arms_imports_us_inflation_adjusted,"تستند البيانات لبعض البلدان على بيانات جزئية أو غير مؤكدة وتقديرات تقريبية. تغطي عمليات نقل الأسلحة إمدادت الأسلحة العسكرية من خلال المبيعات والمساعدات, وتلك المقدمة من خلال تراخيص التصنيع. وتغطي البيانات الأسلحة التقليدية الأساسية كالطائرات والعربات المدرعة والمدفعية., وأنظمة الرادار والصواريخ والسفن المصممة للاستخدام العسكري. ويستثنى من ذلك نقل المعدات العسكرية الأخرى مثل الأسلحة الصغيرة والخفيفة, والشاحنات, والمدفعية الصغيرة, والذخيرة, ومعدات الدعم, و نفل التكنولوجيا والخدمات الأخرى. بأسعار عام 1990",واردات الأسلحة,$
total_gdp_ppp_inflation_adjusted,الناتج المحلي الإجمالي في تعادل القوة الشرائية هو الناتج المحلي الإجمالي محولا إلى دولارات دولية باستخدام معدلات تعادل القوة الشرائية. دولار تعادل القوة الشرائية له نفس القوة الشرائية على الناتج المحلي الإجمالي كما الدولار الأمريكي في الولايات المتحدة. البيانات بالولار الدولي الثابت عام 2005.,الناتج المحلي الإجمالي وفق تعادل القوة الشرائية,$
high_technology_exports_percent_of_manufactured_exports,صادرات التكنولوجيا العالية من المنتجات مع كثافة عالية من البحث والتطوير (R&D)، كما هو الحال في الطيران وأجهزة الكمبيوتر والمستحضرات الصيدلانية، والأجهزة العلمية والآلات الكهربائية.,صادرات التكنولوجيا المتطورة,% من الصادرات المصنعة
merchandise_trade_percent_of_gdp,تجارة البضائع كحصة من الناتج المحلي الإجمالي هي مجموع صادرات البضائع والواردات مقسوماً على قيمة الناتج المحلي الإجمالي، كلها بالقيمة الحالية للدولار الأمريكي. ,تجارة السلع,% من الدخل المحلي الإجمالي
trade_balance_us_not_inflation_adjusted,قيمة صادرات البضائع والخدمات مطروح منها قيمة الواردات والخدمات. مقاسة بالدولار الأمريكي.,الميزان التجاري,"$, غير معدلة للضخم"
trade_balance_percent_of_gdp,الميزان الخارجي للبضائع والخدمات (ميزان الموارد سابقا) يساوي صادرات البضائع والخدمات مطروحا منها واردات البضائع والخدمات (الخدمات بدون عوامل سابقا).,حصة الميزان التجاري من الناتج المحلي الإجمالي,%
hourly_compensation_us,"مقدار التعويض المالي لكل ساعة خارج وقت العمل, معدودة بالدولار الأمريكي. ",تعويض بالساعة,$
working_hours_per_week,إجمالي عدد ساعات العمل السنوية مقسوما على 52 أسبوعا.,ساعات العمل,في الأسبوع
market_value_of_listed_companies_percent_of_gdp,"احتساب رأس المال بسعر السوق (ويعرف أيضا بالقيمة السوقية) هو سعر الحصة مضروبا بعدد الحصص المتداولة. الشركات المحلية المدرجة هي الشركات المساهمة المحلية المدرجة في بورصة الدولة آخر العام. والشركات المدرجة لا تشمل شركات الاستثمار, والصناديق التعاونية وآليات الاستثمار الجماعي.",القيمة السوقية للشركات المدرجة في البورصة,% من الدخل المحلي الإجمالي
military_expenditure_percent_of_gdp,"البيانات, من معهد ستوكهولم بأبحاث السلام الدولي, مشتقة من تعريف حلف شمال الأطلسي (الناتو), والذي يشمل كافة النفقات الرأسمالية والحالية على القوات المسلحة, بما في ذلك قوات حفظ السلام; ووزارات الدفاع والهيئات الحكومية الأخرى المشتركة في المشاريع الدفاعية; والقوات شبه العسكرية, في حال تم الحكم عليها وتدريبها وتسليحها للعمليات العسكرية; وأيضا النشاطات العسكرية الفضائية. ",النفقات العسكرية,% من الدخل المحلي الإجمالي
math_achievement_4th_grade,متوسط النتيجة في امتحان الاتجاهات في الدراسة العالمية للرياضيات والعلوم للأطفال في الصف الرابع.,الإنجاز الرياضي، الصف الرابع,نتيجة امتحان الاتّجاهات في الدراسة العالمية للرّياضيات والعلوم (TIMSS)
math_achievement_8th_grade,متوسط النتيجة في امتحان الاتجاهات في الدراسة العالمية للرياضيات والعلوم للأطفال في الصف الثامن.,الإنجاز الرياضي، الصف الثامن,نتيجة امتحان الاتّجاهات في الدراسة العالمية للرّياضيات والعلوم (TIMSS)
ratio_of_girls_to_boys_in_primary_and_secondary_education_perc,انقطاع في السلسلة بين عامي 1997 و1998 بسبب التغير من التصنيف الدولي الموحد للتعليم (ISCED76) إلى (ISCED97). البيانات الأخيرة مؤقتة. نسبة البنات إلى الأولاد في المرحلتين التعليميتين الأساسية والثانوية هي النسبة المئوية للبنات إلى الأولاد المسجلين في المستويين الأساسي والثانوي في المدارس الحكومية والخاصة.,نسبة البنات إلى الأولاد في المدرسة,"التعليم الأساسي والثانوي, %"
ratio_of_young_literate_females_to_males_percent_ages_15_24,"نسبة الإناث الشابات المتعلمات إلى الذكور هي النسبة المئوية للإناث إلى الذكور في الفئة العمرية 15-24 عاما والتي لديها القدرة, مع الفهم, على قراءة وكتابة عبارة بسيطة عن حياتها اليومية.",نسبة الإناث الشابات المتعلمات إلى الذكور,% الأعمار بين 15 و24
literacy_rate_adult_female_percent_of_females_ages_15_above,"معدل معرفة القراءة والكتابة عند البالغين من عمر 15 عاما فأكثر والذين يستطيعون, بفهم, قراءة وكتابة عبارة بسيطة عن حياتهم اليومية.",معرفة القراءة والكتابة عند الإناث الكبار,% الأعمار من 15+
literacy_rate_adult_male_percent_of_males_ages_15_and_above,"معدل الإناث الشابات المتعلمات إلى الذكور هو النسبة المئوية للإناث إلى الذكور في الفئة العمرية 15-24 عاما واللاتي لديهن القدرة, مع الفهم, على قراءة وكتابة عبارة بسيطة عن حياتها اليومية.",معرفة القراءة والكتابة عند الذكور الكبار,% الأعمار من 15+
literacy_rate_adult_total_percent_of_people_ages_15_and_above,"معدل معرفة القراءة والكتابة بين البالغين هو النسبة المئوية للسكان في الفئة العمرية 15 عاما فما فوق الذين لديهم القدرة, مع الفهم, على قراءة وكتابة عبارة بسيطة عن حياتها اليومية.",معرفة القراءة والكتابة عند الكبار,% الأعمار من 15+
literacy_rate_youth_female_percent_of_females_ages_15_24,"معدل معرفة القراءة والكتابة بين الشباب هو النسبة المئوية للسكان في الفئة العمرية 15-24 عاما الذين لديهم القدرة, مع الفهم, على قراءة وكتابة عبارة بسيطة عن حياتها اليومية.",معرفة القراءة والكتابة بين الإناث الصغيرات,% الأعمار بين 15 و24
literacy_rate_youth_male_percent_of_males_ages_15_24,"معدل معرفة القراءة والكتابة بين الشباب هو النسبة المئوية للسكان في الفئة العمرية 15-24 عاما الذين لديهم القدرة, مع الفهم, على قراءة وكتابة عبارة بسيطة عن حياتها اليومية.",معرفة القراءة والكتابة بين الذكور الصغار,% الأعمار بين 15 و24
literacy_rate_youth_total_percent_of_people_ages_15_24,"معدل معرفة القراءة والكتابة بين الشباب هو النسبة المئوية للسكان في الفئة العمرية 15-24 عاما الذين لديهم القدرة, مع الفهم, على قراءة وكتابة عبارة بسيطة عن حياتها اليومية.",معرفة القراءة والكتابة بين الشباب,% الأعمار بين 15 و24
children_out_of_school_primary,انقطاع في السلسلة بين عامي 1997 و1998 بسبب التغير من التصنيف الدولي الموحد للتعليم (ISCED76) إلى (ISCED97). البيانات الأخيرة مؤقتة. نسبة البنات إلى الأولاد في المرحلتين التعليميتين الأساسية والثانوية هي النسبة المئوية للبنات إلى الأولاد المسجلين في المستويين الأساسي والثانوي في المدارس الحكومية والخاصة.,الأطفال خارج المدرسة الابتدائية,
children_out_of_school_primary_female,انقطاع في السلسلة بين عامي 1997 و1998 بسبب التغير من التصنيف الدولي الموحد للتعليم (ISCED76) إلى (ISCED97). البيانات الأخيرة مؤقتة. نسبة البنات إلى الأولاد في المرحلتين التعليميتين الأساسية والثانوية هي النسبة المئوية للبنات إلى الأولاد المسجلين في المستويين الأساسي والثانوي في المدارس الحكومية والخاصة.,الأطفال خارج المدرسة الابتدائية، الإناث,
children_out_of_school_primary_male,انقطاع في السلسلة بين عامي 1997 و1998 بسبب التغير من التصنيف الدولي الموحد للتعليم (ISCED76) إلى (ISCED97). البيانات الأخيرة مؤقتة. نسبة البنات إلى الأولاد في المرحلتين التعليميتين الأساسية والثانوية هي النسبة المئوية للبنات إلى الأولاد المسجلين في المستويين الأساسي والثانوي في المدارس الحكومية والخاصة.,الأطفال خارج المدرسة الابتدائية، الذكور,
primary_completion_rate_total_percent_of_relevant_age_group,"معدل الإتمام الأساسي هو النسبة المئوية للطلاب الذين أتموا المرحلة الأولية للعام الماضي. ويتم حسابه بأخذ مجموع عدد الطلاب في الصف الأخير من المرحلة الأساسية مطروحا منه عدد الطلاب المعيدين في ذلك الصف, ومقسوما على مجموع عدد الأطفال في السن الرسمية للتخرج.",إتمام المرحلة الابتدائية,% من الفئة العمرية ذات الصلة
primary_school_completion_percent_of_boys,معدل الإتمام للمرحلة الأساسية للأولاد (نسبة الأولاد). ,إتمام المرحلة الابتدائية: الأولاد,%
primary_school_completion_percent_of_girls,معدل الإتمام للمرحلة الأساسية للبنات (نسبة البنات). ,إتمام المرحلة الابتدائية: البنات,%
expenditure_per_student_primary_percent_of_gdp_per_person,"انقطاع في السلسلة بين عامي 1997 و1998 بسبب التغير من التصنيف الدولي الموحد للتعليم (ISCED76) إلى (ISCED97). البيانات الأخيرة مؤقتة. الإنفاق العام على التعليم مقسوما على إجمالي عدد الطلاب حسب المستوى, كنسبة مئوية للدخل الإجمال المحلي للفرد. يضم الإنفاق العام (الحالي ورأس المال) الإنفاق الحكومي على المؤسسة التعليمية (سواء العامة أو الخاصة), وإدارة التعليم بالإضافة إلى دعم الكيانات الخاصة (الطلاب/الأَسر وغيرها).",النفقات لكل طالب، الابتدائي,% من الدخل المحلي الإجمالي للشخص الواحد
expenditure_per_student_secondary_percent_of_gdp_per_person,"انقطاع في السلسلة بين عامي 1997 و1998 بسبب التغير من التصنيف الدولي الموحد للتعليم (ISCED76) إلى (ISCED97). البيانات الأخيرة مؤقتة. الإنفاق العام على التعليم مقسوما على إجمالي عدد الطلاب حسب المستوى, كنسبة مئوية للدخل الإجمال المحلي للفرد. يضم الإنفاق العام (الحالي ورأس المال) الإنفاق الحكومي على المؤسسة التعليمية (سواء العامة أو الخاصة), وإدارة التعليم بالإضافة إلى دعم الكيانات الخاصة (الطلاب/الأَسر وغيرها).","النفقات لكل طالب, الثانوي",% من الدخل المحلي الإجمالي للشخص الواحد
expenditure_per_student_tertiary_percent_of_gdp_per_person,"انقطاع في السلسلة بين عامي 1997 و1998 بسبب التغير من التصنيف الدولي الموحد للتعليم (ISCED76) إلى (ISCED97). البيانات الأخيرة مؤقتة. الإنفاق العام على التعليم مقسوما على إجمالي عدد الطلاب حسب المستوى, كنسبة مئوية للدخل الإجمال المحلي للفرد. يضم الإنفاق العام (الحالي ورأس المال) الإنفاق الحكومي على المؤسسة التعليمية (سواء العامة أو الخاصة), وإدارة التعليم بالإضافة إلى دعم الكيانات الخاصة (الطلاب/الأَسر وغيرها).",النفقات لكل طالب، التعليم بعد الثانوي,% من الدخل المحلي الإجمالي للشخص الواحد
mean_years_in_school_women_25_years_and_older,"متوسط سنوات الدراسة التي مر بها جميع الأشخاص ضمن الفئة العمرية والجنسية المحددة, بما في ذلك التعليم الأساسي والثانوي والتعليم العالي. ",متوسط السنوات في المدرسة، النساء 25+,
mean_years_in_school_men_25_years_and_older,"متوسط سنوات الدراسة التي مر بها جميع الأشخاص ضمن الفئة العمرية والجنسية المحددة, بما في ذلك التعليم الأساسي والثانوي والتعليم العالي. ","متوسط سنوات في المدرسة, الرجال 25+",
mean_years_in_school_women_25_to_34_years,"متوسط سنوات الدراسة التي مر بها جميع الأشخاص ضمن الفئة العمرية والجنسية المحددة, بما في ذلك التعليم الأساسي والثانوي والتعليم العالي. ",متوسط السنوات في المدرسة، النساء 25-34,
mean_years_in_school_men_25_to_34_years,"متوسط سنوات الدراسة التي مر بها جميع الأشخاص ضمن الفئة العمرية والجنسية المحددة, بما في ذلك التعليم الأساسي والثانوي والتعليم العالي. ","متوسط سنوات في المدرسة, الرجال 25-34",
mean_years_in_school_women_of_reproductive_age_15_to_44,"متوسط سنوات الدراسة التي مر بها جميع الأشخاص ضمن الفئة العمرية والجنسية المحددة, بما في ذلك التعليم الأساسي والثانوي والتعليم العالي. ",متوسط السنوات في المدرسة، النساء 15-44,
mean_years_in_school_women_percent_men_25_to_34_years,"نسبة الإناث إلى الذكور من حيث سنوات الدراسة, ضمن الفئة العمرية, 25-24 عاما, بما في ذلك التعليم الأساسي والثانوي والتعليم العائلة. ","متوسط سنوات في المدرسة, النساء/الرجال 25-34",%
energy_use_total,"يشير استخدام الطاقة إلى استخدام الطاقة الأساسية قبل تحويلها إلى أنواع الوقود الأخرى للاستخدام النهائية, وهو ما يساوي الإنتاج الأصلي مضافا إليه الصادرات والتغيرات في المخزون, مطروح منها الوقود المزود للسفن والطائرات التي تعمل في النقل الدولي, معدودا بالطن من النفط المكافئء.",استخدام الطاقة,أطنان النفط المكافئ
energy_use_per_person,"يشير استخدام الطاقة إلى استخدام الطاقة الأساسية قبل تحويلها إلى أنواع الوقود الأخرى للاستخدام النهائية, وهو ما يساوي الإنتاج الأصلي مضافا إليه الصادرات والتغيرات في المخزون, مطروح منها الوقود المزود للسفن والطائرات التي تعمل في النقل الدولي, معدودا بالطن من النفط المكافئء.",استخدام الطاقة للشخص الواحد,أطنان النفط المكافئ
energy_production_total,"يشير إنتاج الطاقة إلى الأشكال الأساسية للطاقة--النفط (النفط الخام, والغاز الطبيعي المسال, والنفط من مصادره غير التقليدية), والغاز الطبيعي والوقود الصلب (الفحم, والليجينيت, والمشتقات الأخرى),, مصادر الطاقة المتجددة القابلة للاحتراق والمخلفا-- وكذلك الكهرباء الأساسية, وكل ذلك يتم تحويله إلى الطن من النفط المكافئ, معدود بطن النفط المكافئ.",إنتاج الطاقة,أطنان النفط المكافئ
energy_production_per_person,"يشير إنتاج الطاقة إلى الأشكال الأساسية للطاقة--النفط (النفط الخام, والغاز الطبيعي المسال, والنفط من مصادره غير التقليدية), والغاز الطبيعي والوقود الصلب (الفحم, والليجينيت, والمشتقات الأخرى), مصادر الطاقة المتجددة القابلة للاحتراق والمخلفات-- وكذلك الكهرباء الأساسية, وكل ذلك يتم تحويله إلى الطن من النفط المكافئ, ويتم حسابه من خلال تقسيمه على على عدد سكان كل بلد على حدى خلال السنة المحددة, معدودا بطن النفط المكافئ.",إنتاج الطاقة للشخص الواحد,أطنان النفط المكافئ
pump_price_for_gasoline_us_per_liter,تشير أسعار الوقود إلى أسعار ضخ درجة الغازولين الأكثر مبيعا. ,سعر البنزين,$/لتر
coal_consumption_total,إجمالي مقدار استهلاك الفحم (طن نفط مكافئ),استهلاك الفحم,أطنان النفط المكافئ
coal_consumption_per_cap,استهلاك الفحم للفرد (طن نفط مكافئ),استهلاك الفحم للشخص الواحد,أطنان النفط المكافئ
electricity_use_per_person,إجمالي مقدار الكهرباء المستهلكة للفرد خلال السنة المحددة معدودة بالكيلو واط الساعي (ك. و. س).,استخدام الكهرباء للشخص الواحد,كيلو واط في الساعة
electricity_use_total,"إجمالي مقدار الكهرباء المستهلكة خلال السنة المحددة, معدودة بالكيلو واط الساعي (ك. و. س).",استخدام الكهرباء,كيلو واط في الساعة
residential_electricity_use_per_person,"إجمالي مقدار الكهرباء السكنية المستهلكة للفرد خلال السنة المحددة, معدودة بالكيلو واط الساعي (ك. و. س).",الاستخدام السكني للكهرباء للشخص الواحد,كيلو واط في الساعة
residential_electricity_use_total,"إجمالي مقدار الكهرباء السكنية المستهلكة للفرد خلال السنة المحددة, معدودة بالكيلو واط الساعي (ك. و. س).",الاستخدام السكني للكهرباء,كيلو واط في الساعة
electricity_generation_total,توليد الكهرباء (كيلو واط ساعي),توليد الكهرباء,كيلو واط في الساعة
electricity_generation_per_person,توليد الكهرباء للفرد (كيلو واط ساعي),توليد الكهرباء للشخص الواحد,كيلو واط في الساعة
hydro_power_generation_total,مقدار الطاقة الكهرومائية المولدة خلال السنة المحددة معدودة بطن النفط المكافئ.,إنتاج الطاقة الكهربائية المائية,أطنان النفط المكافئ
hydro_power_generation_per_person,"مقدار الطاقة الكهرومائية المولدة للفرد خلال السنة المحددة, معدودة بطن النفط المكافئ.",إنتاج الطاقة الكهربائية المائية للشخص الواحد,أطنان النفط المكافئ
nuclear_power_generation_total,"مقدار الكهرباء المولدة من محطات الطاقة النووية خلال السنة المحددة, معدودة بطن النفط المكافئ.",إنتاج الكهرباء النووية,طن نفط مكافئ
nuclear_power_generation_per_person,"مقدار الكهرباء المولدة من محطات الطاقة النووية للفرد خلال السنة المحددة, معدودة بطن النفط المكافئ.",إنتاج الكهرباء النووية للشخص الواحد,طن نفط مكافئ
natural_gas_production_total,إنتاج الغاز الطبيعي (طن نفط مكافئ),إنتاج الغاز الطبيعي,طن نفط مكافئ
natural_gas_production_per_person,إنتاج الغاز الطبيعي للفرد (طن نفط مكافئ),إنتاج الغاز الطبيعي للشخص الواحد,طن نفط مكافئ
natural_gas_proven_reserves_per_person,المخزون المثبت من الغاز الطبيعي للفرد (طن نفط مكافئ),الاحتياطي المثبت من الغاز الطبيعي للشخص الواحد,طن نفط مكافئ
natural_gas_proved_reserves_total,المخزود المثبت من الغاز الطبيعي (طن نفط مكافئ),الاحتياطي المثبت من الغاز الطبيعي,طن نفط مكافئ
oil_production_per_person,إنتاج النفط الخام للفرد (طن نفط مكافئ),إنتاج النفط للشخص الواحد,طن
oil_production_total,إجمالي إنتاج النفط الخام (طن نفط مكافئ),إنتاج النفط,طن
oil_proven_reserves_per_person,المخزون المثبت من النفط للفرد (طن نفط مكافئ),الاحتياطي المثبت من النفط للشخص الواحد,طن
oil_proved_reserves_total,المخزون المثبت من النفط (طن نفط مكافئ),الاحتياطي المثبت من النفط,طن
