concept,description,name,unit
tag,,وسم,
parent,,,
geo,,الموقع الجغرافي,
world_6region,,مناطق العالم (6 ألوان),
income_groups,,فئات الدخل,
landlocked,,غير الساحلية,
g77_and_oecd_countries,,بلدان مجموعة ال77 ومنظمة التعاون الاقتصادي والتنمية,
main_religion_2008,,الديانة الرئيسية 2008,
country,,الدولة,
world_4region,,مناطق العالم,
global,,العالم,
age,,العمر,السنوات
latitude,,خط العرض,الدرجات
longitude,,خط الطول,الدرجات
children_per_woman_total_fertility,المعدل الإجمالي للخصوبة. عدد الأطفال الذي سوف يولد لكل امرأة مع المعدلات الخصوبة السائدة بحسب العمر. ,أطفال للمرأة الواحدة,
income_per_person_gdppercapita_ppp_inflation_adjusted,"إجمالي الناتج المحلي للشخص الواحد معدل للاختلافات في القوة الشرائية (بالدولارات الدولية، أسعار 2011 الثابتة, تعادل القوة الشرائية استناداً إلى برنامج المقارنات الدولية لعام 2011).",نصيب الفرد من الدخل,الناتج المحلي الإجمالي للفرد الواحد بالدولار في السنة معدلة للتضخم والأسعار
co2_emissions_tonnes_per_person,انبعاثات ثاني أكسيد الكربون من حرق الوقود الأحفوري (بالأطنان المترية من CO2 للشخص الواحد). ,ثاني أكسيد الكربون لكل فرد,طن متري للشخص الواحد
child_mortality_0_5_year_olds_dying_per_1000_born,"وفاة الأطفال تحت سنة خمس سنوات لكل 1,000 ولادة حية ",معدل وفيات الأطفال,الوفيات دون سن الخامسة لكل 1000 ولادة
life_expectancy_years,متوسط عدد السنوات التي قد يعيشها طفل حديث الولادة في حال بقيت معدلات وفيات الأطفال الحالية كما هي. ,متوسط العمر المتوقع,السنوات
aid_given_2007_us,"مقدار المساعدات الممكن تخصيصها من أجل المساعدة الإنمائية الرسمية الممنوحة من قبل الدول المتبرعة, معبر عنها بثابت الدولار الأمريكية لعام 2007.",المعونة المقدمة,$
aid_given_per_person_2007_us,المقدار الكلي لمعونات المساعدة الإنمائية الرسمية التي تم منحها خلال العام الحالي مقسوم على عدد سكان البلد (بالدولار الأمريكي لعام 2007),المعونة المقدمة للشخص الواحد,$
aid_given_percent_of_gni,معدل الدخل القومي الإجمالي لكل دولة متلقية تم منحها معونة المساعدة الإنمائية الرسمية هذا العام. ,"المعونة المقدمة, النسبة المئوية من الدخل القومي الإجمالي",
water_and_sanitation_aid_given_percent_of_aid,معدل إجمالي المعونات الممكن تخصيصها للمساعدة الإنمائية الرسمية التي منحت من قبل الدول المتبرعة وتم استخدامها في المياه والصرف الصحي.,المعونة المقدمة للمياه والصرف الصحي,% من الدعم
economical_infrastructure_aid_given_percent_of_aid,معدل إجمالي المعونات الممكن تخصيصها للمساعدة الإنمائية الرسمية التي منحت من قبل الدول المتبرعة وتم استخدامها في البنى التحتية الاقتصادية.,المعونة المقدمة للبنية التحتية الاقتصادية,% من الدعم
production_sector_aid_given_percent_of_aid,"معدل إجمالي المعونات الممكن تخصيصها للمساعدة الإنمائية الرسمية التي منحت من قبل الدول المتبرعة وتم استخدامها في قطاعات الإنتاج, بما في ذلك الزراعة والصناعة, إلخ.",المعونة المقدمة لقطاع الإنتاج,% من الدعم
multisector_cross_cutting_aid_given_percent_of_aid,معدل إجمالي المعونات الممكن تخصيصها للمساعدة الإنمائية الرسمية التي منحت من قبل الدول المانحة وتم استخدامها في المسأئل الجامعة متعددة القطاعات.,المعونة المقدمة للقطاعات الشاملة,% من الدعم
education_aid_given_percent_of_aid,معدل إجمالي المعونات الممكن تخصيصها للمساعدة الإنمائية الرسمية التي منحت من قبل الدول المانحة وتم استخدامها في التعليم.,المعونة المقدمة للتعليم,% من الدعم
health_aid_given_percent_of_aid,معدل إجمالي المعونات الممكن تخصيصها للمساعدة الإنمائية الرسمية التي منحت من قبل الدول المانحة وتم استخدامها في الصحة.,المعونة المقدمة للصحة,% من الدعم
population_policies_aid_given_percent_of_aid,معدل إجمالي المعونات الممكن تخصيصها للمساعدة الإنمائية الرسمية التي منحت من قبل الدول المانحة وتم استخدامها السياسات/البرامج السكانية والصحة التناسلية.,المعونة المقدمة للسياسات السكانية,% من الدعم
government_and_society_aid_given_percent_of_aid,معدل إجمالي المعونات الممكن تخصيصها للمساعدة الإنمائية الرسمية التي منحت من قبل الدول المانحة وتم استخدامها الحكومة والمجتمعات المدنية.,المعونة المقدمة للحكومة والمجتمع,% من الدعم
other_social_services_aid_given_percent_of_aid,معدل إجمالي المعونات الممكن تخصيصها للمساعدة الإنمائية الرسمية التي منحت من قبل الدول المانحة وتم استخدامها في البنى التحتية والخدمات الاجتماعية الأخرى.,المعونة المقدمة للخدمات الاجتماعية الأخرى,% من الدعم
aid_received_total_us_inflation_adjusted,"مجموع المعونة التي تحصل عليها كل بلد خلال هذا العام من جميع الدول المانحة في كل القطاعات, معبر عنه بثابت قيمة الدولار لعام 2007.",المعونة المسلّمة,$
aid_received_per_person_current_us,"متوسط مقدار المعونة التي يحصل عليها كل شخص في البلد المتلقي خلال هذا العام من جميع الدول المانحة في كل القطاعات, معبر عنه بقيمة الدولار الحالية.",المعونة المسلّمة للشخص الواحد,$
aid_received_percent_of_gni,معدل الدخل القومة الإجمالي لكل بلد متلق يأتي من المساعة الإنمائية الرسمية خلال هذا العام. ,"المعونة المسلّمة, النسبة المئوية من الدخل القومي الإجمالي",
dollar_billionaires_per_million_people,"عدد أصحاب المليارات لكل 1 مليون إنسان في بلد جنسيتهم, ويحسب استناداً إلى بيانات موقع Forbes.com",أصحاب المليارات بالدولار لكل مليون,
average_age_of_dollar_billionaires_years,"متوسط أعمار أصحاب المليارات في بلد جنسيتهم, ويحسب استناداَ إلى بيانات موقع Forbes.com",متوسط أعمار أصحاب المليارات,السنوات
total_number_of_dollar_billionaires,"مجموع عدد أصحاب المليارات في بلد جنسيتهم, مزود من موقع Forbes.com",أصحاب المليارات بالدولار,
debt_to_foreigners_by_public_and_private_percent_of_gni,"الدين الخارجي, إجمالي (% من الدخل القومي الإجمالي)",الديون للأجانب,"العام والخاص, % من الدخل القومي الإجمالي"
total_reserves_percent_of_debt_to_foreigners,مجموع الاحتياطي (% من الدين الخارجي),مجموع الاحتياطيات,% من الديون للأجانب
total_gdp_us_inflation_adjusted,محموع الناتج المحلي الإجمالي (ثابت سعر صرف الدولار الأمريكي),مجموع الناتج المحلي الإجمالي,$
gdppercapita_us_inflation_adjusted,الناتج المحلي الإجمالي للفرد الواحد في شروط سعر الصرف معدل في ضوء نسبة التضخم (الدولار الأمريكي 2000),الناتج المحلي الإجمالي للفرد الواحد,$
gdpperemployee_us_inflation_adjusted,"متوسط الناتج المحلي الإجمالي لكن موظف خلال سنة معينة, يتم عده من خلال ثابت الدولار لعام 1990.",الناتج المحلي الإجمالي لكل موظف,$
gdpperworking_hour_us_inflation_adjusted,"متوسط الناتج المحلي الإجمالي لكل ساعة لكل فرد, يتم عده حسب ثابت الدولار لعام 1990.",الناتج المحلي الإجمالي لكل ساعة عمل,$
gdppercapita_growth_over_next_10_years,"متوسط النمو في الناتج المحلي الإجمالي خلال السنوات العشر اللاحقة, أي أن البيانات لعام 1980 تتعلق بمتوسط نمو الأعوام 1980 إلى 1990 استناداً إلى الدخل لكل فرد v12. التوقعات بعد عام 2005.",النمو في نصيب الفرد من الناتج المحلي الإجمالي خلال 10 سنوات القادمة,
gdppercapita_growth_percent_per_year,النمو السنوي في الناتج المحلي الإجمالي لكل فرد استنادا إلى بيانات البنك الدولي.,النمو في نصيب الفرد من الناتج المحلي الإجمالي,% في السنة
total_gni_ppp_current_international,تكافؤ القوة الشرائية من الدخل القومي الإجمالي (تكافؤ القوة الشرائية من الناتج القومي الإجمالي سابقا) هو الدخل القومي الإجمالي محولا إلى الدولارات الدولية باستخدام معدلات تكافؤ القوة الشرائية. تعادل القوة الشرائية للدولار العالمي على الدخل القومي الإجمالي تلك التي يملكها الدولار الأمريكي في الولايات المتحدة الأمريكية.,مجموع الدخل القومي الإجمالي,"تعادل القوة الشرائية, الدولار العالمي الحالي"
gnipercapita_constant_2000_us,نصيب الفرد من الدخل القومي الإجمالي (ثابت الدولار الأمريكي لعام 2000),الدخل القومي الإجمالي للفرد الواحد,$
gnipercapita_atlasmethod_current_us,الدخل القومي الإجمالي للفرد الواحد، طريقة أطلس (الدولار الأمريكي الحالي),الدخل القومي الإجمالي للفرد الواحد (طريقة أطلس),$
gnipercapita_ppp_current_international,الدخل القومي الإجمالي للفرد، تكافؤ القوة الشرائية (بالدولارات الدولية الحالية),نصيب الفرد من إجمالي الناتج المحلي، وفقا لتعادل القوة الشرائية,$
inequality_index_gini,"يقيس مؤشر جيني إلى أي مدى ينحرف توزيع الدخل (أو, في بعض الحالات, نفقات الاستهلاك) بين الأفراد أو العائلات ضمن اقتصاد ما عن التوزيع المتساوي تماما. ويخط منحنى لورينس النسب التراكمية للدخل الكلي التي تم تلقّيه في مقابل العدد التراكمي للمتلقّين, بدءاً أفرق فرد أو عائلة. يقيس مؤشر جيني المساحة بين منحنى لورينس وخط مفترض يمثل التساوي التام, معبّرٌ عنه كنسبة مئوية لأكبر مساحة تحت الخط. لذا فإن مؤشر جيني عن 0 يمثل التساوي التام, بين عند 100 يمثل عدم تساو تام.",معامل جيني,
income_share_of_richest_10percent,النسبة المئوية لحصة الدخل أو الاستهلاك هي الحصة التي تؤول إلى فئات فرعية من السكان مشار إليها بالعشيرات أو الأخماس. قد لا يصل محموع حصص النسب المئوية بالخمس إلى 100 بسبب التقريب. ,دخل أغنى 10%,حصة
income_share_of_richest_20percent,الحصة المئوية الدخل أو الاستهلاك هي الحصة التي تؤول إلى فئات فرعية من السكان مشار إليها بالعشيرات أو الأخماس. قد لا يصل محموع حصص النسب المئوية بالخمس إلى 100 بسبب التقريب. ,دخل أغنى 20%,حصة
income_share_of_2nd_richest_20percent,الحصة المئوية الدخل أو الاستهلاك هي الحصة التي تؤول إلى فئات فرعية من السكان مشار إليها بالعشيرات أو الأخماس. قد لا يصل محموع حصص النسب المئوية بالخمس إلى 100 بسبب التقريب. ,دخل ثاني أغنى 20%,حصة
income_share_of_middle_20percent,الحصة المئوية الدخل أو الاستهلاك هي الحصة التي تؤول إلى فئات فرعية من السكان مشار إليها بالعشيرات أو الأخماس. قد لا يصل محموع حصص النسب المئوية بالخمس إلى 100 بسبب التقريب. ,دخل متوسطي الدخل ال20%,حصة
income_share_of_2nd_poorest_20percent,الحصة المئوية الدخل أو الاستهلاك هي الحصة التي تؤول إلى فئات فرعية من السكان مشار إليها بالعشيرات أو الأخماس. قد لا يصل محموع حصص النسب المئوية بالخمس إلى 100 بسبب التقريب. ,دخل ثاني أفقر 20%,حصة
income_share_of_poorest_20percent,الحصة المئوية الدخل أو الاستهلاك هي الحصة التي تؤول إلى فئات فرعية من السكان مشار إليها بالعشيرات أو الأخماس. قد لا يصل محموع حصص النسب المئوية بالخمس إلى 100 بسبب التقريب. ,دخل أفقر 20%,حصة
income_share_of_poorest_10percent,الحصة المئوية الدخل أو الاستهلاك هي الحصة التي تؤول إلى فئات فرعية من السكان مشار إليها بالعشيرات أو الأخماس. قد لا يصل محموع حصص النسب المئوية بالخمس إلى 100 بسبب التقريب. ,دخل أفقر 10%,حصة
inflation_annual_percent,"يُظهر التضخم, مقاسا بمعدل النمو السنوي لعامل الانكماش الضمني للناتج المحلي الإجمالي, معدلَ تغير الأسعار في الاقتصاد ككل. عامل الانكماش الضمني الناتج المحلي الإجمالي هو نسبة الناتج المحلي الإجمالي بالعملة المحلية الحالية إلى الناتج المحلي الإجمالي بالعملة المحلية الثابتة.",التضخم,النسبة المئوية السنوية
central_bank_discount_rate_annual_percent,البنك المركزي سعر الخصم (% سنوياً),معدل خصم البنك المركزي,النسبة المئوية السنوية
investments_percent_of_gdp,"الإنفاق على الإضافات إلى الأصول الثابتة من الاقتصاد مضافا إليها صافي التغيرات في مستوى المخزونات. تتضمن الأصول الثابتة تحسينات الأراضي (الأسوار والخنادق ومصارف المياه وغيرها); كما تتضمن المنشآت والآلات وشراء المعدات; وتشييد الطرق والسكك الحديدية وما شابه ذلك, بما في ذلك المدارس والمكاتب والمستشفيات والوحدات السكنية الخاصة والمباني التجارية والصناعية. والمخزونات هي بضائع تحتفظ بها المؤسسات لمواجهة التقلبات والمؤقتة والغير متوقعة في الإنتاج والمبيعات والأعمال قيد التنفيذ.",الاستثمارات,% من الدخل المحلي الإجمالي
tax_revenue_percent_of_gdp,تشير الإيرادات الضريبية إلى الحوالات الإلزامية إلى الحكومة المركزية من أجل الأغراض العامة. وتستثنى من هذا حوالات إلزامية معينة مثل الغرامات والعقوبات ومعظم المساهمات في الضمان الاجتماعي. كما يتم التعامل مع المبالغ المستردة والتصويبات من عائدات الضرائب التي تم جمعها بالخطأ على أنها عائدات سالبة.,الإيرادات الضريبية,% من الدخل المحلي الإجمالي
foreign_direct_investment_net_inflows_percent_of_gdp,"صافي تدفقات الاستثمار للحصول على فائدة إدارة دائمة (10 بالمئة من الأسهم الحاملة لحق التصويت) في مشروع يعمل في اقتصاد غير ذلك الذي يعمل فيه المستثمر. وهي مجموع رأس المال المملوك, وأرباح إعادة الاستثمار, ورؤوس أموال أخرى طويلة الأمد, ورؤوس أموال قصيرة الأمد كما يظهر في المحصلة النهائية للمدفوعات, كنسبة مئوية من الناتج المحلي الإجمالي.",تدفقات الاستثمار الأجنبي,"مباشر, % من الدخل المحلي الإجمالي"
foreign_direct_investment_net_outflows_percent_of_gdp,"صافي تدفقات الاستثمار للحصول على فائدة إدارة دائمة (10 بالمئة من الأسهم الحاملة لحق التصويت) في مشروع يعمل في اقتصاد غير ذلك الذي يعمل فيه المستثمر. وهي مجموع رأس المال المملوك, وأرباح إعادة الاستثمار, ورؤوس أموال أخرى طويلة الأمد, ورؤوس أموال قصيرة الأمد كما يظهر في المحصلة النهائية للمدفوعات, كنسبة مئوية من الناتج المحلي الإجمالي.",تدفقات الاستثمار الأجنبي إلى الخارج,"مباشر, % من الدخل المحلي الإجمالي"
patent_applications_total,براءات الاختراع هي وثائق صادرة من مكتب حكومي الغرض منها هو وصف اختراع ما وخلق حالة قانونية تسمح باستغلال الاختراع بواسطة صاحب البراءة أو بإذنه هو فقط. وتقتصر مدة الحماية في الغالب على 20 عاما. ,طلبات براءات الاختراع,المجموع
patents_granted_total,براءات الاختراع هي وثائق صادرة من مكتب حكومي الغرض منها هو وصف اختراع ما وخلق حالة قانونية تسمح باستغلال الاختراع بواسطة صاحب البراءة أو بإذنه هو فقط. وتقتصر مدة الحماية في الغالب على 20 عاما. ,براءات الاختراع الممنوحة,المجموع
patents_in_force_total,براءات الاختراع هي وثائق صادرة من مكتب حكومي الغرض منها هو وصف اختراع ما وخلق حالة قانونية تسمح باستغلال الاختراع بواسطة صاحب البراءة أو بإذنه هو فقط. وتقتصر مدة الحماية في الغالب على 20 عاما. ,براءات الاختراع سارية المفعول,المجموع
poverty_percent_people_below_2_a_day,النسبة المئوية للسكان الذين يعيشون على أقل من 2 دولار (دولار تعادل القوة الشرائية 2005).,الفقر,% الناس تحت 2$ في اليوم
rural_poverty_percent_rural_people_below_national_rural,نسبة تعداد الفقراء عند خط الفقر الريفي (% من سكان الريف),الفقر في المناطق الريفية,%
urban_poverty_percent_urban_people_below_national_urban,نسبة تعداد الفقراء عند خط الفقر الحضري (% من سكان المناطق الحضرية),الفقر في المناطق الحضرية,%
extreme_poverty_percent_people_below_125_a_day,النسبة المئوية للسكان الذين يعيشون على أقل من 1.25 دولار (دولار تعادل القوة الشرائية 2005).,الفقر المدقع,% الناس تحت 1.25$ في اليوم
agriculture_percent_of_gdp,"الزراعة تشمل زراعة الغابات, والصيد, وصيد الأسماك, كما تشمل زراعة المحاصيل والإنتاج الحيواني. والقيمة المضافة هي الناتج الصافي لقطاع ما, بعد إضافة جميل النواتج وطرح المدخلات الوسيطة. ويتم حسابها بدون إجراء اقتطاعات لإهلاك الأصول الملفقة أو نضوب وتدهور الموارد الطبيعية.",الزراعة,% من الدخل المحلي الإجمالي
industry_percent_of_gdp,"تتألف الصناعة من القيمة المضافة في قطاع التعدين والتصنيع (وتسجل أيضا كمجموعة فرعية منفصلة), والبناء, والكهرباء, والماء, والوقود. القيمة المضافة هي الناتج الصافي لقطاع ما, بعد إضافة جميل النواتج وطرح المدخلات الوسيطة. ويتم حسابها بدون إجراء اقتطاعات لإهلاك الأصول الملفقة أو نضوب وتدهور الموارد الطبيعية. ",الصناعة,% من الدخل المحلي الإجمالي
services_percent_of_gdp,"الخدمات تضم بيع الجملة وتجارة التجزئة (بما في ذلك الفنادق والمطاعم), والنقل, والحكومة, والخدمات المالية, والمهنية, والشخصية كالتعليم والرعاية الصحية, والخدمات العقارية. كما تضم أيضا رسوم الخدمات المصرفية المحتسبة, ورسوم الاستيراد, وأي اختلافات إحصائية تشير إليها الوحدات المحاسبية الوطنية بالإضافة إلى الاختلافات الناجمة عن إعادة القياس. ",الخدمات,% من الدخل المحلي الإجمالي
exports_percent_of_gdp,تمثل صادرات السلع والخدمات قيمة كل السلع وخدمات السوق الأخرى المقدمة إلى بقية العالم. وهي تشمل قيمة البضائع، والشحن والتأمين، والنقل، والسفر، والإتاوات، ورسوم الترخيص، والخدمات الأخرى، مثل الاتصالات والبناء والمالية، والمعلومات، والأعمال، والشخصية والخدمات الحكومية. وهي لا تشمل دخل العمل والممتلكات (الذي كان يسمى سابقا خدمات العوامل) فضلا عن المدفوعات المحولة.,الصادرات,% من الدخل المحلي الإجمالي
imports_percent_of_gdp,تمثل واردات السلع والخدمات قيمة كل السلع وخدمات السوق الأخرى المقدمة إلى بقية العالم. وهي تشمل قيمة البضائع، والشحن والتأمين، والنقل، والسفر، والإتاوات، ورسوم الترخيص، والخدمات الأخرى، مثل الاتصالات والبناء والمالية، والمعلومات، والأعمال، والشخصية والخدمات الحكومية. وهي لا تشمل دخل العمل والممتلكات (الذي كان يسمى سابقا خدمات العوامل) فضلا عن المدفوعات المحولة. ,الواردات,% من الدخل المحلي الإجمالي
