"concept","name_catalog"
"gdp_total_yearly_growth","การเพิ่มขึ้นรายปีของผลิตภัณฑ์ในประเทศ"
"gdppercapita_growth_over_next_10_years","การเพิ่มขึ้นรายปีของผลิตภัณฑ์ในประเทศต่อหัวใน 10 ปีข้างหน้า"
"gdppercapita_growth_percent_per_year","การเพิ่มขึ้นของผลิตภัณฑ์ในประเทศต่อหัว"
"gdppercapita_us_inflation_adjusted","ผลิตภัณฑ์ในประเทศต่อหัว (ดอลลาร์สหรัฐ/ปรับตามเงินเฟ้อ)"
"gdpperemployee_us_inflation_adjusted","ผลิตภัณฑ์ในประเทศต่อแรงงาน"
"gdpperworking_hour_us_inflation_adjusted","ผลิตภัณฑ์ในประเทศต่อชั่วโมงทำงาน"
"geo",""
"global",""
"gnipercapita_atlasmethod_current_us","รายได้มวลรวมประชาชาติต่อหัว (โดยวิธี Atlas method)"
"gnipercapita_constant_2010_us","รายได้มวลรวมประชาชาติต่อหัว (ดอลลาร์สหรัฐปี 2010)"
"gnipercapita_ppp_current_international","รายได้มวลรวมประชาชาติต่อหัว (ตามความเสมอภาคแห่งอํานาจซื้อ ดอลลาร์สหรัฐนานาชาติปัจจุบัน)"
"god_id",""
"government_and_society_aid_given_percent_of_aid","ความช่วยเหลือด้านรัฐบาลและสังคมที่ให้"
"government_health_spending_of_total_gov_spending_percent","ค่าใช้จ่ายที่รัฐบาลออกสำหรับสุขภาพเทียบกับค่าใช้จ่ายของรัฐบาลทั้งหมด (ร้อยละ)"
"government_health_spending_per_person_international_dollar","ค่าใช้จ่ายที่รัฐบาลออกสำหรับสุขภาพต่อประชากร (ดอลลาร์นานาชาติ)"
"government_health_spending_per_person_us","ค่าใช้จ่ายที่รัฐบาลออกสำหรับสุขภาพต่อประชากร (ดอลลาร์สหรัฐ)"
"government_share_of_total_health_spending_percent","สัดส่วนค่าใช้จ่ายที่รัฐบาลออกสำหรับสุขภาพ"
"gwid",""
"hdi_human_development_index","ดัชนีการพัฒนามนุษย์"
"health_aid_given_percent_of_aid","ความช่วยเหลือด้านสาธารณสุขที่ให้"
"hepb3_immunized_percent_of_one_year_olds","ผู้ได้รับวัคซีนตับอักเสบบีเข็มที่ 3"
"hib3_immunized_percent_of_one_year_olds","ผู้ได้รับวัคซีนฮิบเข็มที่ 3"
"high_technology_exports_percent_of_manufactured_exports","การส่งออกที่ใช้เทคโนโลยีระดับสูง"
"hiv_deaths_in_children_1_59_months_per_1000_births","เด็กที่เสียชีวิตจากการติดเชื้อเอชไอวี (ต่อการเกิด 1,000 ราย)"
"hiv_deaths_in_children_1_59_months_total_deaths","ผู้เสียชีวิตจากโรคติดเชื้อเอชไอวี"
"hourly_compensation_us","ค่าตอบแทนรายชั่วโมง"
"hydro_power_generation_per_person","ไฟฟ้าที่ผลิตจากพลังงานน้ำต่อคน"
"hydro_power_generation_total","ไฟฟ้าที่ผลิตจากพลังงานน้ำทั้งหมด"
"ifpri_underweight_children","เด็กที่น้ำหนักต่ำกว่าเกณฑ์"
"imports_percent_of_gdp","การนำเข้า (ร้อยละของผลิตภัณฑ์ในประเทศ)"
"imports_unit_value_index_2000100","มูลค่าการนำเข้าต่อหน่วย"
"income_groups",""
"income_mountains",""
"income_per_person_gdppercapita_ppp_inflation_adjusted","รายได้"
"income_per_person_long_series","รายได้ต่อประชากร ระยะยาว"
"income_per_person_with_projections","รายได้ต่อประชากร และการคาดการณ์"
"income_share_of_2nd_poorest_20percent","สัดส่วนของรายได้ของประชากรร้อยละ 20 ที่ยากจนที่สุดลำดับที่ 2"
"income_share_of_2nd_richest_20percent","สัดส่วนของรายได้ของประชากรร้อยละ 20 ที่ร่ำรวยที่สุดลำดับที่ 2"
"income_share_of_middle_20percent","สัดส่วนของรายได้ของประชากรร้อยละ 20 ที่ฐานะปานกลาง"
"income_share_of_poorest_10percent","สัดส่วนของรายได้ของประชากรร้อยละ 10 ที่ยากจนที่สุด"
"income_share_of_poorest_20percent","สัดส่วนของรายได้ของประชากรร้อยละ 20 ที่ยากจนที่สุดลำดับที่ 1"
"income_share_of_richest_10percent","สัดส่วนของรายได้ของประชากรร้อยละ 10 ที่ร่ำรวยที่สุด"
"income_share_of_richest_20percent","สัดส่วนของรายได้ของประชากรร้อยละ 20 ที่ร่ำรวยที่สุดลำดับที่ 1"
"indicator_url",""
"industrial_water_withdrawal_percent_of_total","น้ำที่ใช้ในอุตสาหกรรม"
"industry_percent_of_gdp","อุตสาหกรรม (ร้อยละของผลิตภัณฑ์ในประเทศ)"
"industry_workers_percent_of_labour_force","แรงงานอุตสาหกรรม"
"inequality_index_gini","ดัชนีความไม่เท่าเทียมทางเศรษฐกิจ (จีนี)"
"infant_mortality_rate_per_1000_births","อัตราการตายของเด็กทารก"
"infectious_tb_detection_rate_percent","อัตราตรวจพบวัณโรคที่แพร่เชื้อ"
"infectious_tb_detection_rate_percent_dots_only","อัตราตรวจพบวัณโรคที่แพร่เชื้อ เฉพาะที่ได้การรักษาภายใต้การสังเกตโดยตรง (DOTS)"
"infectious_tb_new_cases_per_100000_estimated","ผู้ป่วยวัณโรคที่แพร่เชื้อรายใหม่ต่อประชากร 100,000 คน (ค่าประมาณ)"
"infectious_tb_new_cases_per_100000_reported","ผู้ป่วยวัณโรคที่แพร่เชื้อรายใหม่ต่อประชากร 100,000 คน (ค่าจากรายงาน)"
"infectious_tb_number_of_new_cases_estimated","ผู้ป่วยวัณโรคที่แพร่เชื้อรายใหม่ (ค่าประมาณ)"
"infectious_tb_number_of_new_cases_reported","ผู้ป่วยวัณโรคที่แพร่เชื้อรายใหม่ (ค่าจากรายงาน)"
"infectious_tb_treatment_dots_completed_percent","การรักษาวัณโรคที่แพร่เชื้อ ภายใต้การสังเกตโดยตรง (DOTS) ได้ครบถ้วน"
"inflation_annual_percent","อัตราเงินเฟ้อ"
"injury_deaths_in_children_1_59_months_per_1000_births","เด็กที่เสียชีวิตจากการบาดเจ็บ (ต่อการเกิด 1,000 ราย)"
"injury_deaths_in_children_1_59_months_total_deaths","เด็กที่เสียชีวิตจากบาดเจ็บ (ทั้งหมด)"
"internal_renewable_water_cu_meters_per_person","น้ำที่นำกลับมาใช้ใหม่ภายใน"
"internet_users","ผู้ใช้อินเทอร์เน็ต"
"investments_percent_of_gdp","การลงทุน"
"iso3166_1_alpha2",""
"iso3166_1_alpha3",""
"iso3166_1_numeric",""
"iso3166_2",""
"landlocked",""
"latitude",""
"life_expectancy_at_birth_data_from_ihme","อายุเฉลี่ย ข้อมูลจากสถาบันวัดและประเมินผลทางสุขภาพ (IHME)"
"life_expectancy_at_birth_with_projections","อายุเฉลี่ยพร้อมการประมาณ"
"life_expectancy_female","อายุเฉลี่ยของผู้หญิง"
"life_expectancy_male","อายุเฉลี่ยของผู้ชาย"
"life_expectancy_years","อายุเฉลี่ย"
"literacy_rate_adult_female_percent_of_females_ages_15_above","อัตราการรู้หนังสือของผู้หญิง"
"literacy_rate_adult_male_percent_of_males_ages_15_and_above","อัตราการรู้หนังสือของผู้ชาย"
"literacy_rate_adult_total_percent_of_people_ages_15_and_above","อัตราการรู้หนังสือของผู้ใหญ่"
"literacy_rate_youth_female_percent_of_females_ages_15_24","อัตราการรู้หนังสือของเยาวชนหญิง"
"literacy_rate_youth_male_percent_of_males_ages_15_24","อัตราการรู้หนังสือของเยาวชนชาย"
"literacy_rate_youth_total_percent_of_people_ages_15_24","อัตราการรู้หนังสือของเยาวชน"
"liver_cancer_deaths_per_100000_men","จำนวนผู้ชายที่เสียชีวิตจากมะเร็งตับ (ต่อประชากรชาย 100,000 คน)"
"liver_cancer_deaths_per_100000_women","จำนวนผู้หญิงที่เสียชีวิตจากมะเร็งตับ (ต่อประชากรหญิง 100,000 คน)"
"liver_cancer_new_cases_per_100000_men","จำนวนผู้ชายที่เป็นผู้ป่วยมะเร็งตับรายใหม่ต่อผู้ชาย 100,000 คน"
"liver_cancer_new_cases_per_100000_women","จำนวนหญิงที่เป็นผู้ป่วยมะเร็งตับรายใหม่ต่อผู้หญิง 100,000 คน"
"liver_cancer_number_of_female_deaths","จำนวนผู้หญิงที่เสียชีวิตจากมะเร็งตับ"
"liver_cancer_number_of_male_deaths","จำนวนผู้ชายที่เสียชีวิตจากมะเร็งตับ"
"liver_cancer_number_of_new_female_cases","จำนวนผู้หญิงที่เป็นผู้ป่วยมะเร็งตับรายใหม่"
"liver_cancer_number_of_new_male_cases","จำนวนผู้ชายที่เป็นผู้ป่วยมะเร็งตับรายใหม่"
"long_term_unemployment_rate_percent","อัตราการว่างงานในระยะยาว"
"longitude",""
"lung_cancer_deaths_per_100000_men","จำนวนผู้ชายที่เสียชีวิตจากมะเร็งปอด (ต่อประชากรชาย 100,000 คน)"
"lung_cancer_deaths_per_100000_women","จำนวนผู้หญิงที่เสียชีวิตจากมะเร็งปอด (ต่อประชากรหญิง 100,000 คน)"
"lung_cancer_new_cases_per_100000_men","จำนวนผู้ชายที่เป็นผู้ป่วยมะเร็งปอดรายใหม่ต่อผู้ชาย 100,000 คน"
"lung_cancer_new_cases_per_100000_women","จำนวนหญิงที่เป็นผู้ป่วยมะเร็งปอดรายใหม่ต่อผู้หญิง 100,000 คน"
"lung_cancer_number_of_female_deaths","จำนวนผู้หญิงที่เสียชีวิตจากมะเร็งปอด"
"lung_cancer_number_of_male_deaths","จำนวนผู้ชายที่เสียชีวิตจากมะเร็งปอด"
"lung_cancer_number_of_new_female_cases","จำนวนผู้หญิงที่เป็นผู้ป่วยมะเร็งปอดรายใหม่"
"lung_cancer_number_of_new_male_cases","จำนวนผู้ชายที่เป็นผู้ป่วยมะเร็งปอดรายใหม่"
"main_religion_2008",""
"malaria_cases_per_100000_reported","จำนวนผู้ป่วยมาลาเรียที่ได้รับรายงานต่อประชากร 100,000 คน"
"malaria_deaths_in_children_1_59_months_per_1000_births","จำนวนเด็กที่เสียชีวิตจากมาลาเรีย (ต่อการเกิด 1,000 ราย)"
"malaria_deaths_in_children_1_59_months_total_deaths","เด็กที่เสียชีวิตจากมาลาเรีย"
"malaria_deaths_per_100000_reported","ผู้เสียชีวิตจากมาลาเรียต่อประชากร 100,000 คน"
"malaria_number_of_cases_reported","จำนวนผู้ป่วยมาลาเรีย"
"malaria_number_of_deaths_reported","จำนวนผู้เสียชีวิตจากมาลาเรีย"
"male_agriculture_workers_percent_of_male_labour_force","เกษตรกรชาย"
"male_family_workers_percent_of_male_labour_force","แรงงานครอบครัวชาย"
"male_industry_workers_percent_of_male_labour_force","แรงงานอุตสาหกรรมชาย"
"male_long_term_unemployment_rate_percent","อัตราการว่างงานในระยะยาวของผู้ชาย"
"male_population_with_projections","ประชากรชาย และการคาดการณ์"
"male_salaried_workers_percent_of_male_labour_force","แรงงานชายที่ได้รับค่าจ้าง"
"male_self_employed_percent_of_male_labour_force","ผู้ชายที่มีกิจการส่วนตัว"
"male_service_workers_percent_of_male_labour_force","แรงงานบริการชาย"
"males_aged_15_24_employment_rate_percent","ผู้ชายอายุ 15-24 ปี"
"males_aged_15_24_unemployment_rate_percent","ผู้ชายอายุ 15-24 ปี"
"males_aged_15_64_labour_force_participation_rate_percent","ผู้ชายอายุ 15-64 ปี"
"males_aged_15plus_employment_rate_percent","ผู้ชายอายุ 15 ปีขึ้นไป"
"males_aged_15plus_labour_force_participation_rate_percent","ผู้ชายอายุ 15 ปีขึ้นไป"
"males_aged_15plus_unemployment_rate_percent","ผู้ชายอายุ 15 ปีขึ้นไป"
"males_aged_25_54_labour_force_participation_rate_percent","ผู้ชายอายุ 25-54 ปี"
"males_aged_25_54_unemployment_rate_percent","ผู้ชายอายุ 25-54 ปี"
"males_aged_55plus_unemployment_rate_percent","ผู้ชายอายุ 55 ปีขึ้นไป"
"males_aged_65plus_labour_force_participation_rate_percent","ผู้ชายอายุ 65 ปีขึ้นไป"
"malnutrition_weight_for_age_percent_of_children_under_5","ภาวะทุพโภชนาการคำนวณตามน้ำหนักต่ออายุ"
"market_value_of_listed_companies_percent_of_gdp","มูลค่าตลาดของบริษัทจดทะเบียน"
"maternal_deaths_lifetime_risk_per_1000","จำนวนมารดาที่เสียชีวิต ความเสี่ยงตลอดช่วงชีวิต (ต่อ 1,000 คน)"
"maternal_deaths_total_number","จำนวนมารดาที่เสียชีวิต"
"maternal_mortality_ratio_per_100000_live_births","อัตราตายของมารดา"
"maternal_mortality_ratio_who","อัตราตายของมารดา โดยองค์การอนามัยโลก"
"math_achievement_4th_grade","ผลสัมฤทธิ์ทางคณิตศาสตร์ - เกรด 4"
"math_achievement_8th_grade","ผลสัมฤทธิ์ทางคณิตศาสตร์ - เกรด 8"
"mcv_immunized_percent_of_one_year_olds","ผู้ได้รับวัคซีนไข้กาฬหลังแอ่น"
"mean_years_in_school_men_15_to_24_years","ผู้ชายอายุ 15-24 ปี"
"mean_years_in_school_men_25_to_34_years","ผู้ชายอายุ 25-34 ปี"
"mean_years_in_school_men_25_years_and_older","ผู้ชายอายุ 25 ปีขึ้นไป"
"mean_years_in_school_men_35_to_44_years","ผู้ชายอายุ 35-44 ปี"
"mean_years_in_school_men_45_to_54_years","ผู้ชายอายุ 45-54 ปี"
"mean_years_in_school_men_55_to_64_years","ผู้ชายอายุ 55-64 ปี"
"mean_years_in_school_men_65_plus_years","ผู้ชายอายุ 65 ปีขึ้นไป"
"mean_years_in_school_women_15_to_24_years","ผู้หญิงอายุ 15-24 ปี"
"mean_years_in_school_women_25_to_34_years","ผู้หญิงอายุ 25-34 ปี"
"mean_years_in_school_women_25_years_and_older","ผู้หญิงอายุ 25 ปีขึ้นไป"
"mean_years_in_school_women_35_to_44_years","ผู้หญิงอายุ 35-44 ปี"
"mean_years_in_school_women_45_to_54_years","ผู้หญิงอายุ 45-54 ปี"
"mean_years_in_school_women_55_to_64_years","ผู้หญิงอายุ 55-64 ปี"
"mean_years_in_school_women_65_plus_years","ผู้หญิงอายุ 65 ปีขึ้นไป"
"mean_years_in_school_women_of_reproductive_age_15_to_44","ผู้หญิงอายุ 15-44 ปี"
"mean_years_in_school_women_percent_men_25_to_34_years","อัตราส่วนจำนวนปีที่เข้าเรียน (ร้อยละของผู้หญิงต่อผู้ชาย อายุ 25-34 ปี)"
"measles_deaths_in_children_1_59_months_per_1000_births","จำนวนเด็กที่เสียชีวิตจากโรคหัด (ต่อการเกิด 1,000 ราย)"
"measles_deaths_in_children_1_59_months_total_deaths","จำนวนเด็กที่เสียชีวิตจากโรคหัด"
"median_age_years","ค่ามัธยฐานของอายุ"
"medical_doctors_per_1000_people","จำนวนแพทย์ (ต่อประชากร 1,000 คน)"
"meningitis_deaths_in_children_1_59_months_per_1000_births","จำนวนเด็กที่เสียชีวิตจากเยื่อหุุ้มสมองอักเสบ (ต่อการเกิด 1,000 ราย)"
"meningitis_deaths_in_children_1_59_months_total_deaths","จำนวนเด็กอที่เสียชีวิตจากเยื่อหุุ้มสมองอักเสบ"
"merchandise_trade_percent_of_gdp","ปริมาณการค้า"
"military_expenditure_percent_of_gdp","ค่าใช้จ่ายในทางทหาร"
"motorcycle_deaths_per_100000_people","ผู้เสียชีวิตจากรถจักรยานยนต์"
"multisector_cross_cutting_aid_given_percent_of_aid","ความช่วยเหลือหลายภาคส่วนที่ให้"
"municipal_water_withdrawal_cu_meters_per_person","น้ำที่ใช้ในบ้านเรือนต่อคน"
"municipal_water_withdrawal_percent_of_total","น้ำที่ใช้ในบ้านเรือน"
"murder_per_100000_people","ผู้เสียชีวิตจากถูกฆาตกรรม (ต่อประชากร 100,000 คน)"
"murder_total_deaths","ผู้เสียชีวิตจากถูกฆาตกรรม"
"murdered_15_29_per_100000_people","ผู้อายุ 15-29 ปีที่ถูกฆาตกรรม (ต่อประชากร 100,000 คน)"
"murdered_30_44_per_100000_people","ผู้อายุ 30-44 ปีที่ถูกฆาตกรรม (ต่อประชากร 100,000 คน)"
"murdered_45_59_per_100000_people","ผู้อายุ 45-59 ปีที่ถูกฆาตกรรม (ต่อประชากร 100,000 คน)"
"murdered_60plus_per_100000_people","ผู้อายุ 60 ปีขึ้นไปที่ถูกฆาตกรรม (ต่อประชากร 100,000 คน)"
"murdered_children_0_14_per_100000_people","ผู้อายุ 0-14 ปีที่ถูกฆาตกรรม (ต่อประชากร 100,000 คน)"
"murdered_men_per_100000_people","ผู้ชายที่ถูกฆาตกรรม (ต่อประชากร 100,000 คน)"
"murdered_women_per_100000_people","ผู้หญิงที่ถูกฆาตกรรม (ต่อประชากร 100,000 คน)"
"name",""
"name_catalog",""
"name_long",""
"name_short",""
"natural_gas_production_per_person","การผลิตแก๊สธรรมชาติต่อคน"
"natural_gas_production_total","การผลิตแก๊สธรรมชาติทั้งหมด"
"natural_gas_proved_reserves_total","แก๊สธรรมชาติสำรองทั้งหมด"
"natural_gas_proven_reserves_per_person","แก๊สธรรมชาติสำรองต่อคน"
"ncd_deaths_in_children_1_59_months_per_1000_births","เด็กที่เสียชีวิตจากโรคไม่ติดต่อ (ต่อการเกิด 1,000 ราย)"
"ncd_deaths_in_children_1_59_months_total_deaths","เด็กที่เสียชีวิตจากโรคไม่ติดต่อ"
"net_barter_terms_of_trade_2000_100","สัดส่วนของราคาสินค้าออกต่อราคาสินค้าเข้า"
"new_births_total_number_estimated","จำนวนเด็กที่เกิดใหม่"
"newborn_deaths","จำนวนเด็กทารกแรกเกิดที่เสียชีวิต"
"newborn_mortality_rate_per_1000","อัตราการตายของเด็กทารกแรกเกิด"
"newly_hiv_infected_number_all_ages","ผู้ติดเชื้อเอชไอวีรายใหม่"
"newly_hiv_infected_percent_age_15_49","ผู้ติดเชื้อเอชไอวีรายใหม่อายุ 15-49 ปี (ร้อยละ)"
"nuclear_power_generation_per_person","ไฟฟ้าที่ผลิตจากพลังงานนิวเคลียร์ต่อคน"
"nuclear_power_generation_total","ไฟฟ้าที่ผลิตจากพลังงานนิวเคลียร์ทั้งหมด"
"number_of_child_deaths","จำนวนเด็กที่เสียชีวิต"
"number_of_people_in_poverty","จำนวนประชากรที่อยู่อย่างยากจน"
"oil_consumption_per_cap","การใช้น้ำมันต่อคน"
"oil_consumption_total","การใช้น้ำมัน"
"oil_production_per_person","การผลิตน้ำมันต่อคน"
"oil_production_total","การผลิตน้ำมัน"
"oil_proved_reserves_total","น้ำมันสำรอง"
"oil_proven_reserves_per_person","น้ำมันสำรองต่อคน"
"other_deaths_in_newborn_per_1000_births","เด็กทารกแรกเกิดที่เสียชีวิตจากสาเหตุอื่น (ต่อการเกิด 1,000 ราย)"
"other_deaths_in_newborn_total_deaths","เด็กทารกแรกเกิดที่เสียชีวิตจากสาเหตุอื่น"
"other_infections_deaths_in_children_1_59_months_per_1000_birt","เด็กที่เสียชีวิตจากการติดเชื้ออื่น (ต่อการเกิด 1,000 ราย)"
"other_infections_deaths_in_children_1_59_months_total_deaths","เด็กที่เสียชีวิตจากการติดเชื้ออื่น"
"other_social_services_aid_given_percent_of_aid","ความช่วยเหลือด้านสังคมสงเคราะห์อื่นที่ให้"
