"concept","name_catalog"
"out_of_pocket_share_of_total_health_spending_percent","สัดส่วนค่าใช้จ่ายจริงสำหรับสุขภาพ"
"pab_immunized_percent_of_newborns","การป้องกันบาดทะยักในทารกแรกเกิด"
"pandg",""
"parent",""
"patent_applications_total","สิทธิบัตรที่ขอยื่นจดทะเบียน"
"patents_granted_total","สิทธิบัตรที่ได้รับจดทะเบียน"
"patents_in_force_total","สิทธิบัตรที่มีผลบังคับใช้"
"people_living_with_hiv_number_all_ages","ผู้ติดเชื้อเอชไอวีทุกอายุ"
"personal_computers_per_100_people","คอมพิวเตอร์ส่วนบุคคล (ต่อประชากร 100 คน)"
"personal_computers_total","คอมพิวเตอร์ส่วนบุคคล"
"pertussis_deaths_in_children_1_59_months_per_1000_births","จำนวนเด็กที่เสียชีวิตจากไอกรน (ต่อการเกิด 1,000 ราย)"
"pertussis_deaths_in_children_1_59_months_total_deaths","เด็กอายุ 1-59 เดือนที่เสียชีวิตจากไอกรน"
"plane_crash_affected_annual_number","ผู้ได้รับผลกระทบจากเครื่องบินตก"
"plane_crash_deaths_annual_number","ผู้เสียชีวิตจากเครื่องบินตก"
"planted_forest_area_ha","พื้นที่ป่าปลูก"
"pneumonia_deaths_in_children_1_59_months_per_1000_births","จำนวนเด็กที่เสียชีวิตจากปอดอักเสบ (ต่อการเกิด 1,000 ราย)"
"pneumonia_deaths_in_children_1_59_months_total_deaths","เด็กอายุ 1-59 เดือนที่เสียชีวิตจากปอดอักเสบ"
"pneumonia_deaths_in_newborn_per_1000_births","จำนวนเด็กทารกแรกเกิดที่เสียชีวิตจากปอดอักเสบ (ต่อการเกิด 1,000 ราย)"
"pneumonia_deaths_in_newborn_total_deaths","จำนวนเด็กทารกแรกเกิดที่เสียชีวิตจากปอดอักเสบ"
"poisonings_deaths_per_100000_people","ผู้เสียชีวิตจากสารพิษ (ต่อประชากร 100,000 คน)"
"population_aged_0_4_years_both_sexes_percent","ประชากรอายุ 0-4 ปี (ร้อยละ)"
"population_aged_0_4_years_female_percent","ประชากรอายุ 0-4 ปี เพศหญิง (ร้อยละ)"
"population_aged_0_4_years_male_percent","ประชากรอายุ 0-4 ปี เพศชาย (ร้อยละ)"
"population_aged_0_4_years_total_number","ประชากรอายุ 0-4 ปี ทั้งหมด"
"population_aged_10_14_years_both_sexes_percent","ประชากรอายุ 10-14 ปี (ร้อยละ)"
"population_aged_10_14_years_female_percent","ประชากรอายุ 10-14 ปี เพศหญิง (ร้อยละ)"
"population_aged_10_14_years_male_percent","ประชากรอายุ 10-14 ปี เพศชาย (ร้อยละ)"
"population_aged_10_14_years_total_number","ประชากรอายุ 10-14 ปี ทั้งหมด"
"population_aged_15_19_years_both_sexes_percent","ประชากรอายุ 15-19 ปี (ร้อยละ)"
"population_aged_15_19_years_female_percent","ประชากรอายุ 15-19 ปี เพศหญิง (ร้อยละ)"
"population_aged_15_19_years_male_percent","ประชากรอายุ 15-19 ปี เพศชาย (ร้อยละ)"
"population_aged_15_19_years_total_number","ประชากรอายุ 15-19 ปี ทั้งหมด"
"population_aged_20_39_years_both_sexes_percent","ประชากรอายุ 20-39 ปี (ร้อยละ)"
"population_aged_20_39_years_female_percent","ประชากรอายุ 20-39 ปี เพศหญิง (ร้อยละ)"
"population_aged_20_39_years_male_percent","ประชากรอายุ 20-39 ปี เพศชาย (ร้อยละ)"
"population_aged_20_39_years_total_number","ประชากรอายุ 20-39 ปี ทั้งหมด"
"population_aged_40_59_years_both_sexes_percent","ประชากรอายุ 40-59 ปี (ร้อยละ)"
"population_aged_40_59_years_female_percent","ประชากรอายุ 40-59 ปี เพศหญิง (ร้อยละ)"
"population_aged_40_59_years_male_percent","ประชากรอายุ 40-59 ปี เพศชาย (ร้อยละ)"
"population_aged_40_59_years_total_number","ประชากรอายุ 40-59 ปี ทั้งหมด"
"population_aged_5_9_years_both_sexes_percent","ประชากรอายุ 5-9 ปี (ร้อยละ)"
"population_aged_5_9_years_female_percent","ประชากรอายุ 5-9 ปี เพศหญิง (ร้อยละ)"
"population_aged_5_9_years_male_percent","ประชากรอายุ 5-9 ปี เพศชาย (ร้อยละ)"
"population_aged_5_9_years_total_number","ประชากรอายุ 5-9 ปี ทั้งหมด"
"population_aged_60plus_years_both_sexes_percent","ประชากรอายุ 60 ปีขึ้นไป (ร้อยละ)"
"population_aged_60plus_years_female_percent","ประชากรอายุ 60 ปีขึ้นไป เพศหญิง (ร้อยละ)"
"population_aged_60plus_years_male_percent","ประชากรอายุ 60 ปีขึ้นไป เพศชาย (ร้อยละ)"
"population_aged_60plus_years_total_number","ประชากรอายุ 60 ปีขึ้นไป ทั้งหมด"
"population_density_per_square_km","ความหนาแน่นของประชากร"
"population_growth_annual_percent","การเพิ่มขึ้นของประชากร"
"population_growth_annual_percent_with_projections","การเพิ่มขึ้นของประชากร และการคาดการณ์"
"population_in_urban_agglomerations_m_1_million_percent_of_total","ประชากรในชุมชนเมือง"
"population_policies_aid_given_percent_of_aid","ความช่วยเหลือด้านนโยบายประชากรที่ให้"
"population_total","ประชากร"
"poverty_percent_people_below_320_a_day","ความยากจนข้นแค้น"
"poverty_percent_people_below_550_a_day","ความยากจนข้นแค้น"
"prematurity_deaths_in_newborn_per_1000_births","เด็กทารกแรกเกิดที่เสียชีวิตจากการเกิดก่อนกำหนด (ต่อการเกิด 1,000 ราย)"
"prematurity_deaths_in_newborn_total_deaths","เด็กทารกแรกเกิดที่เสียชีวิตจากการเกิดก่อนกำหนด"
"present_value_of_debt_percent_of_gni","มูลค่าปัจจุบันของหนี้"
"primary_completion_rate_total_percent_of_relevant_age_group","เด็กวัยประถมที่จบระดับประถมศึกษา"
"primary_forest_area_ha","พื้นที่ป่าธรรมชาติ"
"primary_school_completion_percent_of_boys","เด็กผู้ชายที่จบระดับประถมศึกษา"
"primary_school_completion_percent_of_girls","เด็กผู้หญิงที่จบระดับประถมศึกษา"
"private_share_of_total_health_spending_percent","สัดส่วนค่าใช้จ่ายที่เอกชนออกสำหรับสุขภาพ"
"privately_owned_forest_land_percent","เนื้อที่ป่าที่เอกชนเป็นเจ้าของ"
"privately_owned_other_wooded_land_percent","เนื้อที่ปลูกต้นไม้ที่เอกชนเป็นเจ้าของ"
"production_sector_aid_given_percent_of_aid","ความช่วยเหลือด้านการผลิตที่ให้"
"prostate_cancer_deaths_per_100000_men","จำนวนผู้ชายที่เสียชีวิตจากมะเร็งต่อมลูกหมาก (ต่อประชากรชาย 100,000 คน)"
"prostate_cancer_new_cases_per_100000_men","จำนวนผู้ชายที่เป็นผู้ป่วยมะเร็งต่อมลูกหมายรายใหม่ต่อผู้ชาย 100,000 คน"
"prostate_cancer_number_of_male_deaths","จำนวนผู้เสียชีวิตจากมะเร็งต่อมลูกหมาก"
"prostate_cancer_number_of_new_male_cases","จำนวนผู้ป่วยมะเร็งต่อมลูกหมากรายใหม่"
"pump_price_for_gasoline_us_per_liter","ราคาน้ำมันที่สถานีบริการ"
"rank",""
"ratio_of_girls_to_boys_in_primary_and_secondary_education_perc","อัตราส่วนเด็กผู้หญิงต่อเด็กผู้ชายวัยเรียน"
"ratio_of_young_literate_females_to_males_percent_ages_15_24","อัตราส่วนผู้หญิงต่อผู้ชายที่รู้หนังสือ"
"renewable_water_cu_meters_per_person","น้ำที่นำกลับมาใช้ใหม่"
"residential_electricity_use_per_person","ไฟฟ้าที่ใช้ในครัวเรือนต่อคน"
"residential_electricity_use_total","ไฟฟ้าที่ใช้ในครัวเรือนทั้งหมด"
"residential_energy_use_percent","พลังงานที่ใช้ในครัวเรือน"
"roads_paved_percent_of_total_roads","ถนนที่ราดยาง"
"rural_poverty_percent_rural_people_below_national_rural","ความยากจนในชนบท"
"salaried_workers_percent_of_labour_force","แรงงานที่ได้รับค่าจ้าง"
"scales",""
"self_employed_percent_of_labour_force","ประชากรที่มีกิจการส่วนตัว"
"sepsis_deaths_in_newborn_per_1000_births",""
"sepsis_deaths_in_newborn_total_deaths",""
"service_workers_percent_of_labour_force","แรงงานบริการ"
"services_percent_of_gdp","การบริการ (ร้อยละของผลิตภัณฑ์ในประเทศ)"
"sex_ratio_0_14_years",""
"sex_ratio_15_24_years",""
"sex_ratio_15_49_years",""
"sex_ratio_above_50_years",""
"sex_ratio_all_age_groups",""
"shape_lores_svg",""
"smoking_adults_percent_of_population_over_age_15",""
"smoking_men_percent_of_men_over_age_15",""
"smoking_women_percent_of_women_over_age_15",""
"source",""
"source_long",""
"source_url",""
"stillbirths_per_1000_births",""
"stomach_cancer_deaths_per_100000_men",""
"stomach_cancer_deaths_per_100000_women",""
"stomach_cancer_new_cases_per_100000_men",""
"stomach_cancer_new_cases_per_100000_women",""
"stomach_cancer_number_of_female_deaths",""
"stomach_cancer_number_of_male_deaths",""
"stomach_cancer_number_of_new_female_cases",""
"stomach_cancer_number_of_new_male_cases",""
"storm_affected_annual_number","ผู้ได้รับผลกระทบจากพายุ"
"storm_deaths_annual_number","ผู้เสียชีวิตจากพายุ"
"subsistence_incomes_per_person","รายได้พอยังชีพต่อคน"
"sugar_per_person_g_per_day",""
"suicide_age_0_14_per_100000_people",""
"suicide_age_15_29_per_100000_people",""
"suicide_age_30_44_per_100000_people",""
"suicide_age_45_59_per_100000_people",""
"suicide_age_60plus_per_100000_people",""
"suicide_men_per_100000_people",""
"suicide_per_100000_people",""
"suicide_total_deaths","ผู้เสียชีวิตจากการฆ่าตัวตายทั้งหมด"
"suicide_women_per_100000_people",""
"sulfur_emissions_per_person_kg",""
"surface_area_sq_km",""
"surviving_kids_per_woman",""
"tag",""
"tags",""
"tax_revenue_percent_of_gdp",""
"tb_programme_dots_population_coverage_percent","ความครอบคลุมของการรักษาวัณโรคภายใต้การสังเกตโดยตรง (DOTS)"
"tb_with_hivplus_deaths_per_100000_estimated","ผู้เสียชีวิตจากวัณโรคที่ติดเชื้อเอชไอวีต่อประชากร 100,000 คน (ค่าประมาณ)"
"tb_with_hivplus_existing_cases_per_100000_estimated","ผู้ป่วยวัณโรคที่ติดเชื้อเอชไอวีต่อประชากร 100,000 คน (ค่าประมาณ)"
"tb_with_hivplus_new_cases_per_100000_estimated","ผู้ป่วยวัณโรครายใหม่ที่ติดเชื้อเอชไอวีต่อประชากร 100,000 คน (ค่าประมาณ)"
"tb_with_hivplus_number_of_deaths_estimated","ผู้เสียชีวิตจากวัณโรคที่ติดเชื้อเอชไอวี (ค่าประมาณ)"
"tb_with_hivplus_number_of_existing_cases_estimated","ผู้ป่วยวัณโรคที่ติดเชื้อเอชไอวี (ค่าประมาณ)"
"tb_with_hivplus_number_of_new_cases_estimated","ผู้ป่วยวัณโรครายใหม่ที่ติดเชื้อเอชไอวี (ค่าประมาณ)"
"teen_fertility_rate_births_per_1000_women_ages_15_19",""
"tetanus_deaths_in_newborn_per_1000_births",""
"tetanus_deaths_in_newborn_total_deaths",""
"time",""
"topojson",""
"total_gdp_ppp_inflation_adjusted","ผลิตภัณฑ์ในประเทศรวม (ดอลลาร์สหรัฐตามความเสมอภาคแห่งอํานาจซื้อ ปรับตามเงินเฟ้อ)"
"total_gdp_us_inflation_adjusted","ผลิตภัณฑ์ในประเทศรวม (ดอลลาร์สหรัฐ/ปรับตามเงินเฟ้อ)"
"total_gni_ppp_current_international","รายได้มวลรวมประชาชาติรวม"
"total_health_spending_per_person_international_dollar","ค่าใช้จ่ายทั้งหมดสำหรับสุขภาพต่อประชากร (ดอลลาร์นานาชาติ)"
"total_health_spending_per_person_us","ค่าใช้จ่ายทั้งหมดสำหรับสุขภาพต่อประชากร (ดอลลาร์สหรัฐ)"
"total_health_spending_percent_of_gdp","ค่าใช้จ่ายทางสาธารณสุข (ร้อยละของผลิตภัณฑ์ในประเทศ)"
"total_number_of_dollar_billionaires","ผู้ที่มีทรัพย์สินมากกว่าหนึ่งพันล้านดอลลาร์"
"total_population_with_projections",""
"total_reserves_percent_of_debt_to_foreigners",""
"total_sulfur_emission_kilotonnes",""
"total_water_withdrawal_billion_cu_meters","ปริมาณน้ำที่นำมาใช้"
"trade_balance_percent_of_gdp","ดุลการค้า (ร้อยละของผลิตภัณฑ์ในประเทศ)"
"trade_balance_us_not_inflation_adjusted",""
"traffic_deaths_men_per_100000_people","ผู้ชายที่เสียชีวิตจากอุบัติเหตุจราจร (ต่อประชากรชาย 100,000 คน)"
"traffic_deaths_per_100000_people","ผู้เสียชีวิตจากอุบัติเหตุจราจร (ต่อประชากร 100,000 คน)"
"traffic_deaths_women_per_100000_people","ผู้หญิงที่เสียชีวิตจากอุบัติเหตุจราจร (ต่อประชากรหญิง 100,000 คน)"
"traffic_mortality_15_29_per_100000_people","จำนวนผู้อายุ 15-29 ปีที่เสียชีวิตจากอุบัติเหตุจราจร (ต่อประชากร 100,000 คน)"
"traffic_mortality_30_44_per_100000_people","จำนวนผู้อายุ 30-44 ปีที่เสียชีวิตจากอุบัติเหตุจราจร (ต่อประชากร 100,000 คน)"
"traffic_mortality_45_59_per_100000_people","จำนวนผู้อายุ 45-59 ปีที่เสียชีวิตจากอุบัติเหตุจราจร (ต่อประชากร 100,000 คน)"
"traffic_mortality_60plus_per_100000_people","จำนวนผู้อายุ 60 ปีขึ้นไปที่เสียชีวิตจากอุบัติเหตุจราจร (ต่อประชากร 100,000 คน)"
"traffic_mortality_children_0_14_per_100000_people","จำนวนผู้อายุ 0-14 ปีที่เสียชีวิตจากอุบัติเหตุจราจร (ต่อประชากร 100,000 คน)"
"traffic_total_deaths","ผู้เสียชีวิตจากอุบัติเหตุจราจร (ทั้งหมด)"
"tsunami_affected_annual_number","ผู้ได้รับผลกระทบจากสึนามิ"
"tsunami_deaths_annual_number","ผู้เสียชีวิตจากสึนามิ"
"un_state",""
"under_five_mortality_from_cme_per_1000_born",""
"under_five_mortality_from_ihme_per_1000_born",""
"underweight_children","เด็กที่น้ำหนักต่ำกว่าเกณฑ์"
"unicode_region_subtag",""
"upper_case_name",""
"urban_population",""
"urban_population_growth_annual_percent",""
"urban_population_percent_of_total",""
"urban_poverty_percent_urban_people_below_national_urban",""
"water_and_sanitation_aid_given_percent_of_aid","ความช่วยเหลือด้านการประปาและสุขาภิบาลที่ให้"
"water_withdrawal_cu_meters_per_person","ปริมาณน้ำที่นำมาใช้ต่อคน"
"wood_removal_cubic_meters",""
"working_hours_per_week",""
"world_4region",""
"world_6region",""
"yearly_co2_emissions_1000_tonnes","การปล่อยแก๊สคาร์บอนไดออกไซด์ต่อปี"
