"concept","name_catalog"
"adults_with_hiv_percent_age_15_49","ผู้ติดเชื้อเอชไอวีอายุ 15-49 ปี (ร้อยละ)"
"age_at_1st_marriage_women","อายุของผู้หญิงเมื่อแต่งงานครั้งแรก"
"aged_15_24_employment_rate_percent","อายุ 15-24 ปี"
"aged_15_24_unemployment_rate_percent","อายุ 15-24 ปี"
"aged_15_64_labour_force_participation_rate_percent","อายุ 15-64 ปี"
"aged_15plus_employment_rate_percent","อายุ 15 ปีขึ้นไป"
"aged_15plus_labour_force_participation_rate_percent","อายุ 15 ปีขึ้นไป"
"aged_15plus_unemployment_rate_percent","อายุ 15 ปีขึ้นไป"
"aged_25_54_labour_force_participation_rate_percent","อายุ 25-54 ปี"
"aged_25_54_unemployment_rate_percent","อายุ 25-54 ปี"
"aged_55plus_unemployment_rate_percent","อายุ 55 ปีขึ้นไป"
"aged_65plus_labour_force_participation_rate_percent","อายุ 65 ปีขึ้นไป"
"agricultural_land_percent_of_land_area","พื้นที่เกษตรกรรม"
"agricultural_water_withdrawal_percent_of_total","น้ำที่ใช้เพื่อเกษตรกรรม"
"agriculture_percent_of_gdp","เกษตรกรรม"
"agriculture_workers_percent_of_labour_force","เกษตรกร"
"aid_given_2007_us","ความช่วยเหลือที่ให้"
"aid_given_per_person_2007_us","ความช่วยเหลือที่ให้ต่อคน"
"aid_given_percent_of_gni","ความช่วยเหลือที่ให้ (ร้อยละของรายได้มวลรวมประชาชาติ)"
"aid_received_per_person_current_us","ความช่วยเหลือที่ได้รับต่อคน"
"aid_received_percent_of_gni","ความช่วยเหลือที่ได้รับ (ร้อยละของรายได้มวลรวมประชาชาติ)"
"aid_received_total_us_inflation_adjusted","ความช่วยเหลือที่ได้รับรวม"
"alcohol_consumption_per_adult_15plus_litres","การบริโภคแอลกอฮอล์"
"all_causes_deaths_in_children_1_59_months_per_1000_births","จำนวนเด็กทารกแรกเกิดที่เสียชีวิตจากทุกสาเหตุ (ต่อการเกิด 1,000 ราย)"
"all_causes_deaths_in_children_1_59_months_total_deaths","จำนวนเด็กทารกแรกเกิดที่เสียชีวิตจากทุกสาเหตุ (ทั้งหมด)"
"all_causes_deaths_in_newborn_per_1000_births","จำนวนเด็กทารกแรกเกิดที่เสียชีวิตจากทุกสาเหตุ (ต่อการเกิด 1,000 ราย)"
"all_causes_deaths_in_newborn_total_deaths","จำนวนเด็กทารกแรกเกิดที่เสียชีวิตจากทุกสาเหตุ (ทั้งหมด)"
"all_forms_of_tb_deaths_per_100000_estimated","ผู้เสียชีวิตจากวัณโรคทุกชนิดต่อประชากร 100,000 คน"
"all_forms_of_tb_detection_rate_percent","อัตราการตรวจพบวัณโรคทุกชนิด"
"all_forms_of_tb_detection_rate_percent_dots_only","อัตราการตรวจพบวัณโรคทุกชนิด เฉพาะที่ได้การรักษาภายใต้การสังเกตโดยตรง (DOTS)"
"all_forms_of_tb_existing_cases_per_100000_estimated","ผู้ป่วยวัณโรคทุกชนิดต่อประชากร 100,000 คน"
"all_forms_of_tb_new_cases_per_100000_estimated","ผู้ป่วยวัณโรคทุกชนิดรายใหม่ต่อประชากร 100,000 คน (ค่าประมาณ)"
"all_forms_of_tb_new_cases_per_100000_reported","ผู้ป่วยวัณโรคทุกชนิดรายใหม่ต่อประชากร 100,000 คน (ค่าจากรายงาน)"
"all_forms_of_tb_number_of_deaths_estimated","ผู้เสียชีวิตจากวัณโรคทุกชนิด"
"all_forms_of_tb_number_of_existing_cases_estimated","ผู้ป่วยวัณโรคทุกชนิด"
"all_forms_of_tb_number_of_new_cases_estimated","ผู้ป่วยวัณโรคทุกชนิดรายใหม่ (ค่าประมาณ)"
"all_forms_of_tb_number_of_new_cases_reported","ผู้ป่วยวัณโรคทุกชนิดรายใหม่ (ค่าจากรายงาน)"
"alt_5",""
"alternative_1",""
"alternative_2",""
"alternative_3",""
"alternative_4_cdiac",""
"alternative_gdp_per_capita_ppp_pwt_7_1","ผลิตภัณฑ์ในประเทศต่อหัว ตามความเสมอภาคแห่งอํานาจซื้อ จาก Penn World Table 7.1"
"alternative_gdp_per_capita_ppp_pwt_8_0","ผลิตภัณฑ์ในประเทศต่อหัว ตามความเสมอภาคแห่งอํานาจซื้อ จาก Penn World Table 8.0"
"alternative_gdp_per_capita_ppp_wb","ผลิตภัณฑ์ในประเทศต่อหัว ตามความเสมอภาคแห่งอํานาจซื้อ จากธนาคารโลก"
"alternative_gdppercapita_ppp_inflation_adjusted_from_pwt","ผลิตภัณฑ์ในประเทศต่อหัว ตามความเสมอภาคแห่งอํานาจซื้อ จาก Penn World Table (ปรับตามเงินเฟ้อ)"
"alternative_poverty_percent_below_nationally_defined_poverty","ความยากจนสัมพัทธ์"
"annual_hiv_deaths_number_all_ages","ผู้เสียชีวิตจากโรคติดเชื้อเอชไอวีต่อปี"
"arb1",""
"arb2",""
"arb3",""
"arb4",""
"arb5",""
"arb6",""
"armed_forces_personnel_percent_of_labor_force","ทหาร"
"armed_forces_personnel_total","ทหาร"
"arms_exports_us_inflation_adjusted","อาวุธที่ส่งออก"
"arms_imports_us_inflation_adjusted","อาวุธที่นำเข้า"
"art_coverage_percent_cd4_l_350","ผู้ป่วยที่ได้รับยาต้านไวรัส"
"at_least_basic_sanitation_overall_access_percent","การเข้าถึงสุขาภิบาลพื้นฐานโดยรวมทั้งประเทศ"
"at_least_basic_sanitation_rural_access_percent","การเข้าถึงสุขาภิบาลพื้นฐานในเขตชนบท"
"at_least_basic_sanitation_urban_access_percent","การเข้าถึงสุขาภิบาลพื้นฐานในเขตเมือง"
"at_least_basic_water_source_overall_access_percent","การเข้าถึงแหล่งน้ำโดยรวมทั้งประเทศ"
"at_least_basic_water_source_rural_access_percent","การเข้าถึงแหล่งน้ำในเขตชนบท"
"at_least_basic_water_source_urban_access_percent","การเข้าถึงแหล่งน้ำในเขตเมือง"
"average_age_of_dollar_billionaires_years","อายุเฉลี่ยของผู้ที่มีทรัพย์สินมากกว่าหนึ่งพันล้านดอลลาร์"
"bad_teeth_per_child_12_yr","จำนวนฟันผุต่อเด็กหนึ่งคน"
"battle_deaths_per_100_000","ผู้เสียชีวิตจากสงคราม"
"biomass_stock_in_forest_tons","ปริมาณชีวมวลในป่าไม้"
"birth_asphyxia_deaths_in_newborn_per_1000_births","จำนวนเด็กทารกแรกเกิดที่เสียชีวิตจากภาวะขาดออกซิเจน (ต่อการเกิด 1,000 ราย)"
"birth_asphyxia_deaths_in_newborn_total_deaths","จำนวนเด็กทารกแรกเกิดที่เสียชีวิตจากภาวะขาดออกซิเจน (ทั้งหมด)"
"births_attended_by_skilled_health_staff_percent_of_total","การเกิดโดยบุคลากรทางการแพทย์ผู้เชี่ยวชาญ"
"blood_pressure_sbp_men_mmhg","ความดันโลหิตในผู้ชาย"
"blood_pressure_sbp_women_mmhg","ความดันโลหิตในผู้หญิง"
"body_mass_index_bmi_men_kgperm2","ดัชนีมวลกายในผู้ชาย"
"body_mass_index_bmi_women_kgperm2","ดัชนีมวลกายในผู้หญิง"
"breast_cancer_deaths_per_100000_women","จำนวนผู้เสียชีวิตจากมะเร็งเต้านมต่อผู้หญิง 100,000 คน"
"breast_cancer_new_cases_per_100000_women","จำนวนผู้ป่วยมะเร็งเต้านมรายใหม่ต่อผู้หญิง 100,000 คน"
"breast_cancer_number_of_female_deaths","จำนวนผู้เสียชีวิตจากมะเร็งเต้านม"
"breast_cancer_number_of_new_female_cases","จำนวนผู้ป่วยมะเร็งเต้านมรายใหม่"
"broadband_subscribers","ผู้ใช้บริการอินเทอร์เน็ตไร้สาย"
"broadband_subscribers_per_100_people","ผู้ใช้บริการอินเทอร์เน็ตไร้สาย (ต่อประชากร 100 คน)"
"burns_deaths_per_100000_people","ผู้เสียชีวิตจากไฟไหม้ (ต่อประชากร 100,000 คน)"
"car_deaths_per_100000_people","ผู้เสียชีวิตจากรถยนต์ (ต่อประชากร 100,000 คน)"
"cars_trucks_and_buses_per_1000_persons","รถยนต์ รถบรรทุก และรถโดยสารต่อประชากร 1000 คน"
"cell_phones_per_100_people","จำนวนโทรศัพท์เคลื่อนที่ (ต่อ 100 คน)"
"cell_phones_total","จำนวนโทรศัพท์เคลื่อนที่"
"central_bank_discount_rate_annual_percent","อัตราส่วนลดของธนาคารกลาง"
"cervical_cancer_deaths_per_100000_women","จำนวนผู้หญิงที่เสียชีวิตจากมะเร็งปากมดลูกต่อผู้หญิง 100,000 คน"
"cervical_cancer_new_cases_per_100000_women","จำนวนผู้หญิงที่เป็นผู้ป่วยมะเร็งปากมดลูกรายใหม่ต่อผู้หญิง 100,000 คน"
"cervical_cancer_number_of_female_deaths","จำนวนผู้หญิงที่เสียชีวิตจากมะเร็งปากมดลูก"
"cervical_cancer_number_of_new_female_cases","จำนวนผู้หญิงที่เป็นผู้ป่วยมะเร็งปากมดลูกรายใหม่"
"child_mortality_0_5_year_olds_dying_per_1000_born","อัตราตายของเด็ก"
"child_mortality_0_5_year_olds_more_years_version_7","อัตราการตายของเด็ก จำนวนปีมากขึ้น เวอร์ชัน 7"
"children_and_elderly_per_100_adults","จำนวนเด็กและผู้สูงอายุต่อผู้ใหญ่ 100 คน"
"children_out_of_school_primary","จำนวนเด็กที่ออกจากโรงเรียน"
"children_out_of_school_primary_female","จำนวนเด็กหญิงที่ออกจากโรงเรียน"
"children_out_of_school_primary_male","จำนวนเด็กชายที่ออกจากโรงเรียน"
"children_per_woman_total_fertility","จำนวนเด็กต่อผู้หญิงหนึ่งคน"
"children_per_woman_total_fertility_with_projections","จำนวนเด็กต่อผู้หญิงหนึ่งคน พร้อมการคาดการณ์"
"cholesterol_fat_in_blood_men_mmolperl","ไขมันในเลือด ผู้ชาย"
"cholesterol_fat_in_blood_women_mmolperl","ไขมันในเลือด ผู้หญิง"
"co2_emissions_tonnes_per_person","การปล่อยแก๊สคาร์บอนไดออกไซด์"
"co2_intensity_of_economic_output_kg_co2_per_2011_ppp_of_gdp","ปริมาณแก๊สคาร์บอนไดออกไซด์ต่อผลผลิตทางเศรษฐกิจ"
"coal_consumption_per_cap","การใช้ถ่านหินต่อคน"
"coal_consumption_total","การใช้ถ่านหินรวม"
"colonandrectum_cancer_deaths_per_100000_men","จำนวนผู้ชายที่เสียชีวิตจากมะเร็งลำไส้ใหญ่ (ต่อประชากรชาย 100,000 คน)"
"colonandrectum_cancer_deaths_per_100000_women","จำนวนผู้หญิงที่เสียชีวิตจากมะเร็งลำไส้ใหญ่ (ต่อประชากรหญิง 100,000 คน)"
"colonandrectum_cancer_new_cases_per_100000_men","จำนวนผู้ชายที่เป็นผู้ป่วยมะเร็งลำไส้ใหญ่รายใหม่ต่อผู้ชาย 100,000 คน"
"colonandrectum_cancer_new_cases_per_100000_women","จำนวนผู้หญิงที่เป็นผู้ป่วยมะเร็งลำไส้ใหญ่รายใหม่ต่อผู้หญิง 100,000 คน"
"colonandrectum_cancer_number_of_female_deaths","จำนวนผู้หญิงที่เสียชีวิตจากมะเร็งลำไส้ใหญ่"
"colonandrectum_cancer_number_of_male_deaths","จำนวนผู้ชายที่เสียชีวิตจากมะเร็งลำไส้ใหญ่"
"colonandrectum_cancer_number_of_new_female_cases","จำนวนผู้หญิงที่เป็นผู้ป่วยมะเร็งลำไส้ใหญ่รายใหม่"
"colonandrectum_cancer_number_of_new_male_cases","จำนวนผู้ชายที่เป็นผู้ป่วยมะเร็งลำไส้ใหญ่รายใหม่"
"color",""
"congenital_deaths_in_newborn_per_1000_births","จำนวนเด็กทารกแรกเกิดที่เสียชีวิตจากโรคพิการแต่กำเนิด (ต่อการเกิด 1,000 ราย)"
"congenital_deaths_in_newborn_total_deaths","จำนวนเด็กทารกแรกเกิดที่เสียชีวิตจากโรคพิการแต่กำเนิด"
"contraceptive_use_percent_of_women_ages_15_49","การคุมกำเนิด"
"corruption_perception_index_cpi","ดัชนีการรับรู้การทุจริต"
"corruption_perception_index_cpi_pre2012","ดัชนีการรับรู้การทุจริต (ใช้วิธีก่อนปี 2012 ในการคำนวณ)"
"country",""
"crude_birth_rate_births_per_1000_population","อัตราตายอย่างหยาบ"
"crude_death_rate_deaths_per_1000_population","อัตราตายอย่างหยาบ"
"cumulative_co2_emissions_tonnes","การปล่อยแก๊สคาร์บอนไดออกไซด์สะสม"
"data_method_maternal_mortality","วิธีการหาข้อมูล - อัตราตายของมารดา"
"data_quality_children_per_woman","จำนวนเด็กต่อผู้หญิงหนึ่งคน"
"data_quality_income_per_person","รายได้ต่อคน"
"data_quality_life_expectancy","อายุเฉลี่ย"
"data_quality_population","ประชากร"
"dead_kids_per_woman","จำนวนเด็กที่เสียชีวิตต่อผู้หญิงหนึ่งคน"
"debt_servicing_costs_percent_of_exports_and_net_income_from_abroad","ต้นทุนจากภาระหนี้สิน"
"debt_to_foreigners_by_public_and_private_percent_of_gni","หนี้กับต่างประเทศ"
"democracy_score_use_as_color","คะแนนประชาธิปไตย"
"desalinated_water_produced_billion_cu_meters","น้ำจืดที่ผลิตจากน้ำทะเล"
"description",""
"description_long",""
"diarrhoeal_deaths_in_children_1_59_months_per_1000_births","เด็กที่เสียชีวิตจากโรคอุจจาระร่วง (ต่อการเกิด 1,000 ราย)"
"diarrhoeal_deaths_in_children_1_59_months_total_deaths","เด็กที่เสียชีวิตจากโรคอุจจาระร่วง"
"diarrhoeal_deaths_in_newborn_per_1000_births","เด็กที่เสียชีวิตจากโรคอุจจาระร่วง (ต่อการเกิด 1,000 ราย)"
"diarrhoeal_deaths_in_newborn_total_deaths","เด็กที่เสียชีวิตจากโรคอุจจาระร่วง"
"dollar_billionaires_per_million_people","จำนวนผู้ที่มีทรัพย์สินมากกว่าหนึ่งพันล้านดอลลาร์ต่อประชากรหนึ่งล้านคน"
"domain",""
"drill_up",""
"drought_affected_annual_number","ผู้ได้รับผลกระทบจากภัยแล้ง"
"drought_deaths_annual_number","ผู้เสียชีวิตจากภัยแล้ง"
"drownings_per_100000_people","ผู้เสียชีวิตจากจมน้ำ (ต่อประชากร 100,000 คน)"
"dtp3_immunized_percent_of_one_year_olds","ผู้ได้รับวัคซีนคอตีบ-บาดทะยัก-ไอกรนเข็มที่ 3"
"earthquake_affected_annual_number","ผู้ได้รับผลกระทบจากแผ่นดินไหว"
"earthquake_deaths_annual_number","ผู้เสียชีวิตจากแผ่นดินไหว"
"economic_growth_over_the_past_10_years","การเจริญเติบโตทางเศรษฐกิจในช่วง 10 ปีที่ผ่านมา"
"economical_infrastructure_aid_given_percent_of_aid","ความช่วยเหลือด้านโครงสร้างพื้นฐานทางเศรษฐกิจที่ให้"
"education_aid_given_percent_of_aid","ความช่วยเหลือด้านการศึกษาที่ให้"
"electricity_generation_per_person","การผลิตไฟฟ้าต่อคน"
"electricity_generation_total","การผลิตไฟฟ้า"
"electricity_use_per_person","การใช้ไฟฟ้าต่อคน"
"energy_from_solid_biofuels_percent","พลังงานจากเชื้อเพลิงชีวภาพแข็ง (ร้อยละ)"
"energy_production_per_person","การผลิตพลังงานต่อคน"
"energy_production_total","การผลิตพลังงานรวม"
"energy_supply_per_person_toe","อุปทานของพลังงานต่อคน"
"energy_use_per_person","การใช้พลังงานต่อคน"
"epidemic_affected_annual_number","ผู้ติดเชื้อโรคระบาด"
"epidemic_deaths_annual_number","ผู้เสียชีวิตจากโรคระบาด"
"expenditure_per_student_primary_percent_of_gdp_per_person","ค่าใช้จ่ายต่อนักเรียนประถมหนึ่งคน"
"expenditure_per_student_secondary_percent_of_gdp_per_person","ค่าใช้จ่ายต่อนักเรียนมัธยมหนึ่งคน"
"expenditure_per_student_tertiary_percent_of_gdp_per_person","ค่าใช้จ่ายต่อนักศึกษาอุดมศึกษาหนึ่งคน"
"exports_percent_of_gdp","การส่งออก (ร้อยละของผลิตภัณฑ์ในประเทศ)"
"exports_unit_value_index_2000100","มูลค่าการส่งออกต่อหน่วย"
"external_debt_total_us_not_inflation_adjusted","หนี้ต่างประเทศทั้งหมด"
"extreme_poverty_percent_people_below_190_a_day","ความยากจนข้นแค้น"
"extreme_temperature_affected_annual_number","ผู้ได้รับผลกระทบจากอุณหภูมิที่สูงหรือต่ำผิดปกติ"
"extreme_temperature_deaths_annual_number","ผู้เสียชีวิตจากอุณหภูมิที่สูงหรือต่ำผิดปกติ"
"falls_deaths_per_100000_people","ผู้เสียชีวิตจากการตกจากที่สูง"
"family_workers_percent_of_labour_force","แรงงานครอบครัว"
"female_agriculture_workers_percent_of_female_labour_force","เกษตรกรหญิง"
"female_family_workers_percent_of_female_labour_force","แรงงานครอบครัวหญิง"
"female_industry_workers_percent_of_female_labour_force","แรงงานอุตสาหกรรมหญิง"
"female_long_term_unemployment_rate_percent","อัตราการว่างงานในระยะยาวของผู้หญิง"
"female_population_with_projections","ประชากรหญิง และการคาดการณ์"
"female_salaried_workers_percent_of_female_labour_force","แรงงานหญิงที่ได้รับค่าจ้าง"
"female_self_employed_percent_of_female_labour_force","ผู้หญิงที่มีกิจการส่วนตัว"
"female_service_workers_percent_of_female_labour_force","แรงงานบริการหญิง"
"females_aged_15_24_employment_rate_percent","ผู้หญิงอายุ 15-24 ปี"
"females_aged_15_24_unemployment_rate_percent","ผู้หญิงอายุ 15-24 ปี"
"females_aged_15_64_labour_force_participation_rate_percent","ผู้หญิงอายุ 15-64 ปี"
"females_aged_15plus_employment_rate_percent","ผู้หญิงอายุ 15 ปีขึ้นไป"
"females_aged_15plus_labour_force_participation_rate_percent","ผู้หญิงอายุ 15 ปีขึ้นไป"
"females_aged_15plus_unemployment_rate_percent","ผู้หญิงอายุ 15 ปีขึ้นไป"
"females_aged_25_54_labour_force_participation_rate_percent","ผู้หญิงอายุ 25-54 ปี"
"females_aged_25_54_unemployment_rate_percent","ผู้หญิงอายุ 25-54 ปี"
"females_aged_55plus_unemployment_rate_percent","ผู้หญิงอายุ 55 ปีขึ้นไป"
"females_aged_65plus_labour_force_participation_rate_percent","ผู้หญิงอายุ 65 ปีขึ้นไป"
"fixed_line_subscribers_per_100_people","ผู้ใช้บริการอินเทอร์เน็ตแบบเดินสาย (ต่อประชากร 100 คน)"
"flood_affected_annual_number","ผู้ได้รับผลกระทบจากอุทกภัย"
"flood_deaths_annual_number","ผู้เสียชีวิตจากอุทกภัย"
"food_supply_kilocalories_per_person_and_day","อุปทานอาหาร"
"foreign_direct_investment_net_inflows_percent_of_gdp","กระแสเงินลงทุนโดยตรงจากต่างประเทศที่ไหลเข้า"
"foreign_direct_investment_net_outflows_percent_of_gdp","กระแสเงินลงทุนโดยตรงจากต่างประเทศที่ไหลออก"
"forest_area_sq_km","พื้นที่ป่าไม้"
"forest_coverage_percent","เนื้อที่ป่า"
"forest_land_total_area_ha","พื้นที่ป่าทั้งหมด"
"forest_products_removal_per_ha_dollar","มูลค่าผลิตภัณฑ์จากป่าไม้ต่อเฮกตาร์"
"forest_products_removal_total_dollar","มูลค่าผลิตภัณฑ์จากป่าไม้ทั้งหมด"
"g77_and_oecd_countries",""
"gapminder_gini","ดัชนีความไม่เท่าเทียมทางเศรษฐกิจ (จีนี)"
"gapminder_list",""
"gdp_per_capita_yearly_growth","การเพิ่มขึ้นรายปีของผลิตภัณฑ์ในประเทศต่อหัว"
